key,0,1
208,TEXT_AKTKMA102_04358_OJIKATSUNJIKA_000_352,我已经读过了关于优雷卡的事件报告。<hex:02100103>没想到瓦尔岛会变成那样……<hex:02100103>要是有机会的话请你继续对优雷卡展开调查吧。
209,TEXT_AKTKMA102_04358_KRILE_000_353,他叫欧吉卡·岑吉卡……<hex:02100103>在巴尔德西昂委员会担任事务员，负责管理这座分馆。
210,TEXT_AKTKMA102_04358_OJIKATSUNJIKA_000_354,能见到可露儿以及古·拉哈报告中提到的艾欧泽亚英雄，<hex:02100103>真是倍感光荣啊。<hex:02100103>请你多多指教。
211,TEXT_AKTKMA102_04358_KRILE_000_355,巴尔德西昂委员会曾将总部设在瓦尔岛。<hex:02100103>不过我们来旧萨雷安的机会很多。
212,TEXT_AKTKMA102_04358_KRILE_000_356,比如利用这里的设施展开调查、参加学会、<hex:02100103>乘坐飞空艇或船只前往国外这些情况。
213,TEXT_AKTKMA102_04358_KRILE_000_357,这座巴尔德西昂分馆就是为我们临时歇脚建造的。
214,TEXT_AKTKMA102_04358_OJIKATSUNJIKA_000_358,如今瓦尔岛成为禁地，总部不能贸然接近，<hex:02100103>于是这里成了我们的新据点……
215,TEXT_AKTKMA102_04358_OJIKATSUNJIKA_000_359,巴尔德西昂委员会损失了很多成员，<hex:02100103>目前无法充分地开展活动。<hex:02100103>就连这座分馆也空荡荡的，让人悲从中来……
216,TEXT_AKTKMA102_04358_OJIKATSUNJIKA_000_360,如今总部连同瓦尔岛一同消失了，<hex:02100103>这里也就成为了我们唯一的据点……
217,TEXT_AKTKMA102_04358_OJIKATSUNJIKA_000_361,巴尔德西昂委员会损失了很多成员，<hex:02100103>目前无法充分地开展活动。<hex:02100103>就连这座分馆也空荡荡的，让人悲从中来……
218,TEXT_AKTKMA102_04358_KRILE_000_362,总有一天……我们会重建巴尔德西昂委员会。
219,TEXT_AKTKMA102_04358_KRILE_000_363,为此要先击溃终末使徒的阴谋……对吧！
220,TEXT_AKTKMA102_04358_KRILE_000_364,穿过左边的门是正厅，<hex:02100103>我们就在那里商量今后的计划。
221,TEXT_AKTKMA102_04358_KRILE_000_365,集合时间还没到……<hex:02100103>你可以先去休息一会再来正厅。
222,TEXT_AKTKMA102_04358_KRILE_000_366,我已经为拂晓的各位准备了房间，<hex:02100103>在旧萨雷安期间请随意使用！
223,TEXT_AKTKMA102_04358_GRAHATIA_000_367,休息室啊……真让人怀念……
224,TEXT_AKTKMA102_04358_GRAHATIA_000_368,啊，不用担心，这可是正经的房间哦？<hex:02100103>保证比外面的那些廉价旅店好多了。
225,TEXT_AKTKMA102_04358_GRAHATIA_000_369,来这里的大多是忙于研究或从国外调查回来的人……<hex:02100103>他们经常说完“我去小憩一会”就进屋了。
226,TEXT_AKTKMA102_04358_GRAHATIA_000_370,这些房间也因此得名休息室。<hex:02100103>不过说是休息，但基本上他们都会睡得死死的呢！
227,TEXT_AKTKMA102_04358_OJIKATSUNJIKA_000_371,要想去休息室的时候就跟我说一声，<hex:02100103>我会带你过去。
228,TEXT_AKTKMA102_04358_KRILE_000_372,那我就在正厅等着了。<hex:02100103>做好准备以后就过来吧。
229,TEXT_AKTKMA102_04358_GRAHATIA_000_380,休息室里是不是有很多贴纸？<hex:02100103>以前的房客经常会把研究相关的消息或笔记贴在墙上，<hex:02100103>然后就那么拍屁股走人了……
230,TEXT_AKTKMA102_04358_GRAHATIA_000_381,有时墙上也会贴着对其他使用者的抱怨，<hex:02100103>还有对留下有趣书籍之人的感谢什么的……
231,TEXT_AKTKMA102_04358_GRAHATIA_000_382,如今有点触目伤怀呢。<hex:02100103>我们得为巴尔德西昂委员会的未来想想办法了……
232,TEXT_AKTKMA102_04358_KRILE_000_390,你来了啊。<hex:02100103>大家也差不多该到了，<hex:02100103>你先在这里等一会吧。
