key,0,1
#,,
offset,0,4
Int32,String,String
0,TEXT_AKTKMA102_04358_SEQ_00,知识神海港的可露儿正在观望着同伴们的情况。
1,TEXT_AKTKMA102_04358_SEQ_01,
2,TEXT_AKTKMA102_04358_SEQ_02,
3,TEXT_AKTKMA102_04358_SEQ_03,
4,TEXT_AKTKMA102_04358_SEQ_04,
5,TEXT_AKTKMA102_04358_SEQ_05,
6,TEXT_AKTKMA102_04358_SEQ_06,
7,TEXT_AKTKMA102_04358_SEQ_07,
8,TEXT_AKTKMA102_04358_SEQ_08,
9,TEXT_AKTKMA102_04358_SEQ_09,
10,TEXT_AKTKMA102_04358_SEQ_10,
11,TEXT_AKTKMA102_04358_SEQ_11,
12,TEXT_AKTKMA102_04358_SEQ_12,
13,TEXT_AKTKMA102_04358_SEQ_13,
14,TEXT_AKTKMA102_04358_SEQ_14,
15,TEXT_AKTKMA102_04358_SEQ_15,
16,TEXT_AKTKMA102_04358_SEQ_16,
17,TEXT_AKTKMA102_04358_SEQ_17,
18,TEXT_AKTKMA102_04358_SEQ_18,
19,TEXT_AKTKMA102_04358_SEQ_19,
20,TEXT_AKTKMA102_04358_SEQ_20,
21,TEXT_AKTKMA102_04358_SEQ_21,
22,TEXT_AKTKMA102_04358_SEQ_22,
23,TEXT_AKTKMA102_04358_SEQ_23,
24,TEXT_AKTKMA102_04358_TODO_00,和古·拉哈·提亚对话进入同行状态
25,TEXT_AKTKMA102_04358_TODO_01,带着古·拉哈·提亚和可露儿对话进入同行状态
26,TEXT_AKTKMA102_04358_TODO_02,带着两位同行者前往背水咖啡厅<hex:02100103>和指定地点的可露儿对话
27,TEXT_AKTKMA102_04358_TODO_03,带着两位同行者前往以太之光广场<hex:02100103>和指定地点的可露儿对话
28,TEXT_AKTKMA102_04358_TODO_04,带着两位同行者前往露天集市<hex:02100103>和指定地点的可露儿对话
29,TEXT_AKTKMA102_04358_TODO_05,带着两位同行者前往哲学家广场前<hex:02100103>和指定地点的可露儿对话
30,TEXT_AKTKMA102_04358_TODO_06,带着两位同行者前往漂流的终点<hex:02100103>和指定地点的可露儿对话
31,TEXT_AKTKMA102_04358_TODO_07,带着两位同行者前往巴尔德西昂分馆前<hex:02100103>和指定地点的可露儿对话
32,TEXT_AKTKMA102_04358_TODO_08,和正厅的可露儿对话
33,TEXT_AKTKMA102_04358_TODO_09,
34,TEXT_AKTKMA102_04358_TODO_10,
35,TEXT_AKTKMA102_04358_TODO_11,
36,TEXT_AKTKMA102_04358_TODO_12,
37,TEXT_AKTKMA102_04358_TODO_13,
38,TEXT_AKTKMA102_04358_TODO_14,
39,TEXT_AKTKMA102_04358_TODO_15,
40,TEXT_AKTKMA102_04358_TODO_16,
41,TEXT_AKTKMA102_04358_TODO_17,
42,TEXT_AKTKMA102_04358_TODO_18,
43,TEXT_AKTKMA102_04358_TODO_19,
44,TEXT_AKTKMA102_04358_TODO_20,
45,TEXT_AKTKMA102_04358_TODO_21,
46,TEXT_AKTKMA102_04358_TODO_22,
47,TEXT_AKTKMA102_04358_TODO_23,
48,TEXT_AKTKMA102_04358_ALPHINAUD_000_000,没事的，我没把官吏的话放在心上。<hex:02100103>对方只是给了个忠告，反倒让我松了一口气。
49,TEXT_AKTKMA102_04358_ALISAIE_000_005,既然已经来到了萨雷安，<hex:02100103>那就重新打起精神，去做我们该做的事情吧。
50,TEXT_AKTKMA102_04358_THANCRED_000_010,因为之前去了第一世界，<hex:02100103>这边应该没有经过多少时间……<hex:02100103>不过这座城市还真是没有任何变化啊。
51,TEXT_AKTKMA102_04358_URIANGER_000_015,那我作为本地人……<hex:02100103>欢迎<hex:022903EB0203>你来到我们的祖国知识之都萨雷安。
52,TEXT_AKTKMA102_04358_YSHTOLA_000_020,身为冒险者，你很想赶快探索这个城市吧？<hex:02100103>不用担心，在我们商量计划的时候，<hex:02100103>旧萨雷安的景点是不会消失的。
53,TEXT_AKTKMA102_04358_GRAHATIA_000_025,终于到了旧萨雷安！<hex:02100103>你不觉得这里跟水晶都有点相像吗？<hex:02100103>其实呢……
54,TEXT_AKTKMA102_04358_GRAHATIA_000_026,啊、还是先去听听可露儿要说什么吧。<hex:02100103>等以后有时间的话再接着聊！
55,TEXT_AKTKMA102_04358_ESTINIEN_000_030,因为不让报拂晓血盟的名号，<hex:02100103>我一时间没想到合适的说法。<hex:02100103>反正我又不偷不抢的，管那么多干嘛。
56,TEXT_AKTKMA102_04358_KRILE_000_040,接下来我想跟各位详细讲一下目前我所掌握的情报，<hex:02100103>以及今后需要你们协助调查的事情……
57,TEXT_AKTKMA102_04358_KRILE_000_041,不过<hex:022903EB0203>和埃斯蒂尼安先生是初来乍到……<hex:02100103>其他人则是久别归乡。
58,TEXT_AKTKMA102_04358_KRILE_000_042,我想你们应该有想去的地方和想见的人，<hex:02100103>所以我打算先请各位自由活动，<hex:02100103>顺便缓解一下旅途的疲劳。
59,TEXT_AKTKMA102_04358_KRILE_000_043,等处理完各自的事情以后，<hex:02100103>就在我们巴尔德西昂委员会的支部……<hex:02100103>巴尔德西昂分馆集合，你们看怎么样？
60,TEXT_AKTKMA102_04358_ALPHINAUD_000_044,那真是太好了。<hex:02100103>虽然现在很难再跨进家门，<hex:02100103>不过至少应该可以托人询问一下家里的情况。
61,TEXT_AKTKMA102_04358_YSHTOLA_000_045,我的族人早就各自独立了，<hex:02100103>所以我也算是无家可归……
62,TEXT_AKTKMA102_04358_YSHTOLA_000_046,承蒙可露儿的好意，<hex:02100103>我去看看这座城市现在的样子吧。
63,TEXT_AKTKMA102_04358_THANCRED_000_047,说的也对。<hex:02100103>去看望一下以前的发小，<hex:02100103>没准还能收获些有用的情报。
64,TEXT_AKTKMA102_04358_THANCRED_000_048,我记得巴尔德西昂分馆在以太之光广场的西边。<hex:02100103>那我之后去那里找你们。
65,TEXT_AKTKMA102_04358_KRILE_000_049,嗯，在那见吧！
66,TEXT_AKTKMA102_04358_URIANGER_000_050,我也有一个要去的地方。<hex:02100103>稍后再见吧……
67,TEXT_AKTKMA102_04358_KRILE_000_051,你和埃斯蒂尼安先生有什么打算吗？<hex:02100103>要是没头绪的话，我想带你们逛逛这座城市……
68,TEXT_AKTKMA102_04358_ESTINIEN_000_052,我还是算了吧。<hex:02100103>反正已经知道了集合地点，<hex:02100103>之后我想一个人随便转转。
69,TEXT_AKTKMA102_04358_KRILE_000_053,啊、等一下？！
70,TEXT_AKTKMA102_04358_KRILE_000_054,那拉哈能陪陪我们吗？<hex:02100103>对你来说这也算是久违的萨雷安之行，<hex:02100103>顺带还能回忆往事……你看怎么样？
71,TEXT_AKTKMA102_04358_GRAHATIA_000_055,当、当然没问题，<hex:02100103>我乐意奉陪！
72,TEXT_AKTKMA102_04358_GRAHATIA_000_056,<hex:022903EB0203>！<hex:02100103>那我们就开始旧萨雷安的探索吧！
73,TEXT_AKTKMA102_04358_KRILE_000_060,呵呵，拉哈真是的，像个小孩子一样！
74,TEXT_AKTKMA102_04358_GRAHATIA_000_070,那就出发吧！<hex:02100103>只要是你想去想看的地方，<hex:02100103>我都会跟着你去！
75,TEXT_AKTKMA102_04358_SYSTEM_000_071,古·拉哈·提亚开始跟随在你的后面。
76,TEXT_AKTKMA102_04358_SYSTEM_000_072,在执行任务时，需要同行者处于附近位置。
77,TEXT_AKTKMA102_04358_SYSTEM_000_073,当处于同一区域时，即使使用都市传送网，<hex:02100103>也不会与同行者走散。
78,TEXT_AKTKMA102_04358_SYSTEM_000_074,切换至其他区域或和同行者对话选择“解除同行状态”，<hex:02100103>都将会解除同行的状态。
79,TEXT_AKTKMA102_04358_SYSTEM_000_075,同行状态解除后，<hex:02100103>只要和回到了起点的同行者对话，就能再次进入同行状态。
80,TEXT_AKTKMA102_04358_SYSTEM_000_076,接下来与古·拉哈·提亚在同行状态下，<hex:02100103>和可露儿谈谈吧！
81,TEXT_AKTKMA102_04358_Q1_000_080,要做什么？
82,TEXT_AKTKMA102_04358_A1_000_081,对话
83,TEXT_AKTKMA102_04358_A1_000_082,解除同行状态
84,TEXT_AKTKMA102_04358_A1_000_083,取消
85,TEXT_AKTKMA102_04358_GRAHATIA_000_085,叫上可露儿一起出发吧！
86,TEXT_AKTKMA102_04358_Q2_000_090,确定要解除同行状态吗？
87,TEXT_AKTKMA102_04358_GRAHATIA_000_091,是有什么急事吗？<hex:02100103>那我在知识神海港那里等着你，<hex:02100103>到时候过来跟我说一声就行。
88,TEXT_AKTKMA102_04358_GRAHATIA_000_095,<hex:022903EB0203>！<hex:02100103>我们继续探索旧萨雷安吧！
89,TEXT_AKTKMA102_04358_SYSTEM_000_100,同行者还没过来。<hex:02100103>迎接并带他们来到附近吧。
90,TEXT_AKTKMA102_04358_KRILE_000_108,在邀请我之前，先去邀请拉哈同行吧。<hex:02100103>他正用星星眼看着你呢！
91,TEXT_AKTKMA102_04358_SYSTEM_000_108,在执行该任务时，需要与古·拉哈·提亚保持同行状态。<hex:02100103>此外，古·拉哈·提亚应位于玩家附近。
92,TEXT_AKTKMA102_04358_KRILE_000_110,你和拉哈都准备好了吧？<hex:02100103>那就出发吧。
93,TEXT_AKTKMA102_04358_KRILE_000_111,我们首先去看看位于这个港口西侧的背水咖啡厅吧！
94,TEXT_AKTKMA102_04358_SYSTEM_000_112,可露儿也开始与你们同行！<hex:02100103>带着两人前往背水咖啡厅，<hex:02100103>在指定地点和可露儿谈谈吧。
95,TEXT_AKTKMA102_04358_SYSTEM_000_113,此外，有同行者跟随时，<hex:02100103>在抵达目的地的沿途<hex:02100103>有时存在可以进行特殊对话的交谈点。
96,TEXT_AKTKMA102_04358_SYSTEM_000_114,在交谈点的范围与同行者对话，<hex:02100103>可能会追加新的相关话题。<hex:02100103>和同伴们一起享受探索的乐趣吧！
97,TEXT_AKTKMA102_04358_A3_000_120,<hex:024804F2022403>关于储藏库<hex:0248020103>
98,TEXT_AKTKMA102_04358_A3_000_121,<hex:024804F2022403>关于巨大的石像<hex:0248020103>
99,TEXT_AKTKMA102_04358_GRAHATIA_000_125,我想在可露儿的陪同下重游故地。<hex:02100103>能和你一起带着新鲜感逛街，<hex:02100103>这种久别回乡也挺不错的。
100,TEXT_AKTKMA102_04358_GRAHATIA_000_126,这里就是背水咖啡厅了。<hex:02100103>能闻见一股好香的味道！
101,TEXT_AKTKMA102_04358_GRAHATIA_000_127,咦……可露儿呢？<hex:02100103>要是和我们走散了，<hex:02100103>她应该会回到知识神海港吧。
102,TEXT_AKTKMA102_04358_KRILE_000_130,我们去港口西侧的背水咖啡厅吧！<hex:02100103>那里可是这座城市最为重要的地方呢。
103,TEXT_AKTKMA102_04358_KRILE_000_131,我说……拉哈好像没跟过来哦。<hex:02100103>要是不管他，他该生闷气了……<hex:02100103>我们去知识神海港接他吧。
104,TEXT_AKTKMA102_04358_GRAHATIA_000_135,摆了好多东西啊……<hex:02100103>那说不定有适合冒险者的委托吧？
105,TEXT_AKTKMA102_04358_GRAHATIA_000_136,反正你也通过了入国审查，<hex:02100103>如果找到了感兴趣的委托就去试试吧。
106,TEXT_AKTKMA102_04358_GRAHATIA_000_137,没准以后你的大名也会轰动整个旧萨雷安呢！
107,TEXT_AKTKMA102_04358_KRILE_000_140,这里是列柱廊。<hex:02100103>从船上卸下来的货物都会临时搬运到这里。
108,TEXT_AKTKMA102_04358_KRILE_000_141,除了生活必需品和贸易商品，<hex:02100103>还有大量书籍和试验材料被运到这里……<hex:02100103>所以负责分货的人总是忙得团团转。
109,TEXT_AKTKMA102_04358_GRAHATIA_000_145,那边能看见的就是让人过目难忘的知识神像。
110,TEXT_AKTKMA102_04358_GRAHATIA_000_146,巴尔德西昂委员会的总部在瓦尔岛，<hex:02100103>我以前都待在那边……<hex:02100103>每次来这里时都会看到那座巨像。
111,TEXT_AKTKMA102_04358_KRILE_000_150,从这里通向海洋的大道名为才流柱廊。<hex:02100103>尽头矗立着萨雷安的守护神沙利亚克的神像。
112,TEXT_AKTKMA102_04358_KRILE_000_151,对于萨雷安人来说，<hex:02100103>成为聚集知识之人的信念比信仰更为重要……<hex:02100103>所以他们才供奉司掌知识的沙利亚克。
113,TEXT_AKTKMA102_04358_KRILE_000_152,虽然建造了那么气派的神像，<hex:02100103>但相对于伊修加德严格信仰战神哈罗妮，<hex:02100103>萨雷安更为自由，有不少人信奉其他守护神！
114,TEXT_AKTKMA102_04358_KRILE_000_155,知道啦，一会儿你再到知识神海港找我吧！<hex:02100103>我会继续带你游览萨雷安的！
115,TEXT_AKTKMA102_04358_KRILE_000_160,我还有想带你去的地方呢，<hex:02100103>快点出发吧！
116,TEXT_AKTKMA102_04358_KRILE_000_168,这里是背水咖啡厅……
117,TEXT_AKTKMA102_04358_SYSTEM_000_169,在执行该任务时，需要与古·拉哈·提亚保持同行状态。<hex:02100103>此外，古·拉哈·提亚应位于玩家附近。
118,TEXT_AKTKMA102_04358_KRILE_000_170,我们到了，这里就是背水咖啡厅。
119,TEXT_AKTKMA102_04358_KRILE_000_171,我以前应该跟你说过……<hex:02100103>虽然萨雷安热衷于研究营养学和烹饪技法，<hex:02100103>但对食物的味道却不太讲究……
120,TEXT_AKTKMA102_04358_KRILE_000_172,直白点说就是这里的饭菜基本都很难吃。<hex:02100103>像是贤人面包那样只要能摄取营养就行的思考方式<hex:02100103>在这里绝对是占主流的。
121,TEXT_AKTKMA102_04358_KRILE_000_173,魔法大学的某位学生对难以下咽的食堂菜品忍无可忍，<hex:02100103>于是中途退学开了餐馆。
122,TEXT_AKTKMA102_04358_KRILE_000_174,他开的就是这家背水咖啡厅。<hex:02100103>正如其名，这里也是萨雷安饮食文化最后的防线。
123,TEXT_AKTKMA102_04358_GRAHATIA_000_175,我记得……他家的招牌是汉堡，堪称一绝。<hex:02100103>虽然我没吃过，<hex:02100103>不过关于它的传闻倒是记忆犹新……
124,TEXT_AKTKMA102_04358_KRILE_000_176,拉哈曾经也觉得“简单廉价能吃”就行吧。<hex:02100103>如今在塔塔露的手艺下想必味觉进化了不少，<hex:02100103>等事情告一段落后一定要来尝尝哦，记得叫上大家！
125,TEXT_AKTKMA102_04358_KRILE_000_177,那我们去下一个地方吧。<hex:02100103>从店铺旁边的阶梯上去，<hex:02100103>朝着以太之光广场出发吧！
126,TEXT_AKTKMA102_04358_GRAHATIA_000_180,巴尔德西昂委员会以前总把调查员派往世界各地，<hex:02100103>研究费一直非常紧张。<hex:02100103>而我个人也有想要购买的书籍……
127,TEXT_AKTKMA102_04358_GRAHATIA_000_181,所以我只好舍弃了对美食的追求！<hex:02100103>后来经历了各种时代，<hex:02100103>我切身体会到能吃饱饭是何等幸福。
128,TEXT_AKTKMA102_04358_GRAHATIA_000_182,咦？以太之光好像跟以前不一样了呢……
129,TEXT_AKTKMA102_04358_KRILE_000_185,我们去以太之光广场吧！<hex:02100103>从背水咖啡厅旁边的阶梯上去就是了！
130,TEXT_AKTKMA102_04358_KRILE_000_189,以太之光广场到了……但拉哈人呢？
131,TEXT_AKTKMA102_04358_KRILE_000_190,这里就是以太之光广场！
132,TEXT_AKTKMA102_04358_KRILE_000_191,我想你应该还是第一次看到这种形状的以太之光吧，<hex:02100103>可别忘记共鸣哦！
133,TEXT_AKTKMA102_04358_KRILE_000_192,萨雷安在传送魔法的研究领域非常先进，<hex:02100103>其中比较有代表性的就是以太之光的制作。
134,TEXT_AKTKMA102_04358_KRILE_000_193,附设在这座广场的传送魔法研究所非常有名哦。<hex:02100103>因为它成功地解明了亚拉戈时代的以太之光机制，<hex:02100103>令其在现代重生。
135,TEXT_AKTKMA102_04358_KRILE_000_194,接下来朝东北出发吧！<hex:02100103>城中最大的市场——露天集市就在那里！
136,TEXT_AKTKMA102_04358_A4_000_200,<hex:024804F2022403>关于传送魔法研究所<hex:0248020103>
137,TEXT_AKTKMA102_04358_A4_000_201,<hex:024804F2022403>关于露天书店<hex:0248020103>
138,TEXT_AKTKMA102_04358_GRAHATIA_000_205,接下来是市场啊。<hex:02100103>真期待能发现什么新奇的东西呢！
139,TEXT_AKTKMA102_04358_GRAHATIA_000_206,来看看今天能不能淘到些好东西呢？
140,TEXT_AKTKMA102_04358_KRILE_000_210,你跟以太之光共鸣完了吗？<hex:02100103>那就出发前往东北边的露天集市吧！
141,TEXT_AKTKMA102_04358_GRAHATIA_000_215,传送的费用还真是一笔不小的支出呢。<hex:02100103>所以我以前总是喜欢乘坐廉价的渡船。
142,TEXT_AKTKMA102_04358_GRAHATIA_000_216,塔塔露说最近拂晓会报销执行任务产生的传送费……<hex:02100103>真有这回事吗？
143,TEXT_AKTKMA102_04358_KRILE_000_220,对了对了，<hex:02100103>再往前就是我刚才提到的传送魔法研究所了。
144,TEXT_AKTKMA102_04358_KRILE_000_221,估计以后还会拜访那里，<hex:02100103>趁现在记一下位置吧！
145,TEXT_AKTKMA102_04358_GRAHATIA_000_225,那个，我能稍微看一眼这家露天书店吗？<hex:02100103>没准能发现什么有意思的书呢！
146,TEXT_AKTKMA102_04358_KRILE_000_226,你说的“稍微”绝对不是我们概念里的那种。<hex:02100103>你要是打算一个人待在这里的话，那就随你便啦。
147,TEXT_AKTKMA102_04358_GRAHATIA_000_227,这……呃……不太好吧……<hex:02100103>我还是以后……再来吧……
148,TEXT_AKTKMA102_04358_KRILE_000_230,像这样露天摆摊卖书，<hex:02100103>也许是萨雷安独有的风景吧。<hex:02100103>在我走访其他国家前，一直以为全世界都这样呢！
149,TEXT_AKTKMA102_04358_KRILE_000_239,这里就是露天集市……
150,TEXT_AKTKMA102_04358_KRILE_000_240,露天集市这里不仅贩卖萨雷安出产的物件，<hex:02100103>从港口运来的异国商品也会由此流入市场。
151,TEXT_AKTKMA102_04358_KRILE_000_241,以前也有不少研究机构贩卖不靠谱的试作品……<hex:02100103>不过现在基本上不用担心这个问题了。
152,TEXT_AKTKMA102_04358_KRILE_000_242,做冒险准备时请务必来这里转转！
153,TEXT_AKTKMA102_04358_KRILE_000_243,那接下来……<hex:02100103>我们就去目的地中最应该小心谨慎的地方吧。
154,TEXT_AKTKMA102_04358_KRILE_000_244,返回以太之光广场，<hex:02100103>从正面的台阶沿路直上，<hex:02100103>前面就是哲学家广场。
155,TEXT_AKTKMA102_04358_A5_000_250,<hex:024804F2022403>关于美丽的水景<hex:0248020103>
156,TEXT_AKTKMA102_04358_GRAHATIA_000_255,像这样故地重游，<hex:02100103>感觉过去的记忆和眼前的景象串联了起来。<hex:02100103>得好好感谢可露儿邀请我一起来呢。
157,TEXT_AKTKMA102_04358_GRAHATIA_000_256,啊……扑面而来的风虽然有点冷，但让人神清气爽啊。
158,TEXT_AKTKMA102_04358_KRILE_000_260,沿着以太之光广场正面的台阶走上去就是哲学家广场了。
159,TEXT_AKTKMA102_04358_KRILE_000_261,那附近的区域被称为七贤人庭园。<hex:02100103>不但是萨雷安政治与经济的中心，同时聚集了很多的研究机构，<hex:02100103>因此以为萨雷安建国做出贡献的七人命名。
160,TEXT_AKTKMA102_04358_GRAHATIA_000_265,这种装饰风格也就只有旧萨雷安这里才有了。<hex:02100103>我们之前的据点瓦尔岛虽说也归萨雷安管，<hex:02100103>但除了研究楼之外基本就是“大自然”的感觉……
161,TEXT_AKTKMA102_04358_KRILE_000_270,这就是水仙女神龛。<hex:02100103>为了赞颂水精而建造的水景。
162,TEXT_AKTKMA102_04358_KRILE_000_271,对于萨雷安人来说，水具有非常特别的意义。<hex:02100103>萨雷安建国的契机是第六灵灾的大洪水，<hex:02100103>神话中沙利亚克高举的水瓶涌出的是知识之水……
163,TEXT_AKTKMA102_04358_KRILE_000_272,因此这里的休憩场所通常都会建造配套的喷水池，<hex:02100103>建筑物大多也会采用包含水元素的设计。
164,TEXT_AKTKMA102_04358_KRILE_000_279,这座巨大的建筑就是哲学家广场……
165,TEXT_AKTKMA102_04358_KRILE_000_280,这座巨大的建筑就是哲学家广场！<hex:02100103>明明是座建筑却被叫做广场，很不可思议吧？
166,TEXT_AKTKMA102_04358_KRILE_000_281,其实这里原本有个广场，<hex:02100103>从市民中选出的议员们曾在此集会议论政策。
167,TEXT_AKTKMA102_04358_KRILE_000_282,这就是哲学家议会的由来。<hex:02100103>只不过现在议事地点由广场搬到了议事堂，<hex:02100103>但这里仍然是议员们集会的地方。
168,TEXT_AKTKMA102_04358_KRILE_000_283,我说……拉哈你在听吗？<hex:02100103>从刚才开始你就一直看着远处……
169,TEXT_AKTKMA102_04358_GRAHATIA_000_284,啊、抱歉……<hex:02100103>从这里可以一览整个旧萨雷安的风景吧？
170,TEXT_AKTKMA102_04358_GRAHATIA_000_285,我刚到第一世界没多久，<hex:02100103>聚集在塔附近的人们来找我商量过如何建造城市的问题。
171,TEXT_AKTKMA102_04358_GRAHATIA_000_286,我参考了认知中最气派的城市——旧萨雷安，<hex:02100103>给他们提供了建议。
172,TEXT_AKTKMA102_04358_GRAHATIA_000_287,最终建造出来的便是水晶都。<hex:02100103>看到它的原型……我有点触景生情。
173,TEXT_AKTKMA102_04358_KRILE_000_288,原来如此……<hex:02100103>你可以随时来这里登高望远，<hex:02100103>想必议员们也不会因为这点小事刁难你吧。
174,TEXT_AKTKMA102_04358_KRILE_000_289,拉哈的经历听完了，我们去下一个地点吧。<hex:02100103>最后我想带你们去漂流的终点，<hex:02100103>从东边的台阶下去直走！
175,TEXT_AKTKMA102_04358_GRAHATIA_000_290,你不冷吗？<hex:02100103>受暖流影响，这里在北洋还算暖和的区域，<hex:02100103>但跟利姆萨·罗敏萨相比还是有点冷呢……
176,TEXT_AKTKMA102_04358_GRAHATIA_000_291,这是萨雷安高官权贵居住的区域。<hex:02100103>以前走在这里总觉得不自在……
177,TEXT_AKTKMA102_04358_KRILE_000_295,漂流的终点是位于城市东侧的地区。<hex:02100103>从哲学家广场前走下东边的台阶就是！
178,TEXT_AKTKMA102_04358_KRILE_000_299,这里就是漂流的终点……
179,TEXT_AKTKMA102_04358_KRILE_000_300,没错，这里就是漂流的终点！<hex:02100103>据说人们在萨雷安的建国始祖纽恩克雷夫的指引下，<hex:02100103>将这里作为了最初的定居地。
180,TEXT_AKTKMA102_04358_KRILE_000_301,如今这里也成了居住区，<hex:02100103>住在附近的都是家族历史悠久或身兼要职的人。
181,TEXT_AKTKMA102_04358_KRILE_000_302,其中最醒目的宅邸你也知道，<hex:02100103>就是莱韦耶勒尔家……<hex:02100103>不过现在还是不要去拜访的好。
182,TEXT_AKTKMA102_04358_KRILE_000_303,我想为你介绍的地方就是这些！<hex:02100103>希望这一路你逛得还算尽兴。
183,TEXT_AKTKMA102_04358_KRILE_000_304,那我们就一起去巴尔德西昂分馆集合吧。<hex:02100103>拉哈，你还记得怎么走吗？
184,TEXT_AKTKMA102_04358_GRAHATIA_000_305,朝港口方向下坡，走过右手边的桥。<hex:02100103>之后不用进以太之光广场，沿路直行就到了吧？
185,TEXT_AKTKMA102_04358_KRILE_000_306,呵呵，没错！<hex:02100103>那我们三个出发吧！
186,TEXT_AKTKMA102_04358_A6_000_310,<hex:024804F2022403>关于漂流的终点<hex:0248020103>
187,TEXT_AKTKMA102_04358_GRAHATIA_000_315,巴尔德西昂分馆啊，真是好怀念啊！<hex:02100103>我以前来旧萨雷安办事的时候经常把这里当做旅馆用。
188,TEXT_AKTKMA102_04358_GRAHATIA_000_316,比如为了获取贤人称号来这边提交论文时之类的……嗯……
189,TEXT_AKTKMA102_04358_GRAHATIA_000_317,啊，真的是巴尔德西昂分馆！
190,TEXT_AKTKMA102_04358_KRILE_000_320,走了一路累着了吧。<hex:02100103>巴尔德西昂分馆里已经为你们准备好了休息的房间。
191,TEXT_AKTKMA102_04358_KRILE_000_321,分馆就在以太之光广场的西侧，<hex:02100103>我们一起过去吧！
192,TEXT_AKTKMA102_04358_GRAHATIA_000_325,对，要走过这座桥。<hex:02100103>之后就直着走……<hex:02100103>注意不要进以太之光广场！
193,TEXT_AKTKMA102_04358_KRILE_000_330,虽然萨雷安有不少学术机构和研究机构，<hex:02100103>不过也有人开设私塾，提供学习场所。
194,TEXT_AKTKMA102_04358_KRILE_000_331,不过从各种意义上来讲，<hex:02100103>在这附近的宅邸开设的私塾对我来说门槛太高了。<hex:02100103>阿尔菲诺也许可以去学习。
195,TEXT_AKTKMA102_04358_KRILE_000_339,这座建筑就是巴尔德西昂分馆……
196,TEXT_AKTKMA102_04358_KRILE_000_340,好了，我们到了，一路辛苦了！<hex:02100103>这座建筑就是巴尔德西昂分馆。
197,TEXT_AKTKMA102_04358_KRILE_000_341,顺着坡道往上走就是魔法大学……<hex:02100103>但一次性告诉你这么多，恐怕很难消化吧，<hex:02100103>下次有机会我再给你介绍吧。
198,TEXT_AKTKMA102_04358_KRILE_000_342,那就快进去吧！
199,TEXT_AKTKMA102_04358_KRILE_000_343,我回来了！<hex:02100103><hex:022903EB0203>和拉哈也来了。
200,TEXT_AKTKMA102_04358_OJIKATSUNJIKA_000_344,(-？？？？-)啊，欢迎回来。<hex:02100103>古·拉哈，好久不见了啊。
201,TEXT_AKTKMA102_04358_OJIKATSUNJIKA_000_345,(-？？？？-)<hex:022903EB0203>，初次见面。<hex:02100103>你的事迹我早有耳闻。
202,TEXT_AKTKMA102_04358_GRAHATIA_000_346,欧吉卡！这不是欧吉卡·岑吉卡吗！<hex:02100103>你过得怎么样啊！
203,TEXT_AKTKMA102_04358_KRILE_000_347,他叫欧吉卡……是那个艾吉卡·岑吉卡的堂弟。<hex:02100103>他在巴尔德西昂委员会担任事务员，负责管理这座分馆。
204,TEXT_AKTKMA102_04358_OJIKATSUNJIKA_000_348,我已经收到关于优雷卡的报告了。<hex:02100103>艾吉卡跟我不一样，是个急性子，没少让你头疼吧？<hex:02100103>他只是太较真，本性并不坏，今后还请你多加关照。
205,TEXT_AKTKMA102_04358_KRILE_000_349,他叫欧吉卡……是那个艾吉卡·岑吉卡的堂弟。<hex:02100103>他在巴尔德西昂委员会担任事务员，负责管理这座分馆。
206,TEXT_AKTKMA102_04358_OJIKATSUNJIKA_000_350,我已经看了关于优雷卡的事件报告。<hex:02100103>艾吉卡的离去让我很难过……<hex:02100103>不过感谢你们支持他的选择。
207,TEXT_AKTKMA102_04358_KRILE_000_351,他叫欧吉卡……是那个你在优雷卡见过的艾吉卡·岑吉卡的堂弟。<hex:02100103>他在巴尔德西昂委员会担任事务员，负责管理这座分馆。
