key,0,1
#,,
offset,0,4
int32,str,str
0,TEXT_REGHINRETURNTOIVALICESTORYNPC001_00495_LINA_000_020,昨天的敌人竟然成了今天的朋友。<hex:02100103>没想到事情竟然会发展成这样，真是无法预料！
1,TEXT_REGHINRETURNTOIVALICESTORYNPC001_00495_LINA_000_040,虽然这么说有点奇怪，但冒险者还真是寻物高手呢！<hex:02100103>一点一点脚踏实地完成任务就是获得信赖的秘诀吧！
2,TEXT_REGHINRETURNTOIVALICESTORYNPC001_00495_LINA_000_085,老实说，我现在非常吃惊……<hex:02100103>那就是圣石的力量吗？<hex:02100103>如果是的话，圣石还真是个可怕的东西……
3,TEXT_REGHINRETURNTOIVALICESTORYNPC001_00495_LINA_000_090,我这次就留在这里祈祷你们平安无事。<hex:02100103>等你们回来了一定要告诉我都发生了些什么啊。<hex:02100103>我可是有把这些经历都记录下来的使命！
4,TEXT_REGHINRETURNTOIVALICESTORYNPC001_00495_JENOMIS_000_050,怎么了？<hex:02100103>发生什么了吗？
5,TEXT_REGHINRETURNTOIVALICESTORYNPC001_00495_JENOMIS_000_090,虽然这么说就好像在给你施加压力一样，<hex:02100103>但我非常希望你能解开黎铎拉纳大灯塔和机工都市高古之谜！
6,TEXT_REGHINRETURNTOIVALICESTORYNPC001_00495_RAMZA_000_085,没想到邦加莫南竟然会被圣石吞噬……<hex:02100103>这也是盗贼应有的报应吗。
7,TEXT_REGHINRETURNTOIVALICESTORYNPC001_00495_RAMZA_000_090,拉巴纳斯塔的地下还存留着梦幻之都勒萨利亚。<hex:02100103>高古虽说相传已经毁灭且不存于世，但就算只是蛛丝马迹也好，<hex:02100103>要是我能……不，我一定得亲眼确认才行！
8,TEXT_REGHINRETURNTOIVALICESTORYNPC001_00495_RAMZA_000_100,虽然你可能不会相信，但我十分确定<hex:02100103>将项链托付给后世的人就是拉姆萨·贝奥尔甫本人！<hex:02100103>我一定会证明这点的，请你等着吧！
9,TEXT_REGHINRETURNTOIVALICESTORYNPC001_00495_ALMA_000_020,没想到袭击父亲的盗贼竟然是惨遭灭国的火枪队……<hex:02100103>帝国还真是做了恶劣的事情……
10,TEXT_REGHINRETURNTOIVALICESTORYNPC001_00495_ALMA_000_040,辛苦你了。<hex:02100103>你似乎一直在为我们东奔西走啊。<hex:02100103>真是对不起……
11,TEXT_REGHINRETURNTOIVALICESTORYNPC001_00495_ALMA_000_085,果然圣石是很可怕的东西……<hex:02100103>不过，它为什么会被叫做圣石呢？<hex:02100103>不管怎么想，它的力量都充满了邪恶。
12,TEXT_REGHINRETURNTOIVALICESTORYNPC001_00495_ALMA_000_090,难道说母亲的遗物项链，<hex:02100103>也隐藏有什么秘密吗……<hex:02100103>我好害怕……
13,TEXT_REGHINRETURNTOIVALICESTORYNPC001_00495_ALMA_000_100,没想到母亲的遗物项链也是圣石。<hex:02100103>难道说我们在不知不觉中被圣石中隐藏的<hex:02100103>“真切愿望”所引导了吗……
14,TEXT_REGHINRETURNTOIVALICESTORYNPC001_00495_ALMA_000_101,如果是这样，父亲想要洗清杜莱家污名的愿望<hex:02100103>难道也只是圣石让他这么想的？<hex:02100103>……我越想越觉得不安了。
15,TEXT_REGHINRETURNTOIVALICESTORYNPC001_00495_MONTBLANC_000_020,黎铎拉纳大灯塔？莫古当然知道库啵！<hex:02100103>但是莫古没有去过库啵。<hex:02100103>好想去看看库啵！
16,TEXT_REGHINRETURNTOIVALICESTORYNPC001_00495_MONTBLANC_000_085,老实说，吓死莫古了库啵……<hex:02100103>但是，莫古觉得不能逃库啵……<hex:02100103>这是莫古命中注定的冒险库啵……
17,TEXT_REGHINRETURNTOIVALICESTORYNPC001_00495_MONTBLANC_000_090,现在正是鼓起勇气的时候库啵！<hex:02100103>莫古已经不再害怕了库啵！<hex:02100103>……不害怕库啵……不害怕库啵。
18,TEXT_REGHINRETURNTOIVALICESTORYNPC001_00495_MONTBLANC_000_100,多亏了冒险者给莫古做了榜样，莫古才能鼓起勇气库啵！<hex:02100103>这样莫古也作为剧团的演员迈出新的一步了库啵！<hex:02100103>好想快点登台表演库啵！
19,TEXT_REGHINRETURNTOIVALICESTORYNPC001_00495_HURDY_000_020,黎铎拉纳大灯塔？莫古不是很想去啊库啵……<hex:02100103>流浪的莫古力族不擅长游泳，<hex:02100103>说白了就是旱鸭子库啵……
20,TEXT_REGHINRETURNTOIVALICESTORYNPC001_00495_HURDY_000_085,哥哥就不要去了吧库啵？<hex:02100103>反正他碍手碍脚的，只会耍嘴皮子库啵。<hex:02100103>……莫古很担心他库啵。
21,TEXT_REGHINRETURNTOIVALICESTORYNPC001_00495_HURDY_000_090,事已至此，只能拜托你能将蒙布朗哥哥<hex:02100103>培养成独当一面的冒险者了库啵！<hex:02100103>……希望你能和莫古约好，一定要平安带哥哥回来库啵。
22,TEXT_REGHINRETURNTOIVALICESTORYNPC001_00495_HURDY_000_100,莫古不能留哥哥一个人在这里库啵。<hex:02100103>所以莫古也要和哥哥一起加入剧团库啵！<hex:02100103>还好莫古擅长演奏乐器库啵！
23,TEXT_REGHINRETURNTOIVALICESTORYNPC001_00495_BWAGI_000_020,邦加莫南大哥真的是火枪队队长。<hex:02100103>我们也曾经是队员……<hex:02100103>但已经丧失了为国而战的资格……
24,TEXT_REGHINRETURNTOIVALICESTORYNPC001_00495_BWAGI_000_085,大哥已经救不回来了吗……<hex:02100103>不，现在放弃还为时尚早。<hex:02100103>求求你救救大哥吧！
25,TEXT_REGHINRETURNTOIVALICESTORYNPC001_00495_BWAGI_000_090,大哥已经救不回来了吗……<hex:02100103>不，现在放弃还为时尚早。<hex:02100103>求求你救救大哥吧！
26,TEXT_REGHINRETURNTOIVALICESTORYNPC001_00495_GIJUK_000_020,自从拿到度玛圣石之后，大哥就变得奇怪起来了……<hex:02100103>经常像是在和拉斯勒王子的幽灵对话一样……
27,TEXT_REGHINRETURNTOIVALICESTORYNPC001_00495_GIJUK_000_085,大哥到底怎么了……<hex:02100103>我们以后该如何是好……
28,TEXT_REGHINRETURNTOIVALICESTORYNPC001_00495_GIJUK_000_090,大哥到底怎么了……<hex:02100103>我们以后该如何是好……
29,TEXT_REGHINRETURNTOIVALICESTORYNPC001_00495_RINOK_000_020,我们邦加族的寿命比你们长。<hex:02100103>30年前的战争就好像是昨天的事一样……<hex:02100103>只要一回忆起来就心里乱乱的，虽然我一点也不想回忆起来。
30,TEXT_REGHINRETURNTOIVALICESTORYNPC001_00495_RINOK_000_085,我还没放弃呢……<hex:02100103>大哥不一定完全变成了异形怪物！<hex:02100103>但如果真到了那一步，还请你亲手……呜呜……
31,TEXT_REGHINRETURNTOIVALICESTORYNPC001_00495_RINOK_000_090,我还没放弃呢……<hex:02100103>大哥不一定完全变成了异形怪物！<hex:02100103>但如果真到了那一步，还请你亲手……呜呜……
32,TEXT_REGHINRETURNTOIVALICESTORYNPC001_00495_MIKOTO_000_010,我十分喜欢甜食……<hex:02100103>毕竟动脑筋的时候头脑会很需要糖分补充，不是吗？
33,TEXT_REGHINRETURNTOIVALICESTORYNPC001_00495_MIKOTO_000_011,说起来，你有什么要问我的吗？
34,TEXT_REGHINRETURNTOIVALICESTORYNPC001_00495_MIKOTO_000_020,我在文献里看到过黎铎拉纳大灯塔的描述，<hex:02100103>但并没有亲眼见过。<hex:02100103>不知它和伊瓦利斯有何关系……
35,TEXT_REGHINRETURNTOIVALICESTORYNPC001_00495_MIKOTO_000_021,说起来，你有什么要问我的吗？
36,TEXT_REGHINRETURNTOIVALICESTORYNPC001_00495_MIKOTO_000_085,发生了没有预料到的情况呢。<hex:02100103>果然持有者的意志越强，就越容易引出圣石的力量吗。
37,TEXT_REGHINRETURNTOIVALICESTORYNPC001_00495_MIKOTO_000_086,说起来，你有什么要问我的吗？
38,TEXT_REGHINRETURNTOIVALICESTORYNPC001_00495_MIKOTO_000_090,虽然好奇心之神叫我跟着你走，<hex:02100103>但无力的我就算跟去也帮不上什么忙。<hex:02100103>所以只能祝你好运了……
39,TEXT_REGHINRETURNTOIVALICESTORYNPC001_00495_MIKOTO_000_091,说起来，你有什么要问我的吗？
40,TEXT_REGHINRETURNTOIVALICESTORYNPC001_00495_MIKOTO_000_100,黎铎拉纳大灯塔的远征辛苦了。<hex:02100103>邦加莫南身上竟然发生了那种事，太遗憾了……<hex:02100103>不过，这也让我们对圣石有了更进一步的了解。
41,TEXT_REGHINRETURNTOIVALICESTORYNPC001_00495_MIKOTO_000_101,说起来，你有什么要问我的吗？
42,TEXT_REGHINRETURNTOIVALICESTORYNPC001_00495_Q1_000_000,想了解什么？
43,TEXT_REGHINRETURNTOIVALICESTORYNPC001_00495_A1_000_000,关于圣石的原理
44,TEXT_REGHINRETURNTOIVALICESTORYNPC001_00495_A1_000_001,关于欧提斯圣石
45,TEXT_REGHINRETURNTOIVALICESTORYNPC001_00495_A1_000_002,关于度玛圣石
46,TEXT_REGHINRETURNTOIVALICESTORYNPC001_00495_A1_000_003,关于黎铎拉纳大灯塔
47,TEXT_REGHINRETURNTOIVALICESTORYNPC001_00495_000_100,取消
48,TEXT_REGHINRETURNTOIVALICESTORYNPC001_00495_MIKOTO_100_000,虽然目前只是推测，但我认为它们拥有吸收持有者的意志，<hex:02100103>并以物理形式再现的能力。<hex:02100103>它们会反复将持有者的意志放映出来，直到吸收的以太耗尽。
49,TEXT_REGHINRETURNTOIVALICESTORYNPC001_00495_MIKOTO_100_001,在伊瓦利斯史上它们被称为圣石，<hex:02100103>似乎是被什么人特意创造出来的人工产物。<hex:02100103>不过究竟是谁为了何种目的创造出它们，已经无人知晓了。
50,TEXT_REGHINRETURNTOIVALICESTORYNPC001_00495_MIKOTO_200_000,欧提斯圣石的持有者是杰诺米，<hex:02100103>但据我调查，欧提斯圣石似乎并没有吸收特定的波长……<hex:02100103>也就是杰诺米的以太。
51,TEXT_REGHINRETURNTOIVALICESTORYNPC001_00495_MIKOTO_200_001,也就是说它还处于内部空空如也的初始状态。<hex:02100103>不知道如何才能将它吸收以太的开关打开。
52,TEXT_REGHINRETURNTOIVALICESTORYNPC001_00495_MIKOTO_300_000,度玛圣石吸收了最后持有者阿加斯的真切愿望，<hex:02100103>只要有人进入王都勒萨利亚的遗迹就会将其放映出来。
53,TEXT_REGHINRETURNTOIVALICESTORYNPC001_00495_MIKOTO_300_001,上次由于你让度玛圣石储存的以太都耗光了，<hex:02100103>所以它变回了和欧提斯圣石一样空空如也的初始状态。
54,TEXT_REGHINRETURNTOIVALICESTORYNPC001_00495_MIKOTO_320_000,度玛圣石吸收了最后持有者阿加斯的真切愿望，<hex:02100103>只要有人进入王都勒萨利亚的遗迹就会将其放映出来。
55,TEXT_REGHINRETURNTOIVALICESTORYNPC001_00495_MIKOTO_320_001,上次由于你让度玛圣石储存的以太都耗光了，<hex:02100103>所以它变回了和欧提斯圣石一样空空如也的初始状态。
56,TEXT_REGHINRETURNTOIVALICESTORYNPC001_00495_MIKOTO_320_002,但是，遭到度玛圣石迷惑的邦加莫南终究是<hex:02100103>连同愿望一起被石头吞噬了。
57,TEXT_REGHINRETURNTOIVALICESTORYNPC001_00495_MIKOTO_320_003,不知是他愿望的波长与度玛圣石十分匹配，<hex:02100103>还是度玛圣石主动适应了邦加莫南。<hex:02100103>虽然不明白具体机制，但我感觉它并非是天然形成的。
58,TEXT_REGHINRETURNTOIVALICESTORYNPC001_00495_MIKOTO_400_000,在拉巴纳斯塔遥远的南边，瓦尔纳德海上，<hex:02100103>有一个叫黎铎拉纳的巨大的海眼，据说通往地狱。
59,TEXT_REGHINRETURNTOIVALICESTORYNPC001_00495_MIKOTO_400_001,周围的海水形成巨大的瀑布灌入海眼中，<hex:02100103>最终不知去向。
60,TEXT_REGHINRETURNTOIVALICESTORYNPC001_00495_MIKOTO_400_002,几位勇敢的探险家曾经驾驶飞空艇进内里试图一探究竟，<hex:02100103>但瀑布卷起的气流和海水的压力将他们的飞空艇全数击坠，<hex:02100103>至今无人生还。
61,TEXT_REGHINRETURNTOIVALICESTORYNPC001_00495_MIKOTO_400_003,海眼的边缘有一座小岛，岛上建有一座巨大的灯塔。<hex:02100103>据说是为了警告在黎铎拉纳近海航行的船只，<hex:02100103>防止船只不慎落入海眼而建造的。
62,TEXT_REGHINRETURNTOIVALICESTORYNPC001_00495_MIKOTO_400_004,不过，没有人知道灯塔是谁在何时建的。<hex:02100103>虽然达尔马斯卡王国一直在管理灯塔，<hex:02100103>但灯塔本身建于很久以前，十分古老。
63,TEXT_REGHINRETURNTOIVALICESTORYNPC001_00495_MIKOTO_420_000,在拉巴纳斯塔遥远的南边，瓦尔纳德海上，<hex:02100103>有一个叫黎铎拉纳的巨大的海眼，据说通往地狱。
64,TEXT_REGHINRETURNTOIVALICESTORYNPC001_00495_MIKOTO_420_001,周围的海水形成巨大的瀑布灌入海眼中，<hex:02100103>最终不知去向。
65,TEXT_REGHINRETURNTOIVALICESTORYNPC001_00495_MIKOTO_420_002,几位勇敢的探险家曾经驾驶飞空艇进内里试图一探究竟，<hex:02100103>但瀑布卷起的气流和海水的压力将他们的飞空艇全数击坠，<hex:02100103>至今无人生还。
66,TEXT_REGHINRETURNTOIVALICESTORYNPC001_00495_MIKOTO_420_003,海眼的边缘有一座小岛，岛上建有一座巨大的灯塔。<hex:02100103>据说是为了警告在黎铎拉纳近海航行的船只，<hex:02100103>防止船只不慎落入海眼而建造的。
67,TEXT_REGHINRETURNTOIVALICESTORYNPC001_00495_MIKOTO_420_004,不过，没有人知道灯塔是谁在何时建的。<hex:02100103>虽然达尔马斯卡王国一直在管理灯塔，<hex:02100103>但灯塔本身建于很久以前，十分古老。
68,TEXT_REGHINRETURNTOIVALICESTORYNPC001_00495_MIKOTO_420_005,根据杰诺米的推测，<hex:02100103>伊瓦利斯时代那里曾经存在着极其繁荣的机工都市高古，<hex:02100103>却因为原因不明的爆炸事故失去了整个上半部分。
69,TEXT_REGHINRETURNTOIVALICESTORYNPC001_00495_MIKOTO_420_006,被遗弃的机工都市高古的下半部分，<hex:02100103>就被后世的达尔马斯卡王国作为灯塔继续使用了。
70,TEXT_REGHINRETURNTOIVALICESTORYNPC001_00495_MIKOTO_420_007,对了，在这次远征中，<hex:02100103>我们在空中发现了被认为已经消失的高古上半部分，<hex:02100103>所以实际上因爆炸而消失的应该是高古的中间部分才对。
71,TEXT_REGHINRETURNTOIVALICESTORYNPC001_00495_LINA_000_100,（★未使用／削除予定★）
72,TEXT_REGHINRETURNTOIVALICESTORYNPC001_00495_LINA_000_101,（★未使用／削除予定★）
73,TEXT_REGHINRETURNTOIVALICESTORYNPC001_00495_LINA_000_102,（★未使用／削除予定★）
74,TEXT_REGHINRETURNTOIVALICESTORYNPC001_00495_LINA_000_103,（★未使用／削除予定★）
75,TEXT_REGHINRETURNTOIVALICESTORYNPC001_00495_LINA_000_104,（★未使用／削除予定★）
76,TEXT_REGHINRETURNTOIVALICESTORYNPC001_00495_LINA_000_105,（★未使用／削除予定★）
