key,0,1
#,,
offset,0,4
Int32,String,String
0,TEXT_BANARK001_04545_SEQ_00,<hex:024804F201FC03><hex:024904F201FD03>特殊规则： 等级调整（限定职业）<hex:0249020103><hex:0248020103><hex:02100103>新港的勘恰娜好像在担心什么事。
1,TEXT_BANARK001_04545_SEQ_01,※本任务为<hex:024804F201FC03><hex:024904F201FD03><hex:0249020103><hex:0248020103> 等级调整（限定职业）任务，<hex:02100103>需要与接受任务时的职业相同才可继续进行任务。<hex:02100103><hex:02100103>和勘恰娜进行了交谈。冒险者接到委托前去调查萨维奈道路上作乱的河马。向新港的居民打听目击情报。
2,TEXT_BANARK001_04545_SEQ_02,向居民打听了情报。得知的确有河马在作乱，但却不清楚它们在道路上狂奔的原因。为了进一步获得有关狂奔河马的线索，前往萨维奈岛的熏香丘陵寻找荼罗娜。
3,TEXT_BANARK001_04545_SEQ_03,和荼罗娜进行了交谈。了解到原来是她的小弟们在利用河马飙车。为了替自己的小弟们赔罪，她希望冒险者将调查的委托人介绍给她。和新港的勘恰娜谈谈。
4,TEXT_BANARK001_04545_SEQ_04,和勘恰娜进行了交谈。荼罗娜认为不能再这样下去，于是提出他们可以在物流停滞的萨维奈岛提供配送服务。和新港的荼罗娜谈谈，加入荼罗娜的初次配送工作，前往萨维奈岛的代米尔遗烈乡。
5,TEXT_BANARK001_04545_SEQ_05,和荼罗娜进行了交谈，乘坐河马车前往了代米尔遗烈乡。将药草交到了等待货物的炼金术士手上，顺利地完成了配送。再次和代米尔遗烈乡的荼罗娜谈谈。
6,TEXT_BANARK001_04545_SEQ_06,再次和荼罗娜进行了交谈。冒险者骑乘的河马因为一路奔波似乎已经感到疲累。荼罗娜表示会让疲累的河马休整后再回去。乘坐她的河马车返回新港。
7,TEXT_BANARK001_04545_SEQ_07,乘坐荼罗娜的河马车回到了新港。和新港的勘恰娜谈谈，向她报告配送的结果。
8,TEXT_BANARK001_04545_SEQ_08,和勘恰娜进行了交谈。她表示愿意出借场地作为配送服务的据点。和萨维奈岛大金库的荼罗娜谈谈。
9,TEXT_BANARK001_04545_SEQ_09,和荼罗娜进行了交谈。配送服务的据点大金库已经准备就绪。为荼罗娜他们出谋划策，将他们培养成优秀的配送人员吧！
10,TEXT_BANARK001_04545_SEQ_10,
11,TEXT_BANARK001_04545_SEQ_11,
12,TEXT_BANARK001_04545_SEQ_12,
13,TEXT_BANARK001_04545_SEQ_13,
14,TEXT_BANARK001_04545_SEQ_14,
15,TEXT_BANARK001_04545_SEQ_15,
16,TEXT_BANARK001_04545_SEQ_16,
17,TEXT_BANARK001_04545_SEQ_17,
18,TEXT_BANARK001_04545_SEQ_18,
19,TEXT_BANARK001_04545_SEQ_19,
20,TEXT_BANARK001_04545_SEQ_20,
21,TEXT_BANARK001_04545_SEQ_21,
22,TEXT_BANARK001_04545_SEQ_22,
23,TEXT_BANARK001_04545_SEQ_23,
24,TEXT_BANARK001_04545_TODO_00,向居民打听情报
25,TEXT_BANARK001_04545_TODO_01,寻找荼罗娜
26,TEXT_BANARK001_04545_TODO_02,和勘恰娜对话
27,TEXT_BANARK001_04545_TODO_03,和荼罗娜对话
28,TEXT_BANARK001_04545_TODO_04,再次和荼罗娜对话
29,TEXT_BANARK001_04545_TODO_05,乘坐河马车前往指定地点
30,TEXT_BANARK001_04545_TODO_06,和勘恰娜对话
31,TEXT_BANARK001_04545_TODO_07,和荼罗娜对话
32,TEXT_BANARK001_04545_TODO_08,
33,TEXT_BANARK001_04545_TODO_09,
34,TEXT_BANARK001_04545_TODO_10,
35,TEXT_BANARK001_04545_TODO_11,
36,TEXT_BANARK001_04545_TODO_12,
37,TEXT_BANARK001_04545_TODO_13,
38,TEXT_BANARK001_04545_TODO_14,
39,TEXT_BANARK001_04545_TODO_15,
40,TEXT_BANARK001_04545_TODO_16,
41,TEXT_BANARK001_04545_TODO_17,
42,TEXT_BANARK001_04545_TODO_18,
43,TEXT_BANARK001_04545_TODO_19,
44,TEXT_BANARK001_04545_TODO_20,
45,TEXT_BANARK001_04545_TODO_21,
46,TEXT_BANARK001_04545_TODO_22,
47,TEXT_BANARK001_04545_TODO_23,
48,TEXT_BANARK001_04545_KANCANA_000_000,啊，<hex:022903EB0203>！<hex:02100103>你来得正好，能借用点你的时间吗？
49,TEXT_BANARK001_04545_KANCANA_000_001,我本来以为最近的情况终于安稳一点了，<hex:02100103>没想到又出了意外……
50,TEXT_BANARK001_04545_KANCANA_000_002,问题的根源是……是河马！<hex:02100103>没错，路上不知为什么出现了河马！
51,TEXT_BANARK001_04545_KANCANA_000_003,而且还是不停狂奔的河马！
52,TEXT_BANARK001_04545_Q1_000_004,要说什么？
53,TEXT_BANARK001_04545_A1_000_001,狂奔的……河马？
54,TEXT_BANARK001_04545_A1_000_002,哇哦，真是新奇啊……
55,TEXT_BANARK001_04545_A1_000_003,这附近有河马的栖息地吗？
56,TEXT_BANARK001_04545_KANCANA_000_005,河马原来栖息在岛北部的万相森国树海里。<hex:02100103>可树海在末日降临时发生了严重的火灾，<hex:02100103>它们可能就是因此离开了那里。
57,TEXT_BANARK001_04545_KANCANA_000_006,如果真是这样的话，那它们倒还是挺可怜的……<hex:02100103>不过，考虑它们会威胁到交通安全，<hex:02100103>又不能放任不管。
58,TEXT_BANARK001_04545_KANCANA_000_007,本来这类问题应该去拜托星战士团来帮忙解决，<hex:02100103>但他们还在处理末日造成的后续问题，实在难以分身。<hex:02100103>斡兀立现在也不在这里，不知能不能请你帮忙调查一下？
59,TEXT_BANARK001_04545_KANCANA_000_008,太好了，谢谢你！
60,TEXT_BANARK001_04545_KANCANA_000_009,遗憾的是我这里也没有更多的情报，<hex:02100103>或许你可以试着去问问新港的居民们。
61,TEXT_BANARK001_04545_KANCANA_000_010,遗憾的是我这里也没有更多的情报，<hex:02100103>或许你可以试着去问问新港的居民们。
62,TEXT_BANARK001_04545_RESIDENTSA_000_015,你问我见没见过狂奔的河马？<hex:02100103>见过见过，它们跑得那真是飞快，吓死我了。
63,TEXT_BANARK001_04545_RESIDENTSA_000_016,当时扬了一阵飞尘，虽然看得不是很清楚，<hex:02100103>但从那大小和轮廓来看，我觉得就是河马。<hex:02100103>别看河马长得憨憨的，其实非常凶猛，我现在都不敢出去了。
64,TEXT_BANARK001_04545_RESIDENTSB_000_017,狂奔的河马我是没听过，<hex:02100103>不过我倒是知道一条与河马有关的消息。<hex:02100103>北边有一群悌阳象族没事就会让河马拉着车跑。
65,TEXT_BANARK001_04545_RESIDENTSB_000_018,我还听说他们做事品行不良，<hex:02100103>最近从北边过来的难民中就有不少像他们那样<hex:02100103>不好好干活就知道成天鬼混的家伙们。
66,TEXT_BANARK001_04545_RESIDENTSC_000_019,我倒是在遗烈乡附近见过几次狂奔的河马……<hex:02100103>不过没想到在同一天内会再次被人问到这个问题。
67,TEXT_BANARK001_04545_RESIDENTSC_000_020,其实在你之前也有一个悌阳象族的女孩问过我这个。<hex:02100103>她是从树海那边过来避难的，名字好像是……
68,TEXT_BANARK001_04545_RESIDENTSC_000_021,对了，是叫荼罗娜来着。<hex:02100103>如果你要找的目标跟她一样的话，不如去和她谈谈怎么样？<hex:02100103>她现在应该还在沿着大道寻找河马吧。
69,TEXT_BANARK001_04545_RESIDENTSA_000_022,那些河马为什么会沿着大道跑呢？<hex:02100103>难道是觉得平整的大路跑起来比较舒服吗？
70,TEXT_BANARK001_04545_RESIDENTSB_000_023,要是那帮北部的混混们也来南边避难了，<hex:02100103>那些多半就是他们的河马。
71,TEXT_BANARK001_04545_RESIDENTSC_000_024,关于河马的事情，你去和荼罗娜谈谈吧。<hex:02100103>现在她应该在遗烈乡附近的大道上。
72,TEXT_BANARK001_04545_TRNA_000_025,你看什么看？<hex:02100103>我正忙着呢！
73,TEXT_BANARK001_04545_TRNA_000_026,啊？<hex:02100103>有人拜托你调查狂奔的河马，<hex:02100103>所以你就来找我了？
74,TEXT_BANARK001_04545_TRNA_000_027,可恶，我本想在闹出麻烦前阻止那些家伙呢，<hex:02100103>看来为时已晚了吗……
75,TEXT_BANARK001_04545_TRNA_000_028,那群狂奔的河马差不多该经过这里了。<hex:02100103>我已经设置好了吸引它们的诱饵，<hex:02100103>如果你也是来调查的，那在这里等着就行了。
76,TEXT_BANARK001_04545_TRNA_000_030,来了！
77,TEXT_BANARK001_04545_MARU_000_031,(-河马车的骑手-)快走啊！别停下！
78,TEXT_BANARK001_04545_MARU_000_032,(-河马车的骑手-)嗯？<hex:02100103>为什么大路上会有水果？
79,TEXT_BANARK001_04545_TRNA_000_033,你们这群蠢货！
80,TEXT_BANARK001_04545_TRNA_000_034,摩罗卢！<hex:02100103>你怎么能让河马在有人来往的路上乱跑？！
81,TEXT_BANARK001_04545_MARU_000_035,啊……是大姐头……
82,TEXT_BANARK001_04545_MARU_000_036,不是，你听我解释……<hex:02100103>树海那边的小径都被烧得没法走了……<hex:02100103>我们只好来这边跑跑了……
83,TEXT_BANARK001_04545_Q2_000_037,要说什么？
84,TEXT_BANARK001_04545_A2_000_001,狂奔的河马可是十分危险的！
85,TEXT_BANARK001_04545_A2_000_002,请不要骑着河马在大路上狂奔
86,TEXT_BANARK001_04545_TRNA_000_038,说的没错！<hex:02100103>你们扬起了大片大片的尘土！<hex:02100103>就算往来的行人没有以前那么多，也是在给别人添麻烦啊！
87,TEXT_BANARK001_04545_TRNA_000_039,先有佐特塔后来又遇上了末日……<hex:02100103>现在情况好不容易才稳定下来了，你们还给大家添乱。<hex:02100103>难道你们就不明白这座岛上的人受了多少苦吗？！
88,TEXT_BANARK001_04545_TRNA_000_040,以前那种自由自在地驾驶河马车狂奔的日子早就过去了！
89,TEXT_BANARK001_04545_TRNA_000_041,你是受人委托来调查狂奔河马的吧？<hex:02100103>就像你看到的这样，犯人就是这些家伙……<hex:02100103>他们是我的小弟。
90,TEXT_BANARK001_04545_TRNA_000_042,我想问一下，你的委托人在哪？<hex:02100103>既然小弟们给人家添麻烦了，<hex:02100103>照道理我得去赔礼道歉才对。
91,TEXT_BANARK001_04545_TRNA_000_043,去新港那里就行了是吧。<hex:02100103>我这就找一趟那位勘恰娜，低头向人家赔个不是。
92,TEXT_BANARK001_04545_TRNA_100_044,摩罗卢，你也跟我走一趟！<hex:02100103>领头的家伙要是不去赔罪，<hex:02100103>那还像话吗！
93,TEXT_BANARK001_04545_TRNA_000_044,你是不是也得回去报告一下？<hex:02100103>我们在你的委托人那边见面吧，<hex:02100103>我会说明事情的缘由。
94,TEXT_BANARK001_04545_KANCANA_000_050,嗯？他们是……？<hex:02100103>我还以为你是来汇报调查结果的，<hex:02100103>难道他们也是像斡兀立一样需要帮助的人？
95,TEXT_BANARK001_04545_TRNA_000_051,我、我叫荼罗娜！<hex:02100103>听说是你在委托调查狂奔河马的事情，<hex:02100103>我是来为此事道歉的！
96,TEXT_BANARK001_04545_TRNA_000_052,那些狂奔的河马其实是我们“飙车族”用的河马车。<hex:02100103>让它们在大道上狂奔的也是我的小弟们……<hex:02100103>给你添这么大的麻烦，真是十分抱歉！
97,TEXT_BANARK001_04545_TRNA_000_053,我们原本居住的北部树海在末日中受灾严重，<hex:02100103>只好来这边避难。
98,TEXT_BANARK001_04545_TRNA_000_054,以前我们靠着树海带来的恩惠，过着随性自由的生活。<hex:02100103>这就导致我们没什么一技之长，现在只能无所事事……
99,TEXT_BANARK001_04545_TRNA_000_055,岛上刚经历过灾难……<hex:02100103>所以我想我们也不该再游手好闲下去了，得做些贡献才行，<hex:02100103>但我们一直不太合群，净在这边闯祸了……
100,TEXT_BANARK001_04545_SYSTEM_000_056,荼罗娜他们拥有的河马车<hex:02100103>不仅拉得动身强力壮的悌阳象族，<hex:02100103>还能在这种状态下狂奔……
101,TEXT_BANARK001_04545_SYSTEM_000_057,或许可以从萨维奈岛当前面临的困境中<hex:02100103>寻找出让他们做出贡献的机会……
102,TEXT_BANARK001_04545_Q3_000_058,要说什么？
103,TEXT_BANARK001_04545_A3_000_001,如果真想做贡献，那试着做做配送吧？
104,TEXT_BANARK001_04545_A3_000_002,驾驭河马狂奔不也是一项技术吗？
105,TEXT_BANARK001_04545_TRNA_000_059,我们真的能胜任吗？<hex:02100103>虽然河马车的确是我心目中最好的交通工具……
106,TEXT_BANARK001_04545_TRNA_000_060,真的吗?<hex:02100103>驾驶河马车对我们来说一直都只是一项兴趣，<hex:02100103>没想到这也算一项有用的技术……
107,TEXT_BANARK001_04545_KANCANA_000_061,正好，萨维奈现阶段的主要目标就是复兴经济。<hex:02100103>活用河马车来发展配送服务或许真是一个不错的想法。
108,TEXT_BANARK001_04545_KANCANA_000_062,不过配送服务从工作性质上来讲需要临时保管重要的货物，<hex:02100103>因此与委托人构筑信赖关系尤为重要。
109,TEXT_BANARK001_04545_KANCANA_000_063,你们不仅要努力赢得对方的信任，<hex:02100103>还要学习最基本的配送流程和服务标准。
110,TEXT_BANARK001_04545_KANCANA_000_064,不过要我说的话，万事开头难，不论是谁都会经历初次挑战！<hex:02100103>如果你们已经鼓足勇气想要试试的话……<hex:02100103>那就让这方面的前辈带带你们吧。
111,TEXT_BANARK001_04545_KANCANA_000_065,刚才我接到消息，有一批进口货物本该运往代米尔遗烈乡，<hex:02100103>却被货运船错误地装卸到了这里……<hex:02100103>这些货物都是来自格里达尼亚的药草，所以我想尽快送过去。
112,TEXT_BANARK001_04545_KANCANA_000_066,如果可以的话，能请你和她一起走一趟吗？<hex:02100103>毕竟你经验丰富，完成过不少委托，<hex:02100103>有你在的话她也能安心地完成初次挑战。
113,TEXT_BANARK001_04545_KANCANA_000_067,你就和<hex:022903EB0203>一起体验一下如何配送吧，<hex:02100103>之后再判断自己能否胜任这项工作。<hex:02100103>货物就交给你保管了。
114,TEXT_BANARK001_04545_TRNA_000_068,<hex:022903EB0203>，抱歉还得让你陪我……
115,TEXT_BANARK001_04545_TRNA_000_069,我会在新港的入口附近等你，<hex:02100103>要出发的时候记得说一声。
116,TEXT_BANARK001_04545_KANCANA_000_070,你这个人还真是善于结交朋友呢。<hex:02100103>你带来的人总是会让人不禁想要多加关照！
117,TEXT_BANARK001_04545_KANCANA_000_071,虽然还得请你多跑一趟，<hex:02100103>不过缘分难得，请你多帮帮她吧。
118,TEXT_BANARK001_04545_MARU_000_072,不管怎么想，我们也干不来配送这种活吧。<hex:02100103>虽然大姐头一副跃跃欲试的样子……<hex:02100103>可让我们和他人建立起信赖关系，这实在是太为难人了……
119,TEXT_BANARK001_04545_MARU_100_072,当然了，要是有工作我们就不会饿肚子了，<hex:02100103>自然也就用不着靠飙车来发泄饥饿带来的精神压力。<hex:02100103>可……唉，我们该怎么办才好啊……
120,TEXT_BANARK001_04545_TRNA_000_075,你来了啊！<hex:02100103>我这边也做好准备了。
121,TEXT_BANARK001_04545_TRNA_000_076,我带来了我的爱车以及河马搭档骁厉亚。<hex:02100103>车座下面有储存空间，我把拿到的货物放在里面了。
122,TEXT_BANARK001_04545_TRNA_000_077,河马比较认生，不过我之前用诱饵让它们停下来时你也在场，<hex:02100103>它们应该会把你也当成负责喂食的人。
123,TEXT_BANARK001_04545_TRNA_000_078,所以你可以放心借用一辆小弟的河马车。<hex:02100103>驾着它我们很快就能到代米尔遗烈乡！
124,TEXT_BANARK001_04545_MARU_000_079,有大姐头跟着的话我想应该不会出问题，<hex:02100103>但毕竟除了我们之外从未有人驾驶过它……<hex:02100103>呃，反正你多注意吧。
125,TEXT_BANARK001_04545_TRNA_000_080,啊，对了，<hex:02100103>路上要记得降低速度安全驾驶！
126,TEXT_BANARK001_04545_Q4_000_081,要乘上河马车进行移动吗？
127,TEXT_BANARK001_04545_TRNA_000_082,乘河马车的感觉如何？<hex:02100103>这还是我想出来的呢。
128,TEXT_BANARK001_04545_TRNA_000_083,起初悌阳象族并没有用动物拉车的文化，<hex:02100103>后来看到人类驾驭的陆行鸟篷车，才受到启发开始了模仿。
129,TEXT_BANARK001_04545_TRNA_000_084,只不过以我们的体重来说，陆行鸟肯定是行不通的。<hex:02100103>在试了各种动物后，最终我们选择了河马当做坐骑！
130,TEXT_BANARK001_04545_TRNA_000_085,河马虽然爆发力很强，但却缺乏耐力。<hex:02100103>所以何时指挥它加速就完全看骑手的本事了。
131,TEXT_BANARK001_04545_TRNA_000_090,好了，我们到了！<hex:02100103>之后再把货物送给这里的家伙就算完工了……
132,TEXT_BANARK001_04545_ALCHEMIST04545_000_091,(-？？？？-)你们是来送货的？<hex:02100103>是不是进口的那批药草？
133,TEXT_BANARK001_04545_ALCHEMIST04545_000_092,我还想着海运的话应该到了，可就是见不到船影。<hex:02100103>一直在干等着呢……
134,TEXT_BANARK001_04545_ALCHEMIST04545_000_093,诶……你不是救了尼答娜的冒险者吗！<hex:02100103>是你送来的吗？
135,TEXT_BANARK001_04545_ALCHEMIST04545_000_094,哈哈，原来是这样啊！<hex:02100103>是你们将出错的货物从新港那边专程送过来了啊，<hex:02100103>真是感谢！
136,TEXT_BANARK001_04545_ALCHEMIST04545_000_095,这里的港口太小没法供贸易船停靠。
137,TEXT_BANARK001_04545_ALCHEMIST04545_000_096,所以大船只能停靠在近海那边的光明岛，<hex:02100103>然后再通过小船运到这里。<hex:02100103>也因此难免会出现些失误。
138,TEXT_BANARK001_04545_ALCHEMIST04545_000_097,啊对了，能让我确认一下货物吗？<hex:02100103>虽然听你们的描述，应该就是我订购的东西，<hex:02100103>不过以防万一还是让我亲自看看吧。
139,TEXT_BANARK001_04545_ALCHEMIST04545_000_098,嗯，的确是我订购的药草。
140,TEXT_BANARK001_04545_ALCHEMIST04545_000_099,订购岛外的东西十分费时费力，<hex:02100103>不过看到药草还能保持得这么新鲜，真是太好了。
141,TEXT_BANARK001_04545_ALCHEMIST04545_000_100,话说回来，真没想到传闻中的狂奔河马居然做起了配送服务。<hex:02100103>虽然看起来比较吓人，不过有你在我就放心了。<hex:02100103>今后还会继续委托你们的！
142,TEXT_BANARK001_04545_TRNA_000_101,还真被人当成配送人员了……<hex:02100103>算了，就这样吧。
143,TEXT_BANARK001_04545_TRNA_000_102,看样子人们还真信赖你呢，<hex:02100103>就连我这个素未谋面的随行人员都得到了认可。
144,TEXT_BANARK001_04545_TRNA_000_103,话说回来，当我看见那位炼金术士在收到货物时露出的笑脸，<hex:02100103>顿时就觉得心情很畅快呢！<hex:02100103>没想到给别人配送东西原来是这么有价值的工作！
145,TEXT_BANARK001_04545_TRNA_000_110,谢谢你陪着我完成了初次挑战！<hex:02100103>也感谢你帮忙说明了货物晚到的原因。
146,TEXT_BANARK001_04545_TRNA_000_111,虽然我很想和你立刻回到勘恰娜那里报告，<hex:02100103>不过看来你驾驭的河马已经累得不行了……<hex:02100103>这也没办法，小弟他们之前一直在路上狂奔来着。
147,TEXT_BANARK001_04545_TRNA_000_112,我会让这个家伙休息好后再回去。<hex:02100103>你先驾着我的爱车还有骁厉亚回新港吧！
148,TEXT_BANARK001_04545_TRNA_000_113,你只要按着来时的驾驶诀窍应该就能顺利回去。<hex:02100103>我们到时候再在勘恰娜那里汇合吧。
149,TEXT_BANARK001_04545_SYSTEM_000_114,从河马车上下来后，和代米尔遗烈乡的荼罗娜对话，<hex:02100103>即可再次骑乘。
150,TEXT_BANARK001_04545_Q5_000_115,要驾驶河马车吗？
151,TEXT_BANARK001_04545_TRNA_000_116,看到骁厉亚独自跑回来，<hex:02100103>我还以为出什么事了呢。<hex:02100103>要再次乘上它吗？
152,TEXT_BANARK001_04545_SYSTEM_000_120,到达目的地下车后，骁厉亚跑走了。<hex:02100103>前往勘恰娜那里报告配送结果。
153,TEXT_BANARK001_04545_SYSTEM_000_121,和代米尔遗烈乡的荼罗娜对话，<hex:02100103>乘着河马车来到新港。
154,TEXT_BANARK001_04545_KANCANA_000_125,欢迎回来！<hex:02100103>配送的结果我已经从<hex:022903EB0203>那里听说了。<hex:02100103>也谢谢你的帮忙。
155,TEXT_BANARK001_04545_KANCANA_000_126,你对初次的挑战有什么感想？
156,TEXT_BANARK001_04545_TRNA_000_127,感觉运货的工作我们也能做到。<hex:02100103>只不过我们没有和客人打过交道，<hex:02100103>难免会有些不安……
157,TEXT_BANARK001_04545_TRNA_000_128,但不管怎么说我们只能试着去习惯了。<hex:02100103>反正万相森国树海那边的村子都在末日中被烧光了，<hex:02100103>既然要在这边生活，就必须与自家以外的人建立起联系才行。
158,TEXT_BANARK001_04545_TRNA_000_129,更重要的是配送时看到客人高兴的样子感觉并不赖。<hex:02100103>一想到我们这些混混也能帮到别人，我就想要试一试！
159,TEXT_BANARK001_04545_KANCANA_000_130,我能理解因自己的行动让他人展露笑颜的喜悦，<hex:02100103>如果这种喜悦让你决定继续这份工作的话，<hex:02100103>我会全力支持你的！
160,TEXT_BANARK001_04545_KANCANA_000_131,不过……有干劲虽好，但毕竟你们还对工作不熟练，<hex:02100103>最好还是有个能提建议的人在身边比较好。
161,TEXT_BANARK001_04545_KANCANA_000_132,<hex:022903EB0203>，你之前也关照过斡兀立，<hex:02100103>这次能不能也帮帮他们？
162,TEXT_BANARK001_04545_TRNA_000_133,拜托了，<hex:022903EB0203>！<hex:02100103>不管是我还是小弟们，<hex:02100103>都不想再继续做品行不良不合群的人了！
163,TEXT_BANARK001_04545_Q6_000_134,要说什么？
164,TEXT_BANARK001_04545_A6_000_001,看在你的态度上，我愿意帮忙！
165,TEXT_BANARK001_04545_A6_000_002,我感觉有点照顾不过来……
166,TEXT_BANARK001_04545_TRNA_000_135,太感谢了！<hex:02100103>今后请多指教！
167,TEXT_BANARK001_04545_KANCANA_000_136,呵呵呵，别这么说嘛。<hex:02100103>我相信你一定能像帮助斡兀立的时候那样<hex:02100103>正确地指引这些人。
168,TEXT_BANARK001_04545_KANCANA_000_137,既然你们也得到了<hex:022903EB0203>的协助，<hex:02100103>那我就为你们提供可以作为据点使用的场地吧。
169,TEXT_BANARK001_04545_KANCANA_000_138,其实之前有一家因为生意萧条不得不关门的商会<hex:02100103>转让给我一间仓库。
170,TEXT_BANARK001_04545_KANCANA_000_139,虽然位置离大路很近很方便，<hex:02100103>但由于长期没有维护，建筑物都老化了，<hex:02100103>所以需要重新装修，你们正好能按照自己的喜好进行改装。
171,TEXT_BANARK001_04545_MARU_000_140,你真愿意将那么好的地方借给我们用吗？
172,TEXT_BANARK001_04545_KANCANA_000_141,当然我也是要收一点点租金的。<hex:02100103>也就是说如果你们无法赚到足够的费用，<hex:02100103>我就不得不让你们离开了。
173,TEXT_BANARK001_04545_KANCANA_000_142,不过这件事以后再慢慢谈……<hex:02100103>我在地图上已经标好位置了，你们先过去看看。<hex:02100103>如果满意的话，现在就用起来也没问题。
174,TEXT_BANARK001_04545_TRNA_000_143,太好了！感谢你为我们做的一切！
175,TEXT_BANARK001_04545_TRNA_000_144,那我们就赶紧过去看看吧。<hex:02100103>我去叫上其他小弟，到时候在那里汇合！
176,TEXT_BANARK001_04545_KANCANA_000_145,希望荼罗娜他们的事业能够顺利展开。<hex:02100103>如果有什么需要帮忙的事情，<hex:02100103>可以随时来找我。
177,TEXT_BANARK001_04545_MARU_000_146,地方比我想象中的还要大，但是也更破烂。<hex:02100103>虽然我知道我们没资格抱怨，但这也太……
178,TEXT_BANARK001_04545_TRNA_000_150,<hex:022903EB0203>，很高兴看到你过来。
179,TEXT_BANARK001_04545_TRNA_000_151,我和小弟们一起看了一圈，<hex:02100103>说实在的，照目前这个样子这里很难使用下去，<hex:02100103>只能先从要用的地方开始着手修缮……
180,TEXT_BANARK001_04545_MARU_000_152,首先肯定需要一个仓库来保管货物。<hex:02100103>除此之外还要有停放以及维护车辆的地方……
181,TEXT_BANARK001_04545_MARU_000_153,说真的，我到现在都还不是很乐意做这个。<hex:02100103>不过既然大姐头说了要做，我就只好乖乖帮忙了……
182,TEXT_BANARK001_04545_TRNA_000_154,谢谢你，摩罗卢。麻烦你了！
183,TEXT_BANARK001_04545_TRNA_000_155,<hex:022903EB0203>，也要麻烦你多费心，<hex:02100103>今天我们就从飙车族毕业转行做配送服务了！<hex:02100103>你可不要手下留情，尽管教导我们吧！
184,TEXT_BANARK001_04545_TRNA_000_156,啊，这么一来我们至少得有个名号才行。<hex:02100103>嗯……到底该起个什么名字呢。
185,TEXT_BANARK001_04545_MARU_000_157,大姐头，我们还得准备据点呢，哪有时间去想这个啊。<hex:02100103>要不干脆就用我们飙车族时的队名吧？
186,TEXT_BANARK001_04545_TRNA_000_158,说、说的也对。<hex:02100103>那我们河马骑手团配送服务今后将全速前进！
187,TEXT_BANARK001_04545_SYSTEM_000_160,河马骑手团配送服务的据点完成了！<hex:02100103>荼罗娜展现出了全速驰骋的干劲！
188,TEXT_BANARK001_04545_SYSTEM_000_161,可是人们对他们目前的评价仍然是“当地的混混”……<hex:02100103>请运用冒险者的经验与知识指引他们走向成功吧！
189,TEXT_BANARK001_04545_SYSTEM_000_165,与悌阳象族“河马骑手团”之间的关系程度到达了“友好”。<hex:02100103>开启了悌阳象族的友好部族任务。
