key,0,1
155,TEXT_SUBWIL901_04779_RASHAHT_000_133,正是因为有了通信雷波塔破坏作战的合力在前，<hex:02100103>贤者行军行动中各国的配合才能那么顺利，<hex:02100103>同盟军的第一场胜利无疑成了指引我们通往未来的希望。
156,TEXT_SUBWIL901_04779_RASHAHT_000_134,可这一战之后，留给我们的并非只有喜讯。<hex:02100103>我们确实是毁掉了通信雷波塔，但奈尔却突然出现，放话说，<hex:02100103>只要他还活着，他就会完成陨石计划。
157,TEXT_SUBWIL901_04779_RASHAHT_000_135,只要奈尔还活着，卫月坠落的危机就还没有离我们而去……<hex:02100103>他是生活在艾欧泽亚的所有生灵的敌人，各国立刻对他展开了搜索。
158,TEXT_SUBWIL901_04779_RASHAHT_000_136,最终，我们终于在库尔札斯找到了他。<hex:02100103>被派去讨伐他的，是当时最为精锐的战士。<hex:02100103>其中担当头领一职的是谁……
159,TEXT_SUBWIL901_04779_RASHAHT_000_138,<hex:020866E4E94D02FF28>我想就不需要我特地说了吧？<hex:FF37>没错，就是那位人称光之战士的冒险者。<hex:03><hex:02100103>却因为战斗过于激烈，没能明确记录下来，着实非常可惜。<hex:02100103>唯一能够保证的就是，派出去的战士们确实成功击毙了奈尔。
160,TEXT_SUBWIL901_04779_RASHAHT_000_139,然而，就像你们知道的那样，事情到这里并非就完全解决了。<hex:02100103>根据路易索瓦大人的调查结果显示，<hex:02100103>卫月仍然在向着艾欧泽亚坠落。
161,TEXT_SUBWIL901_04779_RASHAHT_000_140,面对这种现状，救世诗盟向各国求援。<hex:02100103>为了防止卫月坠落，施展最后的秘术，<hex:02100103>需要我们控制第七军团聚集的加尔提诺平原。
162,TEXT_SUBWIL901_04779_RASHAHT_000_141,救世诗盟提出了前所未有的计策，他们将通过请神术，<hex:02100103>召唤艾欧泽亚十二神的力量，将卫月推回到天空之上……<hex:02100103>为此，需要我们控制住卫月的最终坠落点。
163,TEXT_SUBWIL901_04779_RASHAHT_000_142,于是，加尔提诺平原之战就这样拉开了帷幕……<hex:02100103>之后发生了什么……你们也是知道的吧。
164,TEXT_SUBWIL901_04779_NANANJI_000_143,漆黑的巨龙巴哈姆特从坠落的卫月之中突然现身，<hex:02100103>将艾欧泽亚全境投入了一片火海之中……<hex:02100103>谁也不曾想过灵灾会以这样的形式发生。
165,TEXT_SUBWIL901_04779_RASHAHT_000_144,没错，但路易索瓦大人发动了秘术之后的事……<hex:02100103>他和巴哈姆特最终经历了什么，<hex:02100103>为什么这片大地会重获新生，却成了无人知晓的谜团。
166,TEXT_SUBWIL901_04779_NANANJI_000_145,灵灾后遗症导致的记忆紊乱吗？<hex:02100103>对了，在临近加尔提诺平原之战的那段时间里，<hex:02100103>你是否知道有和他关系亲密，并与他有过交流的人？
167,TEXT_SUBWIL901_04779_RASHAHT_000_146,路易索瓦大人为了施展秘术，<hex:02100103>一直呆在能够纵览战场的丘陵之上，<hex:02100103>……而我总是冲在最前线作战，所以对他的情况了解不多。
168,TEXT_SUBWIL901_04779_RASHAHT_000_147,这我只能回答你我不知道了。<hex:02100103>抱歉，帮不了你。
169,TEXT_SUBWIL901_04779_NANANJI_000_148,没有没有，能听到这么多贵重的情报，我已经十分感谢你了。<hex:02100103>多亏了你，我才了解了加尔提诺平原一战的始末。
170,TEXT_SUBWIL901_04779_RASHAHT_000_149,那就太好了！<hex:02100103>那么，我就回去工作啦！<hex:02100103>等你写完了传记，可一定要让我拜读一下哦！
171,TEXT_SUBWIL901_04779_NANANJI_000_150,这算是弄明白了整个第七灵灾从头到尾的经过了吧……唔。
172,TEXT_SUBWIL901_04779_NANANJI_000_151,啊，抱歉，我想入神了……<hex:02100103>谢谢你陪我来做采访，多亏了有你在，<hex:02100103>我才能问到这么多当时的消息。
173,TEXT_SUBWIL901_04779_NANANJI_000_152,不过，我还有其他无论如何都想知道的情报。<hex:02100103>有你帮忙的话，也许可以再采访到些别的什么……<hex:02100103>如果你方便的话，请再来找我吧。
