key,0,1
#,,
offset,0,4
int32,str,str
0,TEXT_SUBWIL901_04779_SEQ_00,<hex:024804F201FC03><hex:024904F201FD03>特殊规则： 等级调整<hex:0249020103><hex:0248020103><hex:02100103>恒辉作战总部的纳纳恩吉有一个想法。
1,TEXT_SUBWIL901_04779_SEQ_01,※本任务为<hex:024804F201FC03><hex:024904F201FD03><hex:0249020103><hex:0248020103> 等级调整任务。<hex:02100103><hex:02100103>想要为路易索瓦书写传记的纳纳恩吉拜托冒险者陪他一同前去参访。和东萨纳兰枯骨营地的纳纳恩吉谈谈。
2,TEXT_SUBWIL901_04779_SEQ_02,和纳纳恩吉进行了交谈。前往约定的采访地点——东萨纳兰的跨天桥，在<hex:02280CFF05>EObj<hex:F61EB8D40103>等待。
3,TEXT_SUBWIL901_04779_SEQ_03,在指定地点等待，和霍林·奥布里副耀尉进行了交谈。和格里达尼亚碧企鹅瀑布的纳纳恩吉谈谈。
4,TEXT_SUBWIL901_04779_SEQ_04,和纳纳恩吉进行了交谈，又和希洛·富尔克副牙尉进行了交谈。和利姆萨·罗敏萨黑涡军令部的纳纳恩吉谈谈。
5,TEXT_SUBWIL901_04779_SEQ_05,和纳纳恩吉进行了交谈，又和尔·阿夏正漩校进行了交谈。再次和黑涡军令部附近的纳纳恩吉谈谈。
6,TEXT_SUBWIL901_04779_SEQ_06,和纳纳恩吉进行了交谈。为了书写路易索瓦的传记，他还要继续他的采访之旅。再次和纳纳恩吉谈谈，帮助他进行采访。
7,TEXT_SUBWIL901_04779_SEQ_07,
8,TEXT_SUBWIL901_04779_SEQ_08,
9,TEXT_SUBWIL901_04779_SEQ_09,
10,TEXT_SUBWIL901_04779_SEQ_10,
11,TEXT_SUBWIL901_04779_SEQ_11,
12,TEXT_SUBWIL901_04779_SEQ_12,
13,TEXT_SUBWIL901_04779_SEQ_13,
14,TEXT_SUBWIL901_04779_SEQ_14,
15,TEXT_SUBWIL901_04779_SEQ_15,
16,TEXT_SUBWIL901_04779_SEQ_16,
17,TEXT_SUBWIL901_04779_SEQ_17,
18,TEXT_SUBWIL901_04779_SEQ_18,
19,TEXT_SUBWIL901_04779_SEQ_19,
20,TEXT_SUBWIL901_04779_SEQ_20,
21,TEXT_SUBWIL901_04779_SEQ_21,
22,TEXT_SUBWIL901_04779_SEQ_22,
23,TEXT_SUBWIL901_04779_SEQ_23,
24,TEXT_SUBWIL901_04779_TODO_00,和枯骨营地的纳纳恩吉对话
25,TEXT_SUBWIL901_04779_TODO_01,在<hex:02280CFF05>EObj<hex:F61EB8D40103>等待
26,TEXT_SUBWIL901_04779_TODO_02,和格里达尼亚碧企鹅瀑布的纳纳恩吉对话
27,TEXT_SUBWIL901_04779_TODO_03,和黑涡军令部附近的纳纳恩吉对话
28,TEXT_SUBWIL901_04779_TODO_04,再次和纳纳恩吉对话
29,TEXT_SUBWIL901_04779_TODO_05,
30,TEXT_SUBWIL901_04779_TODO_06,
31,TEXT_SUBWIL901_04779_TODO_07,
32,TEXT_SUBWIL901_04779_TODO_08,
33,TEXT_SUBWIL901_04779_TODO_09,
34,TEXT_SUBWIL901_04779_TODO_10,
35,TEXT_SUBWIL901_04779_TODO_11,
36,TEXT_SUBWIL901_04779_TODO_12,
37,TEXT_SUBWIL901_04779_TODO_13,
38,TEXT_SUBWIL901_04779_TODO_14,
39,TEXT_SUBWIL901_04779_TODO_15,
40,TEXT_SUBWIL901_04779_TODO_16,
41,TEXT_SUBWIL901_04779_TODO_17,
42,TEXT_SUBWIL901_04779_TODO_18,
43,TEXT_SUBWIL901_04779_TODO_19,
44,TEXT_SUBWIL901_04779_TODO_20,
45,TEXT_SUBWIL901_04779_TODO_21,
46,TEXT_SUBWIL901_04779_TODO_22,
47,TEXT_SUBWIL901_04779_TODO_23,
48,TEXT_SUBWIL901_04779_NANANJI_000_001,唔唔唔！这种表情！这种气场……<hex:02100103>还有这种怎么看怎么可靠的感觉！
49,TEXT_SUBWIL901_04779_NANANJI_100_001,这么突然叫住你真是不好意思……你是冒险者吧？<hex:02100103>你应该也听说过“路易索瓦·莱韦耶勒尔”这个名字，<hex:02100103>并且对他有所了解吧？
50,TEXT_SUBWIL901_04779_Q1_000_000,如何作答？
51,TEXT_SUBWIL901_04779_A1_000_001,我当然知道他了
52,TEXT_SUBWIL901_04779_A1_000_002,我还是第一次听说这个人……
53,TEXT_SUBWIL901_04779_NANANJI_000_002,嗯！听你这么说我就更放心了。
54,TEXT_SUBWIL901_04779_NANANJI_000_003,什么？！<hex:02100103>你没听说过那位将艾欧泽亚从灵灾中拯救出来的大贤人吗？！<hex:02100103>算了，没听过也好，全新的视角带来的感想也很宝贵……
55,TEXT_SUBWIL901_04779_NANANJI_000_004,话说还没自我介绍呢……我叫纳纳恩吉·诺诺恩吉，是名新人作家。<hex:02100103>其实我正打算为那位贤人路易索瓦撰写一本传记。<hex:02100103>现在正在调查他在灵灾期间进行的种种活动。
56,TEXT_SUBWIL901_04779_NANANJI_000_005,首先，我申请采访了恒辉队的成员。<hex:02100103>当时艾欧泽亚同盟军邀请了贤者路易索瓦担当军师一职，<hex:02100103>所以我就想现在大国防联军里一定还有一些和他有过接触的人在吧？
57,TEXT_SUBWIL901_04779_NANANJI_000_006,没想到对方真的直接同意了我的采访要求。<hex:02100103>可是说实话，我的采访经验不多……
58,TEXT_SUBWIL901_04779_NANANJI_000_007,我就想着，像你这样的冒险者的话，应该很擅长和人打交道吧？<hex:02100103>所以我去采访的时候，希望你在一边陪着我……<hex:02100103>有人陪着，我感觉上应该就不会那么紧张了……
59,TEXT_SUBWIL901_04779_NANANJI_000_008,并且，如果可以的话，等到我们的采访都结束之后，<hex:02100103>我也想要听听你这样活在当下的冒险者的感想。
60,TEXT_SUBWIL901_04779_NANANJI_000_009,我非常想要写这么一本传记，好把第七灵灾的记忆流传给后世。<hex:02100103>拜托你了，你在我写作的过程里帮了我，<hex:02100103>我肯定会在书里把你的名字写得又大又显眼的！
61,TEXT_SUBWIL901_04779_NANANJI_000_010,太好了！谢谢你！
62,TEXT_SUBWIL901_04779_NANANJI_000_011,那么，我虽然也很想立刻就开始采访，<hex:02100103>但在此之前我们先去一趟东萨纳兰的枯骨营地吧。<hex:02100103>有个地方我想先去一下！
63,TEXT_SUBWIL901_04779_NANANJI_100_013,啊！你来啦！<hex:02100103>那么，就让我来说说拜访这里的原因吧……
64,TEXT_SUBWIL901_04779_NANANJI_000_013,糟了，我在干什么啊，还说要把你的名字写在书里，<hex:02100103>结果却忘了问你名字，请问你叫什么名字？
65,TEXT_SUBWIL901_04779_NANANJI_000_015,什么？<hex:022903EB0203>？<hex:02100103>你莫非是那个……那位英雄<hex:022903EB0203>？
66,TEXT_SUBWIL901_04779_NANANJI_000_016,哎——？！怪不得你看上去这么可靠。<hex:02100103>没想到我会请你这样的人物来陪我采访……<hex:02100103>这可真是意外之喜，我感觉更安心了。
67,TEXT_SUBWIL901_04779_NANANJI_000_017,对了，关于采访的事情，<hex:02100103>我和一位知道当时具体情况的恒辉队军官约好了在这里碰面。
68,TEXT_SUBWIL901_04779_NANANJI_100_017,不过他还要再过一段时间才能完成任务……<hex:02100103>所以我想先去一趟附近的墓地，能请你陪我一起去吗？<hex:02100103>我想让你听听我写传记的动机。
69,TEXT_SUBWIL901_04779_NANANJI_000_018,我的故乡是加尔提诺平原附近的一个小村庄……<hex:02100103>村子在灵灾中被烧成了一片白地，<hex:02100103>我的父母和亲朋好友如今都在这里安眠。
70,TEXT_SUBWIL901_04779_NANANJI_000_019,这也不是什么很少见的事情吧？<hex:02100103>那条从卫月中出现的黑龙释放出来的爆炎<hex:02100103>席卷了艾欧泽亚各地，造成了很大的伤亡和损失。
71,TEXT_SUBWIL901_04779_NANANJI_000_020,不过，那灾难的一天已经过去不止5年了。<hex:02100103>人们已经渐渐放下了灵灾中的种种，学会了向前看。<hex:02100103>最近有些人谈起第七灵灾时，甚至用的是谈论历史的口吻了。
72,TEXT_SUBWIL901_04779_NANANJI_000_021,多亏了来自萨雷安的贤人们预见了灵灾的到来，<hex:02100103>人们才能避开毁灭的宿命，艾欧泽亚也因此而得救，<hex:02100103>迎来第七星历的破晓……
73,TEXT_SUBWIL901_04779_NANANJI_000_022,不过，我认为这样的见解多少有一些违和感，<hex:02100103>无数人的家乡变成了一片白地，又有无数的人失去了生命，<hex:02100103>这样的惨状，又何谈“得救”呢？
74,TEXT_SUBWIL901_04779_NANANJI_000_024,所以我才想要调查贤人路易索瓦，<hex:02100103>想看看大家为什么会说他拯救了艾欧泽亚。<hex:02100103>……然后，我想将调查的结果写下来，也算是给自己一个交代。
75,TEXT_SUBWIL901_04779_NANANJI_000_026,这就是我打算写这本传记的动机。<hex:02100103>你看呢，能明白我的意思吗？
76,TEXT_SUBWIL901_04779_NANANJI_000_027,太好了。<hex:02100103>对了，算是为了之后的采访做准备吧，<hex:02100103>我们来简单地回顾一下贤人路易索瓦和第七灵灾的事吧。
77,TEXT_SUBWIL901_04779_NANANJI_000_028,我们很难准确定义第七灵灾是从何时开始的……<hex:02100103>在普遍认知中，人们会把帝国的“陨石计划”视为一切的导火索。<hex:02100103>“陨石计划”，即令月亮的卫星坠向艾欧泽亚的作战。
78,TEXT_SUBWIL901_04779_NANANJI_000_029,那是发生在第六星历1562年的事了。<hex:02100103>路易索瓦为了对抗加雷马帝国的威胁，<hex:02100103>创立了以拯救艾欧泽亚为目标的秘密组织“救世诗盟”。
79,TEXT_SUBWIL901_04779_NANANJI_000_030,隶属于这个组织的萨雷安贤人们在艾欧泽亚各国游说劝谏，<hex:02100103>促使同盟国重新团结起来一同面对即将到来的危机。
80,TEXT_SUBWIL901_04779_NANANJI_000_031,他们的一大成果就是推动了3大都市国家设立大国防联军。<hex:02100103>“黑涡团”“恒辉队”和“双蛇党”……如今这三个组织的存在，<hex:02100103>都离不开贤人们尽心竭力的奔走。
81,TEXT_SUBWIL901_04779_NANANJI_000_032,之后，时间来到了火药味愈发浓厚、战争一触即发的1572年……<hex:02100103>路易索瓦秘密地来到了格里达尼亚。<hex:02100103>……之后也是他积极与各国对话。
82,TEXT_SUBWIL901_04779_NANANJI_000_033,我们所要走访调查的就是这之后的事情。<hex:02100103>我们现在要采访的是恒辉队当时的冒险者部队窗口负责人。<hex:02100103>他似乎在任务中借助过路易索瓦的帮助。
83,TEXT_SUBWIL901_04779_NANANJI_000_034,我们约好在东北方的跨天桥碰面。<hex:02100103>时间也差不多了，我们快点过去吧。
84,TEXT_SUBWIL901_04779_NANANJI_000_040,约好的会合点应该就是这里啊……
85,TEXT_SUBWIL901_04779_AUBREY_000_041,(-恒辉队军官-)你们好啊，想要采访我的就是你们俩吗？<hex:02100103>真没想到英雄阁下你也在啊。
86,TEXT_SUBWIL901_04779_NANANJI_000_042,初次见面，我叫纳纳恩吉。<hex:02100103><hex:02080DE905FF04>她<hex:FF04>他<hex:03>是陪我来采访你的。<hex:02100103>那个，这次非常感谢你的……
87,TEXT_SUBWIL901_04779_AUBREY_000_043,(-恒辉队军官-)不不，不用这么生疏。<hex:02100103>你想让我的恩人路易索瓦大人的故事准确地流传到后世，<hex:02100103>是我该要谢谢你才对。
88,TEXT_SUBWIL901_04779_AUBREY_000_044,容我重新介绍一下自己，我是霍林·奥布里，请多关照。
89,TEXT_SUBWIL901_04779_NANANJI_000_045,那么，让我们尽快开始采访吧。
90,TEXT_SUBWIL901_04779_NANANJI_000_046,我想问问霍林你是怎样接触到贤人路易索瓦的呢？<hex:02100103>当时他又是以怎样的一种方式，协助大国防联军运作的？
91,TEXT_SUBWIL901_04779_AUBREY_000_047,唔……其实本来大国防联军这些组织，<hex:02100103>就是在以路易索瓦大人为首的救世诗盟推动下建立的。<hex:02100103>但我第一次接触到他本人，是在卫月刚开始变红的时候。
92,TEXT_SUBWIL901_04779_AUBREY_000_049,当时有一个传闻，据说有一位年老的精灵族男性<hex:02100103>带着讨伐蛮神的妙计拜访了格里达尼亚。<hex:02100103>为了占到优势，我们也派遣了一位恒辉队的冒险者前去与他接触。
93,TEXT_SUBWIL901_04779_AUBREY_000_050,我后来听说，<hex:02100103>双蛇党、黑涡团也像我们一样，派遣了冒险者。<hex:02100103>当时的各国之间没有同盟可言，各方都一心想赶在别人前头。
94,TEXT_SUBWIL901_04779_AUBREY_000_051,本来，在当时的各国眼里，<hex:02100103>路易索瓦大人只是“那群研究奇怪预言诗的人”的老大。<hex:02100103>但在得到冒险者的报告之后，对他的评价迅速有了反转。
95,TEXT_SUBWIL901_04779_AUBREY_000_052,报告中提到，路易索瓦大人竟然使用秘术，<hex:02100103>打开了一道通往伊弗利特老巢的大门。<hex:02100103>勇敢的熟练冒险者们才得以完成了弑神的壮举。
96,TEXT_SUBWIL901_04779_AUBREY_000_053,然而，这项壮举的背后却还隐藏着莫大的牺牲。<hex:02100103>还记得，实现了弑神之举的冒险者的报告中是这样写的，<hex:02100103>伊弗利特所在的炎帝陵中到处都是被烈火吞噬的焦黑尸体。
97,TEXT_SUBWIL901_04779_AUBREY_000_054,同时……<hex:02100103>这一次的报告中，还包含另一条惊人的内容。
98,TEXT_SUBWIL901_04779_AUBREY_000_055,加雷马帝国第七军团团长奈尔·范·达纳斯……<hex:02100103>在不久之后会成为艾欧泽亚心腹大患的人突然现身，他对冒险者说，<hex:02100103>“火红的净化之星，即将令这片大地化为焦土”。
99,TEXT_SUBWIL901_04779_AUBREY_000_056,……直到此时我们才终于发现，<hex:02100103>原来卫月的异变，竟是加雷马帝国军的奸计。
100,TEXT_SUBWIL901_04779_NANANJI_000_057,发现“陨石计划”一事，无疑是贤人路易索瓦的大功一件。<hex:02100103>但只有这些情报，<hex:02100103>很难找到应对之法吧？
101,TEXT_SUBWIL901_04779_AUBREY_000_059,你说的没错，这时候我们必须尽快了解这项计划的具体情况和内容。<hex:02100103>因此从这个时候开始直到第七灵灾降临，<hex:02100103>各国都在冒险者的帮助之下，拼命地收集着相关情报。
102,TEXT_SUBWIL901_04779_AUBREY_000_060,一个你们也很熟悉的人，<hex:02100103>天才机械师西德・加隆德在此期间大显身手。<hex:02100103>也是他为我们带来了最为宝贵的情报。
103,TEXT_SUBWIL901_04779_AUBREY_000_061,那可恶的陨石计划的概要。<hex:02100103>帝国人将会使用通信雷波塔作为引导卫月坠落的信标，<hex:02100103>坠落的卫月将会把他们口中的蛮族……我们艾欧泽亚人一网打尽。
104,TEXT_SUBWIL901_04779_AUBREY_000_062,这个故事还有很多我没提到的地方，<hex:02100103>但我知道一个比我更适合为你们介绍后续部分的人。
105,TEXT_SUBWIL901_04779_AUBREY_000_063,如果你们觉得可以的话，我可以替你们问问他是否方便谈话……<hex:02100103>怎么样，你们还准备继续采访吗？
106,TEXT_SUBWIL901_04779_NANANJI_000_064,当然好了！麻烦你了！<hex:02100103>能替我们介绍一下那位就再好不过了！
107,TEXT_SUBWIL901_04779_AUBREY_000_065,我知道了，我会联系蛇巢司令部那边的，对了……<hex:02100103>可以的话，请你们去格里达尼亚的碧企鹅瀑布那边吧。<hex:02100103>我会和他说好，让他在那里和你们会合。
108,TEXT_SUBWIL901_04779_NANANJI_000_066,麻烦你帮这么多忙真不好意思，真是太谢谢你了。<hex:02100103>不过，我能问一句吗，你为什么要帮我们帮到这一步呢？
109,TEXT_SUBWIL901_04779_AUBREY_000_067,这算什么，举手之劳罢了……而且我最开始不就说了吗？<hex:02100103>我很高兴你愿意将人们记忆中的路易索瓦大人记录下来。<hex:02100103>我只是不希望大家遗忘那位将我们三国联系在一起的人而已。
110,TEXT_SUBWIL901_04779_AUBREY_000_068,……那么，我就先走一步回乌尔达哈去了。<hex:02100103>我会继续为你们加油的，愿你们的采访之旅能获得圆满成功。
111,TEXT_SUBWIL901_04779_NANANJI_000_069,原来如此，不论如何，显然在霍林副耀尉眼里，<hex:02100103>贤人路易索瓦是值得这样对待的伟大人物啊……
112,TEXT_SUBWIL901_04779_NANANJI_000_070,不过，没想到霍林副耀尉竟然为我们安排了新的采访渠道。<hex:02100103>接下来要去的目的地是贤人路易索瓦待过的格里达尼亚啊……<hex:02100103>我们快去碧企鹅瀑布吧！
113,TEXT_SUBWIL901_04779_NANANJI_000_080,这里就是碧企鹅瀑布了……虽然没有真的碧企鹅，但确实很漂亮。<hex:02100103>霍林副耀尉替我们征询的人应该快来了，<hex:02100103>我们先等一等吧。
114,TEXT_SUBWIL901_04779_FULKE_000_081,请问，就是二位想要询问路易索瓦大人的经历吗？<hex:02100103>这可真是没想到，英雄阁下竟然也在……<hex:02100103>我是灵灾当时负责双蛇党接待的希洛·富尔克。
115,TEXT_SUBWIL901_04779_FULKE_000_082,请问，就是二位想要询问路易索瓦大人的经历吗？<hex:02100103>这可真是没想到，<hex:020852E1E93601FF4A><hex:020846E3E93680FF3E><hex:022903EB0203><hex:020834E1E93601FF2C><hex:020828E3E93680FF20><hex:02281CFF17>GCRankGridaniaMaleText<hex:E9360103><hex:FF01><hex:03><hex:FF01><hex:03><hex:FF01><hex:03><hex:FF01><hex:03>竟然也在……<hex:02100103>我是灵灾当时负责双蛇党接待的希洛·富尔克。
116,TEXT_SUBWIL901_04779_NANANJI_000_083,我是纳纳恩吉·诺诺恩吉。<hex:02100103>感谢你愿意接受我们的采访。
117,TEXT_SUBWIL901_04779_FULKE_000_085,哪里哪里，我才是承蒙你关照了。
118,TEXT_SUBWIL901_04779_FULKE_100_085,不过，霍林可真是找了个好地方啊……<hex:02100103>要聊路易索瓦大人的话，没有哪个地方比这里更合适了。
119,TEXT_SUBWIL901_04779_FULKE_000_086,灵灾之前，贤人路易索瓦经常滞留在此地陷入沉思。<hex:02100103>格里达尼亚居民对外来者总是保有很强的警戒之心，<hex:02100103>最开始的时候，大家都只敢远远地看着他……
120,TEXT_SUBWIL901_04779_FULKE_000_087,但不知何时，大家就变得愿意主动和他交流搭话了。<hex:02100103>路易索瓦大人会静心聆听他人发言，无论怎样的话题都会认真讨论，<hex:02100103>他还会替人治病疗伤，因此很快在民众间获得了不错的信赖与声誉。
121,TEXT_SUBWIL901_04779_FULKE_000_088,“顾虑自身的安危而见死不救，这是懒惰和不仁。<hex:02100103>我们既然自诩为进步人士，就应该以身作则。”
122,TEXT_SUBWIL901_04779_FULKE_000_089,路易索瓦大人如此说，也是如此做的，<hex:02100103>只要看过他奔走的身影，你就会立刻理解他为什么被称为贤者了。<hex:02100103>……这就是我对他最深刻的印象。
123,TEXT_SUBWIL901_04779_FULKE_000_090,那么……正当各国开始对陨石计划有所了解时，<hex:02100103>位于黑衣森林中的辅城石场水车却突然受到了蛮神迦楼罗的袭击。<hex:02100103>导致众多的士兵与民众遇难。
124,TEXT_SUBWIL901_04779_FULKE_000_092,必须打倒蛮神，神勇队双蛇党出击的同时，<hex:02100103>路易索瓦大人也通过自己的渠道请求了黑涡团、恒辉队派来援军，<hex:02100103>各国最精锐的冒险者齐聚一堂。
125,TEXT_SUBWIL901_04779_FULKE_000_093,这时，路易索瓦大人使用冒险者得来的风神之羽毛，<hex:02100103>施展秘术，打开了通往蛮神老巢的大门，<hex:02100103>才让冒险者们找到机会击败迦楼罗。
126,TEXT_SUBWIL901_04779_FULKE_000_094,但不久之后，我们便发现，蛮神被讨伐之后，<hex:02100103>它们的以太并没能归还大地，而是被卫月所吞噬了。
127,TEXT_SUBWIL901_04779_FULKE_000_097,雪上加霜的是，我们也发现帝国在摩杜纳建立了新的据点，<hex:02100103>认识到事态的严重性之后，嘉恩·艾大人便有了一个提案，<hex:02100103>即实现艾欧泽亚城邦军事同盟……建立艾欧泽亚同盟军。
128,TEXT_SUBWIL901_04779_FULKE_000_099,不过，当时各国的反应并不十分积极。<hex:02100103>首先各国都认为嘉恩·艾大人提出的计划会增加对内的负担，<hex:02100103>各国又都各有谋划，都想在将来的同盟军中为本国争取优势地位。
129,TEXT_SUBWIL901_04779_FULKE_000_100,不过，不久之后，我们就获得了新的情报，<hex:02100103>我们确认到了帝国军正在摩杜纳的新据点内建造通信雷波塔。<hex:02100103>要用通信雷波塔让卫月坠落。
130,TEXT_SUBWIL901_04779_FULKE_000_101,得到这个消息之后，各国的司令部一片哗然。<hex:02100103>毕竟，要想阻止陨石计划成功，<hex:02100103>唯一的办法就是摧毁用于控制卫月的通信雷波塔。
131,TEXT_SUBWIL901_04779_FULKE_000_102,已然落后一步的我们唯有立刻着手反攻……<hex:02100103>为了紧握这一线希望，艾欧泽亚各国组建了同盟军。<hex:02100103>也达成了救世诗盟的多年夙愿。
132,TEXT_SUBWIL901_04779_FULKE_000_103,并且，借此机会，<hex:02100103>同盟军决定邀请路易索瓦大人担当军师，<hex:02100103>从这之后，他就正式负责了为各国首脑建言献策的工作。
133,TEXT_SUBWIL901_04779_NANANJI_000_104,最开始的时候，被人当成了怪人的贤人路易索瓦，<hex:02100103>就是在解决蛮神、调查卫月的过程中得到了人们的信赖。<hex:02100103>最终……推进各国实现了他理想中的同盟体制。
134,TEXT_SUBWIL901_04779_FULKE_000_105,你说的没有错，正是因为有了救世诗盟的活跃，<hex:02100103>我们才避免了在四分五裂的情况下迎来灭顶之灾……<hex:02100103>从这个角度来说，路易索瓦大人无疑是我们的救命恩人。
135,TEXT_SUBWIL901_04779_FULKE_000_106,接下来，这之后通信雷波塔破坏作战的经过，<hex:02100103>如何会演变成在加尔提诺平原展开决战……<hex:02100103>我已经找到了比我更适合告诉你们这些内容的人。
136,TEXT_SUBWIL901_04779_FULKE_000_107,你们要找的她可是当时在最前线奋战过的骁勇战士。<hex:02100103>她是个爽快人，跟你们聊起来一定会很愉快的……<hex:02100103>你们看呢，我替你们联系一下她吧？
137,TEXT_SUBWIL901_04779_NANANJI_000_108,好的！拜托了！<hex:02100103>一而再地麻烦你，真是抱歉。
138,TEXT_SUBWIL901_04779_FULKE_000_109,那就麻烦你们，<hex:02100103>跑一趟利姆萨·罗敏萨的黑涡军令部了。<hex:02100103>愿你能写出一部好传记来。
139,TEXT_SUBWIL901_04779_NANANJI_000_110,一听说我是来采访，大家都十分热情。<hex:02100103>我想这就是贤人路易索瓦的人望，<hex:02100103>或者也许是多亏了你也在陪着我采访吧。
140,TEXT_SUBWIL901_04779_NANANJI_000_111,不管怎么说，这一次的采访里，<hex:02100103>我们触及到了更多关于路易索瓦的事，<hex:02100103>感觉对他的形象……或者说，对他的人格有了一点了解。
141,TEXT_SUBWIL901_04779_NANANJI_000_112,总之，下一个目的地……<hex:02100103>我们现在就出发去利姆萨·罗敏萨的黑涡军令部吧！
142,TEXT_SUBWIL901_04779_NANANJI_000_120,采访的准备都做好了。<hex:02100103>黑涡军令部就在那里，我们过去吧。
143,TEXT_SUBWIL901_04779_RASHAHT_000_121,<hex:022903EB0203>！你好啊！<hex:02100103>还有纳纳恩吉，很高兴认识你。<hex:02100103>就是你们想和当事人谈谈通信雷波塔破坏战吧？
144,TEXT_SUBWIL901_04779_RASHAHT_000_122,<hex:022903EB0203><hex:020831E1E93501FF29><hex:020825E3E93580FF1D><hex:022819FF14>GCRankLimsaMaleText<hex:E9350103><hex:FF01><hex:03><hex:FF01><hex:03>！你好啊！<hex:02100103>还有纳纳恩吉，很高兴认识你。<hex:02100103>就是你们想和当事人谈谈通信雷波塔破坏战吧？
145,TEXT_SUBWIL901_04779_NANANJI_000_123,那个，很抱歉百忙之中来打扰你。<hex:02100103>我想要写一本贤人路易索瓦的传记，<hex:02100103>正在各地采访调查他在第七灵灾前后的经历。
146,TEXT_SUBWIL901_04779_RASHAHT_000_124,希洛·富尔克副牙尉那边已经跟我说过了。<hex:02100103>那么，就由我尔·阿夏略述拙见，讲讲我的经历吧。
147,TEXT_SUBWIL901_04779_RASHAHT_000_125,那么，应该是从，帝国在摩杜纳境内建造了据点开始，对吧？<hex:02100103>其实正式建立艾欧泽亚城邦军事同盟之后不久，<hex:02100103>调查队就报告说发现雷波塔启动了。
148,TEXT_SUBWIL901_04779_RASHAHT_000_126,当时那座据点叫帝国军新堡……<hex:02100103>就是灵灾之后经过第十四军团改造，<hex:02100103>名字换成了帝国中央堡的地方。
149,TEXT_SUBWIL901_04779_RASHAHT_000_127,此时，为了突破帝国戒备森严的封锁线，破坏雷波塔，<hex:02100103>我们艾欧泽亚都市同盟的三国决定建立一条共同战线。<hex:02100103>这是我们的第一次正面决战，各国斗志昂扬。
150,TEXT_SUBWIL901_04779_RASHAHT_000_128,时任军师的路易索瓦大人提出的作战计划非常简单！<hex:02100103>那就是让我们同盟军的主力成为守护据点的主战力，<hex:02100103>再派冒险者精锐以奇兵穿插。
151,TEXT_SUBWIL901_04779_RASHAHT_000_129,也就是说，我们将艾欧泽亚的命运，<hex:02100103>托付给了那些击退了蛮神的冒险者们。
152,TEXT_SUBWIL901_04779_RASHAHT_000_130,隶属于不同国家的我们为了吸引敌方注意，<hex:02100103>在最前线拼死作战，互相支持，互相鼓舞，一步也不曾后退。<hex:02100103>我们可是不能输给冒险者啊！对吧！
153,TEXT_SUBWIL901_04779_RASHAHT_000_131,正在这时，突然传令兵闯了过来，大喊着……<hex:02100103>“通信雷波塔毁了！我们成功了！我们赢了！”<hex:02100103>现在想起这个场景，我还是觉得热血沸腾，非常激动。
154,TEXT_SUBWIL901_04779_RASHAHT_000_132,我们艾欧泽亚人只要齐心协力，<hex:02100103>就算是强大的帝国也奈何不了我们。<hex:02100103>你知道向着国内外证明了这一点，意味着什么吗？
