key,0,1
#,,
offset,0,4
Int32,String,String
0,TEXT_CTSDDD4AENCDAENTALK_00945_AENCDAEN_000_000,如果这一切并不是偶然，<hex:02100103>那朝圣路中一定有一个开始这场葬礼的人，<hex:02100103>并且还能连接教会内外。
1,TEXT_CTSDDD4AENCDAENTALK_00945_AENCDAEN_000_001,总之请您尽力向前探索吧。<hex:02100103>如果见到了疑似幕后黑手的家伙，就来告诉我一声。
2,TEXT_CTSDDD4AENCDAENTALK_00945_AENCDAEN_000_010,之前我说了些莫名其妙的话，<hex:02100103>不过骚动的原因的确被彻底斩断了，这一点毫无疑问。
3,TEXT_CTSDDD4AENCDAENTALK_00945_AENCDAEN_000_011,作为谢礼……好像也谈不上什么谢礼。<hex:02100103>总之我会知无不言，毕竟活了这么多年，<hex:02100103>对那些稀奇古怪的玩意多少有些了解。
4,TEXT_CTSDDD4AENCDAENTALK_00945_AENCDAEN_000_012,嗯……你好像探索到了很远的地方呢。<hex:02100103>看来你也是个不在乎界限的人，<hex:02100103>说不定很有成为<hex:021A020203>“错季花红”<hex:021A020103>的潜力。
5,TEXT_CTSDDD4AENCDAENTALK_00945_AENCDAEN_000_013,你真是个能吃苦头的人类！<hex:02100103>不过，你可千万不要因为习惯了冒险就放松警惕。<hex:02100103>无论是对朝圣路，还是对我们……
6,TEXT_CTSDDD4AENCDAENTALK_00945_Q1_000_020,要做什么？
7,TEXT_CTSDDD4AENCDAENTALK_00945_A1_000_021,关于成就
8,TEXT_CTSDDD4AENCDAENTALK_00945_A1_000_022,领取成就
9,TEXT_CTSDDD4AENCDAENTALK_00945_A1_000_023,听因克·代恩讲故事
10,TEXT_CTSDDD4AENCDAENTALK_00945_A1_000_024,取消
11,TEXT_CTSDDD4AENCDAENTALK_00945_Q2_000_030,想了解什么？
12,TEXT_CTSDDD4AENCDAENTALK_00945_A2_000_031,关于妖灵
13,TEXT_CTSDDD4AENCDAENTALK_00945_A2_000_032,关于你
14,TEXT_CTSDDD4AENCDAENTALK_00945_A2_000_033,关于食罪灵
15,TEXT_CTSDDD4AENCDAENTALK_00945_A2_000_034,关于第10朝圣路的“花人”
16,TEXT_CTSDDD4AENCDAENTALK_00945_A2_000_035,关于第20朝圣路的“得到宽恕的模仿”
17,TEXT_CTSDDD4AENCDAENTALK_00945_A2_000_036,关于第30朝圣路的“得到宽恕的背信”
18,TEXT_CTSDDD4AENCDAENTALK_00945_A2_000_037,关于第40朝圣路的“得到宽恕的天真”
19,TEXT_CTSDDD4AENCDAENTALK_00945_A2_000_038,关于第50朝圣路的“奥格布那巴利”
20,TEXT_CTSDDD4AENCDAENTALK_00945_A2_000_039,关于第60朝圣路的“始祖马利克巨人掌”
21,TEXT_CTSDDD4AENCDAENTALK_00945_A2_000_040,关于第70朝圣路的“得到宽恕的热忱”
22,TEXT_CTSDDD4AENCDAENTALK_00945_A2_000_041,关于第80朝圣路的“得到宽恕的不敬”
23,TEXT_CTSDDD4AENCDAENTALK_00945_A2_000_042,关于第90朝圣路的“马纳果达”
24,TEXT_CTSDDD4AENCDAENTALK_00945_A2_000_043,关于第99朝圣路的“卓异的悲寂”
25,TEXT_CTSDDD4AENCDAENTALK_00945_A2_000_044,取消
26,TEXT_CTSDDD4AENCDAENTALK_00945_AENCDAEN_000_050,你在朝圣路的尽头找到了“光耀圣典”？<hex:02100103>真是怀念啊，过去家家户户都有这本圣典。
27,TEXT_CTSDDD4AENCDAENTALK_00945_AENCDAEN_000_051,虽然如今圣典已经不会再有任何用处，<hex:02100103>但既然你那本是在特殊地方找到的，<hex:02100103>那就很可能依然带有魔力。
28,TEXT_CTSDDD4AENCDAENTALK_00945_AENCDAEN_000_052,不过，上面也可能有仙子族施加的恶作剧。<hex:02100103>总之，你可以把它交给旁边的奥瑟·卫德，<hex:02100103>不论是什么魔力，他都能安全处理好，这玩意做个饰品也挺不错。
29,TEXT_CTSDDD4AENCDAENTALK_00945_SYSTEM_000_053,将朝圣交错路最深处取得的光耀圣典<hex:02100103>交给云村的奥瑟·卫德，<hex:02100103>可以用来交换4种饰品。
30,TEXT_CTSDDD4AENCDAENTALK_00945_SYSTEM_000_054,在持有或者装备上述全部饰品后，<hex:02100103>和因克·代恩对话，<hex:02100103>可以获得成就和特别的道具。
31,TEXT_CTSDDD4AENCDAENTALK_00945_AENCDAEN_000_055,和传言一样，你的背包全被各种东西塞满了。<hex:02100103>我根本塞不进去啊……
32,TEXT_CTSDDD4AENCDAENTALK_00945_SYSTEM_000_056,要想获得成就和特别的道具，<hex:02100103>需要背包保留1格以上的空位。
33,TEXT_CTSDDD4AENCDAENTALK_00945_AENCDAEN_000_057,不错不错……<hex:02100103>戒指、耳坠，妖灵的饰品一应俱全！
34,TEXT_CTSDDD4AENCDAENTALK_00945_AENCDAEN_000_058,要是换个时代、换个地点，<hex:02100103>别人怕不是会说你是个被妖灵下了降头的家伙，<hex:02100103>然后把你排挤在外呢。
35,TEXT_CTSDDD4AENCDAENTALK_00945_AENCDAEN_000_059,妖灵王很喜欢你的这份热情呢。
36,TEXT_CTSDDD4AENCDAENTALK_00945_AENCDAEN_000_060,他还说要再赏你一番功劳。<hex:02100103>于是在城里的宝物库里翻找，<hex:02100103>翻出了一台与光耀教会有关的“光耀吊灯”！
37,TEXT_CTSDDD4AENCDAENTALK_00945_AENCDAEN_000_061,大家一起给它施加了一点妖灵的咒语，<hex:02100103>如今那玩意甚至可以载着人在天上飞来飞去。
38,TEXT_CTSDDD4AENCDAENTALK_00945_AENCDAEN_000_062,骑着吊灯在天上飞，<hex:02100103>听起来简直就像是滑稽的梦话，或者是妖灵们的恶作剧。<hex:02100103>虽说不知道这梦会在何时醒来，但你不妨上去试试看吧。
39,TEXT_CTSDDD4AENCDAENTALK_00945_AENCDAEN_000_070,妖灵究竟是什么……这个问题属实有点难以回答。<hex:02100103>首先，光是“妖灵”的定义，<hex:02100103>每个时代和每个地区就都有不同的答案。
40,TEXT_CTSDDD4AENCDAENTALK_00945_AENCDAEN_000_071,我们水妖族和他们仙子族一直是公认的正宗妖灵，<hex:02100103>而恩莫族和返祖阿马罗则是后来才被归进“妖灵”里的。
41,TEXT_CTSDDD4AENCDAENTALK_00945_AENCDAEN_000_072,总之，“妖灵”的定义非常模糊。<hex:02100103>如果非要下一个定义，<hex:02100103>那大概就是看似人类，却并非人类的奇特生物吧。
42,TEXT_CTSDDD4AENCDAENTALK_00945_AENCDAEN_000_073,这“看似人类”，指的是会不会说话。<hex:02100103>若是只会低吼咆哮，那就只是低级的野兽而已。<hex:02100103>很好判断吧？
43,TEXT_CTSDDD4AENCDAENTALK_00945_AENCDAEN_000_074,难的是“却并非人类”。<hex:02100103>要想判断这一点，就必须定义“什么是人类”！
44,TEXT_CTSDDD4AENCDAENTALK_00945_AENCDAEN_000_075,你真是问了我一个千古难题呀。<hex:02100103>那么我也来问问你吧。<hex:02100103>你敢说自己是一个符合一切定义的人类吗？
45,TEXT_CTSDDD4AENCDAENTALK_00945_AENCDAEN_000_080,我？你对我感兴趣？<hex:02100103>我只是一只人畜无害的小水妖，喜欢看书，但书页太容易受潮，<hex:02100103>我每分每刻都在为这件事烦恼。
46,TEXT_CTSDDD4AENCDAENTALK_00945_AENCDAEN_000_081,水妖水妖，说白了就是水之妖灵。<hex:02100103>我们天生喜欢恶作剧，有事没事就把人类拖到水里玩……<hex:02100103>虽然常常遭到嫌弃，但这其中却有着深刻的缘由。
47,TEXT_CTSDDD4AENCDAENTALK_00945_AENCDAEN_000_082,还记得我之前和你说的，仙子族的诞生过程吗？<hex:02100103>人类小孩在接受洗礼之前死去的话，就会得不到神的引导，<hex:02100103>从而变成仙子族。
48,TEXT_CTSDDD4AENCDAENTALK_00945_AENCDAEN_000_083,而我们水妖族，则是在无人知晓的情况下淹死，<hex:02100103>连悼念都无人悼念的人类变成的。
49,TEXT_CTSDDD4AENCDAENTALK_00945_AENCDAEN_000_084,很孤独吧？<hex:02100103>所以我们才会喜欢把活人拖入淹死我们的那片水里。
50,TEXT_CTSDDD4AENCDAENTALK_00945_AENCDAEN_000_085,爱好那些花里胡哨、阴险恶毒的恶作剧，也算是一种本能。<hex:02100103>就好像在喊“我在这呢，快注意到我吧！”一样。
51,TEXT_CTSDDD4AENCDAENTALK_00945_AENCDAEN_000_086,至于我嘛，我早就不记得自己是在哪里被淹死的了。<hex:02100103>就算想起来了，也肯定找不到尸骨。
52,TEXT_CTSDDD4AENCDAENTALK_00945_AENCDAEN_000_090,变成食罪灵，<hex:02100103>就相当于生命的性质发生了改变。
53,TEXT_CTSDDD4AENCDAENTALK_00945_AENCDAEN_000_091,不仅外表会变成食罪灵的样子，<hex:02100103>根据某些记录，身体内部的结构似乎也会完全改变。<hex:02100103>心灵恐怕也是一样吧……
54,TEXT_CTSDDD4AENCDAENTALK_00945_AENCDAEN_000_092,不过呢，某些“原本”的构造或者习惯，<hex:02100103>有时也会残留下来。
55,TEXT_CTSDDD4AENCDAENTALK_00945_AENCDAEN_000_093,你在朝圣路上遇见了很多颇有特点的食罪灵吧？<hex:02100103>我可以在我知道的范围内，给你介绍一下它们生前的状态。
56,TEXT_CTSDDD4AENCDAENTALK_00945_AENCDAEN_000_094,不过，我对它们的了解并不来自我的亲身经历。<hex:02100103>只是从别人口中听到的老故事，或者是阅览图鉴时得来的知识而已。<hex:02100103>和光耀教会一样，都是些泛滥前留下的、迟早被人遗忘的余痕罢了。
57,TEXT_CTSDDD4AENCDAENTALK_00945_AENCDAEN_000_100,拥有彩虹色叶片的草墩子……<hex:02100103>那应该不是食罪灵，只是个突然变异了的草人。
58,TEXT_CTSDDD4AENCDAENTALK_00945_AENCDAEN_000_101,你可能知道，草人就是被仙子族变成植物的人类。
59,TEXT_CTSDDD4AENCDAENTALK_00945_AENCDAEN_000_102,以前也出现过可以移动或是发出声音的草人，<hex:02100103>但它居然会用压花一样的技巧压扁你，何等旺盛的行动力！
60,TEXT_CTSDDD4AENCDAENTALK_00945_AENCDAEN_000_103,如果它可以靠分株来快速增殖，<hex:02100103>那头顶盛放的花朵岂不是个没用的累赘。<hex:02100103>难道它只是想要打扮自己？
61,TEXT_CTSDDD4AENCDAENTALK_00945_AENCDAEN_000_104,它的行为是那么地像人类，<hex:02100103>发出的话语却与植物的本能无异！<hex:02100103>也许是它当了太久的草人，已经失去了自我了吧……真是可怜！
62,TEXT_CTSDDD4AENCDAENTALK_00945_AENCDAEN_000_110,它原本居住在这片地区的森林深处。<hex:02100103>你看，就和这附近的变种树一样，只是棵会走路的树。
63,TEXT_CTSDDD4AENCDAENTALK_00945_AENCDAEN_000_111,有许多植物、菌类还有小动物共生在它的身体上。<hex:02100103>以前它还有个别的名字，意思是“行走的小森林”。
64,TEXT_CTSDDD4AENCDAENTALK_00945_AENCDAEN_000_112,它神经大条，性格也很悠闲。<hex:02100103>我们水妖一族偶尔也会到它的背上睡个午觉。
65,TEXT_CTSDDD4AENCDAENTALK_00945_AENCDAEN_000_113,然而有一天，它变成了食罪灵……<hex:02100103>所有触碰到它身体的动植物，全都被光侵蚀了。
66,TEXT_CTSDDD4AENCDAENTALK_00945_AENCDAEN_000_114,所以现在它的身上也就只剩下了几具残骸。<hex:02100103>那昔日的小森林，已经毫无生机了……
67,TEXT_CTSDDD4AENCDAENTALK_00945_AENCDAEN_000_120,知道了知道了，是那个总主教吧。<hex:02100103>我去书库给你查了，查的时候不仅一直被恩莫族管理员嫌弃，<hex:02100103>还一直查到了整片地板都跟泡过水一样湿湿嗒嗒才离开。
68,TEXT_CTSDDD4AENCDAENTALK_00945_AENCDAEN_000_121,总主教的人类名字叫做司拉德福特。<hex:02100103>他是迦震族的壮汉，出生于孚布特王国。
69,TEXT_CTSDDD4AENCDAENTALK_00945_AENCDAEN_000_122,他心智坚定，身体也非常强壮。<hex:02100103>为了磨练自己的意志，也从未懈怠过严苛的修行。
70,TEXT_CTSDDD4AENCDAENTALK_00945_AENCDAEN_000_123,再加上他与人为善，性格非常温厚，<hex:02100103>简直就是刚健质朴的代名词。<hex:02100103>成为总主教后，所有人也都非常信赖他。
71,TEXT_CTSDDD4AENCDAENTALK_00945_AENCDAEN_000_124,然而变成食罪灵后，那份诚实反而害了他。<hex:02100103>吟唱了几千几万次的光之颂词已经深深融入了他的意识，<hex:02100103>哪怕失去了心智也依然记得清清楚楚。
72,TEXT_CTSDDD4AENCDAENTALK_00945_AENCDAEN_000_125,结果在那份祈祷的影响下，他体内的光之力被反复增幅。<hex:02100103>最终导致自己成为了极其棘手的食罪灵。
73,TEXT_CTSDDD4AENCDAENTALK_00945_AENCDAEN_000_126,他口中不断颂唱着救赎，可他自己偏偏是没能得到救赎的那一个。<hex:02100103>不过还好有你，他才能在属于他的教会里得到安眠。<hex:02100103>这么看的话，这祈祷也算是没白费……至少我是这么认为的。
74,TEXT_CTSDDD4AENCDAENTALK_00945_AENCDAEN_000_130,据我推测，从第21朝圣路开始，<hex:02100103>你应该是在珂露西亚岛近海的海中教会群里兜兜转转。
75,TEXT_CTSDDD4AENCDAENTALK_00945_AENCDAEN_000_131,那片地区自古以来就很擅长用礁石建造建筑。<hex:02100103>海中教会群就是他们登峰造极的杰作。
76,TEXT_CTSDDD4AENCDAENTALK_00945_AENCDAEN_000_132,透过巨大的玻璃窗，人们可以看见震撼心灵的海中景色！<hex:02100103>一些房间甚至还会引入海水，当作装点内饰的一环。
77,TEXT_CTSDDD4AENCDAENTALK_00945_AENCDAEN_000_133,得到宽恕的天真与它的族群或许是从对应的取水口进来的。
78,TEXT_CTSDDD4AENCDAENTALK_00945_AENCDAEN_000_134,那些家伙明明是食罪灵，却还会耍小聪明联合作战。<hex:02100103>乱七八糟地四处喷水，把猎物逼得无路可逃……<hex:02100103>真是让人不快！
79,TEXT_CTSDDD4AENCDAENTALK_00945_AENCDAEN_000_135,让活人扑通一声掉进水里，可是我们水妖族的拿手好戏！<hex:02100103>海里那些咸到发齁的畜生赶紧滚一边去！
80,TEXT_CTSDDD4AENCDAENTALK_00945_AENCDAEN_000_140,这个世上经常会出现一些比食罪灵还吓人的生物，<hex:02100103>你在第50朝圣路上遇见的奥格布那巴利就是其中之一。<hex:02100103>那家伙自古以来就栖息在安穆·艾兰。
81,TEXT_CTSDDD4AENCDAENTALK_00945_AENCDAEN_000_141,它力大无比，那对翡翠色的大颚一旦刺进地里，<hex:02100103>就算是再坚硬的土地，也能瞬间化为流沙。
82,TEXT_CTSDDD4AENCDAENTALK_00945_AENCDAEN_000_142,或许是它能改变大地中的以太平衡，<hex:02100103>又或许是它能在地底释放冲击波。<hex:02100103>总之各有各的道理，但谁也不知道真实原因到底是怎么回事。
83,TEXT_CTSDDD4AENCDAENTALK_00945_AENCDAEN_000_143,毕竟本来就没多少机会能遇见它，<hex:02100103>就算遇见了，多半也是被拖进流沙里等死。<hex:02100103>想调查？根本不可能！
84,TEXT_CTSDDD4AENCDAENTALK_00945_AENCDAEN_000_144,被活埋在流沙里，光是想想都后背发凉。<hex:02100103>手脚与身体被死死压住，动弹不得，甚至连气都喘不了一口！
85,TEXT_CTSDDD4AENCDAENTALK_00945_AENCDAEN_000_145,同样都是窒息而亡，淹死可比这个轻松多了！<hex:02100103>你要不要来体验一下？<hex:02100103>我可以温柔一点，一辈子可只有一次机会！
86,TEXT_CTSDDD4AENCDAENTALK_00945_AENCDAEN_000_150,这可真是稀罕事情！<hex:02100103>那种怪模怪样的大块头竟然没变成食罪灵，还一直活了下来？！
87,TEXT_CTSDDD4AENCDAENTALK_00945_AENCDAEN_000_151,它在巨人掌里也是体形特别大的个体，<hex:02100103>因此才会被人称为马利克巨人掌，意思是巨人掌中的王。<hex:02100103>不过你遇到的这只之所以被这么叫，其实还有另一桩缘由……
88,TEXT_CTSDDD4AENCDAENTALK_00945_AENCDAEN_000_152,那家伙会割下自己头上的幼苗。<hex:02100103>幼苗落地后会变成它的士兵，多割一些甚至能组成军队！<hex:02100103>简直就像是在玩国王游戏。
89,TEXT_CTSDDD4AENCDAENTALK_00945_AENCDAEN_000_153,不过呢，那些幼苗孱弱得很，随便动几下就枯死了……
90,TEXT_CTSDDD4AENCDAENTALK_00945_AENCDAEN_000_154,头顶的王冠也是它自己做的。<hex:02100103>它会砸碎一些金色矿石，把渣渣糊在上面，<hex:02100103>再贴满亮晶晶的宝石……
91,TEXT_CTSDDD4AENCDAENTALK_00945_AENCDAEN_000_155,简直就是彻头彻尾的自娱自乐之王！<hex:02100103>可它最滑稽的地方，并不是这一点。
92,TEXT_CTSDDD4AENCDAENTALK_00945_AENCDAEN_000_156,下次再遇见它的时候，你可以仔细瞧瞧。<hex:02100103>那家伙的针刺可不光是从头顶射出来，还有屁股呢！
93,TEXT_CTSDDD4AENCDAENTALK_00945_AENCDAEN_000_160,很久以前，在早已覆灭的拿巴示艾兰王国中，<hex:02100103>曾流传过一个广为人知的故事。
94,TEXT_CTSDDD4AENCDAENTALK_00945_AENCDAEN_000_161,沙漠中的一个绿洲小村频频遭到独眼怪的袭击，<hex:02100103>村民们苦不堪言。
95,TEXT_CTSDDD4AENCDAENTALK_00945_AENCDAEN_000_162,那怪物力大无穷，脾气也像沙暴一样喜怒无常。<hex:02100103>凡是被那独眼盯上的人，瞬间就会被火焰吞噬！
96,TEXT_CTSDDD4AENCDAENTALK_00945_AENCDAEN_000_163,人们无计可施，只能眼睁睁地看着物资被掠走。<hex:02100103>直到一名勇敢又聪慧的青年站了出来。<hex:02100103>他斩杀了独眼怪，从它的巢穴带回了所有被掠走的物资。
97,TEXT_CTSDDD4AENCDAENTALK_00945_AENCDAEN_000_164,村子就此重归和平，故事也画上了圆满的句号。<hex:02100103>我想，故事里的独眼怪，<hex:02100103>或许就是你所见到的“得到宽恕的热忱”。
98,TEXT_CTSDDD4AENCDAENTALK_00945_AENCDAEN_000_165,曾经可以烧尽一切的魔眼，<hex:02100103>也已经彻底被光之力侵蚀。
99,TEXT_CTSDDD4AENCDAENTALK_00945_AENCDAEN_000_166,它自古以来就是遭人厌恶的生物。<hex:02100103>如今在沙漠废墟里孤零零地守着空落落的教会，<hex:02100103>真是让人唏嘘啊……
100,TEXT_CTSDDD4AENCDAENTALK_00945_AENCDAEN_000_170,从前，在某个险峻山脉的深处住着一头拥有华丽犄角的野兽。<hex:02100103>它毛色漆黑，仿佛是裁下了夜空的一角披在身上。
101,TEXT_CTSDDD4AENCDAENTALK_00945_AENCDAEN_000_171,如果感知到有生灵在被病痛折磨，<hex:02100103>它便会毫无征兆地现身，静静靠近那可怜的家伙。
102,TEXT_CTSDDD4AENCDAENTALK_00945_AENCDAEN_000_172,然后，那些痛苦的生灵便会宛如坠入梦乡一般，<hex:02100103>安详地离开这个世界。
103,TEXT_CTSDDD4AENCDAENTALK_00945_AENCDAEN_000_173,可若说得直白无情一些，<hex:02100103>那头野兽不过是驱使体内强烈的暗之力，<hex:02100103>让生命瞬间走到尽头罢了。
104,TEXT_CTSDDD4AENCDAENTALK_00945_AENCDAEN_000_174,可即便如此，当时的光耀教会还是视它为不祥之物。<hex:02100103>他们害怕它是光芒无法照亮的阴影。
105,TEXT_CTSDDD4AENCDAENTALK_00945_AENCDAEN_000_175,最终，那头野兽被人从山中强行拖了出来。<hex:02100103>据说被封印到了某个遥远的地方。
106,TEXT_CTSDDD4AENCDAENTALK_00945_AENCDAEN_000_176,之后就像你看到的那样，它变成了食罪灵，<hex:02100103>原本美丽的黑色毛皮，也被光之力彻底染白。
107,TEXT_CTSDDD4AENCDAENTALK_00945_AENCDAEN_000_177,如果它如今会尝试将你引向亡途，<hex:02100103>那或许意味着它体内的黑暗正在逐渐苏醒吧。
108,TEXT_CTSDDD4AENCDAENTALK_00945_AENCDAEN_000_180,你在朝圣路上不断深入，<hex:02100103>走访了各地的光耀教会遗迹。
109,TEXT_CTSDDD4AENCDAENTALK_00945_AENCDAEN_000_181,不过这些遗迹全都在诺弗兰特的土地上，<hex:02100103>其他地区的教会早就被光之泛滥吞没，一点痕迹都没留下。
110,TEXT_CTSDDD4AENCDAENTALK_00945_AENCDAEN_000_182,那么，第81朝圣路之后的地点，具体是哪里的教会呢？
111,TEXT_CTSDDD4AENCDAENTALK_00945_AENCDAEN_000_183,若只看建筑风格，倒是很像雷克兰德的教会。<hex:02100103>那里被视为光耀教会的发源地，<hex:02100103>不仅教会数量多，规模也一个比一个庞大。
112,TEXT_CTSDDD4AENCDAENTALK_00945_AENCDAEN_000_184,可是，为什么那片教会充斥着如此强大的黑暗？<hex:02100103>就算诺弗兰特夺回了黑夜，那也绝非是自然之力可以造就的景象。
113,TEXT_CTSDDD4AENCDAENTALK_00945_AENCDAEN_000_185,还有你在第90朝圣路交战的“马纳果达”……<hex:02100103>就连我也推测不出它的真实来历。
114,TEXT_CTSDDD4AENCDAENTALK_00945_AENCDAEN_000_186,它能同时展开多个魔法阵，操控之余还能接着准备别的招式。<hex:02100103>只有高超的术师才能做到这种高度。
115,TEXT_CTSDDD4AENCDAENTALK_00945_AENCDAEN_000_187,至少单凭本能行动的食罪灵是一定不会这样战斗。
116,TEXT_CTSDDD4AENCDAENTALK_00945_AENCDAEN_000_190,卓异的悲寂……<hex:02100103>很可惜，妖灵王对此只字未提。
117,TEXT_CTSDDD4AENCDAENTALK_00945_AENCDAEN_000_191,那我也就不妄下猜测了吧。<hex:02100103>我可不像旁边那个提儿·麻恩那样喜欢刨根问底。
118,TEXT_CTSDDD4AENCDAENTALK_00945_AENCDAEN_000_192,如果只谈确凿无疑的事，<hex:02100103>那东西的模样宛如食罪灵与暗之异形混合起来了一样。
119,TEXT_CTSDDD4AENCDAENTALK_00945_AENCDAEN_000_193,光与暗本是对立，却也因此互相吸引。<hex:02100103>无论它们各自源自何处，也终究是被彼此的强大引诱而来。
120,TEXT_CTSDDD4AENCDAENTALK_00945_AENCDAEN_000_194,在互相吞噬的过程中，暗之异形取得了上风。<hex:02100103>但对手是同样强大的食罪灵，它也做不到一口吞下！
121,TEXT_CTSDDD4AENCDAENTALK_00945_AENCDAEN_000_195,于是只能停留在半混合的状态。<hex:02100103>在这期间，它们体内的光与暗逐渐中和，化作了稳定的以太，<hex:02100103>使其得以苟延残喘。
122,TEXT_CTSDDD4AENCDAENTALK_00945_AENCDAEN_000_196,所以，只有同时斩杀才能彻底击败它们。<hex:02100103>纵然它们之间没有爱情，可这形态却酷似无法分开的恋人，<hex:02100103>只有一起埋葬，才是唯一的正确答案！
123,TEXT_CTSDDD4AENCDAENTALK_00945_AENCDAEN_000_197,总之，你彻底走完了朝圣之路。<hex:02100103>为长眠其中的死者赐下祝福，送去了终结的康宁。<hex:02100103>最后，且听我这生性饶舌的水妖再呻吟几句吧！
124,TEXT_CTSDDD4AENCDAENTALK_00945_AENCDAEN_000_198,如若觉得这是一段无聊的情节，就请你这样思量！<hex:02100103>鼾息沉沉的短暂歇晌，你经历了大梦一场！<hex:02100103>过往均是幻景的显现，不过是梦中的妄念！
125,TEXT_CTSDDD4AENCDAENTALK_00945_AENCDAEN_000_199,可若觉得这是一出风雅的戏剧，我便会乐得豁亮！<hex:02100103>多谢！多谢！因克·代恩决不忘记大恩！<hex:02100103>去吧！去吧！鄙人拍手祝你旅途坦荡！
