key,0,1
#,,
offset,0,4
int32,str,str
0,TEXT_REGROC2HOUSEFORTEMPSSTEWARD_00275_STEWARD_000_010,啊，<hex:022903EB0203>阁下。<hex:02100103>您要是有什么事，请尽管吩咐……
1,TEXT_REGROC2HOUSEFORTEMPSSTEWARD_00275_STEWARD_000_020,啊，<hex:022903EB0203>阁下。<hex:02100103>阿尔菲诺阁下和塔塔露小姐平安无事我就放心了。<hex:02100103>您要是有什么事，请尽管吩咐……
2,TEXT_REGROC2HOUSEFORTEMPSSTEWARD_00275_STEWARD_000_030,啊，<hex:022903EB0203>阁下。<hex:02100103>我听塔塔露小姐说，您要出发前往西方。<hex:02100103>还请您一路小心……
3,TEXT_REGROC2HOUSEFORTEMPSSTEWARD_00275_STEWARD_000_040,啊，<hex:022903EB0203>阁下。<hex:02100103>我一直担心大家会被卷入这次的暴动骚乱……<hex:02100103>你们没事就好。
4,TEXT_REGROC2HOUSEFORTEMPSSTEWARD_00275_STEWARD_000_050,为什么……会这样……<hex:02100103>呜呜……奥尔什方少爷……
5,TEXT_REGROC2HOUSEFORTEMPSSTEWARD_00275_STEWARD_000_060,我不能一直这么沮丧，<hex:02100103>老爷都已经挺过来，继续向前看了……
6,TEXT_REGROC2HOUSEFORTEMPSSTEWARD_00275_STEWARD_000_061,<hex:022903EB0203>阁下……<hex:02100103>我听说您要再次前往西方。<hex:02100103>请您务必要小心……
7,TEXT_REGROC2HOUSEFORTEMPSSTEWARD_00275_STEWARD_000_070,啊，<hex:022903EB0203>阁下。<hex:02100103>连我这种下人都体会到事情的严重性了。<hex:02100103>……希望您能够平安无事。
8,TEXT_REGROC2HOUSEFORTEMPSSTEWARD_00275_STEWARD_000_080,啊，<hex:022903EB0203>阁下。<hex:02100103>该怎么说呢，总觉得神清气爽的。
9,TEXT_REGROC2HOUSEFORTEMPSSTEWARD_00275_STEWARD_000_081,老爷在考虑要把诸位的英勇事迹整理成书册，留给后人。<hex:02100103>奥尔什方少爷应该也会很高兴吧。
10,TEXT_REGROC2HOUSEFORTEMPSSTEWARD_00275_STEWARD_000_090,毕竟皇都现在人心惶惶……<hex:02100103>我和侍奉福尔唐家的佣人们一起，<hex:02100103>会时刻提高警惕，做好准备应对一切突发状况。
11,TEXT_REGROC2HOUSEFORTEMPSSTEWARD_00275_STEWARD_000_100,竟然会在神圣的伊修加德教皇厅发生劫持人质事件，<hex:02100103>真是前所未闻。<hex:02100103>皇都今后到底会变成什么样子……
12,TEXT_REGROC2HOUSEFORTEMPSSTEWARD_00275_STEWARD_000_110,老爷也很对发生在隼巢的骚乱忧虑不安。<hex:02100103>埃马内兰少爷是个本性善良的孩子，<hex:02100103>他内心一定也非常痛苦吧……
13,TEXT_REGROC2HOUSEFORTEMPSSTEWARD_00275_STEWARD_000_120,恕我冒昧，向您汇报情况……<hex:02100103>奥诺鲁瓦醒来后因为担心埃马内兰少爷，<hex:02100103>光着脚就跑出去了。
14,TEXT_REGROC2HOUSEFORTEMPSSTEWARD_00275_STEWARD_000_121,虽然他还是个很不成熟的佣人，<hex:02100103>不过看来已经找到了想要侍奉终生的主人……<hex:02100103>我们福尔唐家的佣人真的是很幸福啊。
15,TEXT_REGROC2HOUSEFORTEMPSSTEWARD_00275_STEWARD_000_130,祝、祝您旗开得胜……
16,TEXT_REGROC2HOUSEFORTEMPSSTEWARD_00275_STEWARD_000_140,哦，您平安回来了！
17,TEXT_REGROC2HOUSEFORTEMPSSTEWARD_00275_STEWARD_000_150,您回来了，<hex:022903EB0203>阁下。<hex:02100103>哦，您还没习惯我这样向您问候吗？
18,TEXT_REGROC2HOUSEFORTEMPSSTEWARD_00275_STEWARD_000_151,阿图瓦雷尔少爷在继承伯爵之位后<hex:02100103>向我们佣人们说的第一件事就是，<hex:02100103>要我们把您这位“家族的盟友”当做家人一样对待。
19,TEXT_REGROC2HOUSEFORTEMPSSTEWARD_00275_STEWARD_Q1_000_000,想了解什么？
20,TEXT_REGROC2HOUSEFORTEMPSSTEWARD_00275_STEWARD_A1_000_001,你是做什么的？
21,TEXT_REGROC2HOUSEFORTEMPSSTEWARD_00275_STEWARD_A1_000_002,关于福尔唐家
22,TEXT_REGROC2HOUSEFORTEMPSSTEWARD_00275_STEWARD_A1_000_003,关于伊修加德
23,TEXT_REGROC2HOUSEFORTEMPSSTEWARD_00275_STEWARD_A1_000_004,取消
24,TEXT_REGROC2HOUSEFORTEMPSSTEWARD_00275_STEWARD_001_010,我是福尔唐家的总管。<hex:02100103>至于工作内容嘛……
25,TEXT_REGROC2HOUSEFORTEMPSSTEWARD_00275_STEWARD_001_011,除了负责埃德蒙·德·福尔唐伯爵的生活起居，<hex:02100103>主要还有管理福尔唐家的佣人等工作。
26,TEXT_REGROC2HOUSEFORTEMPSSTEWARD_00275_STEWARD_001_012,我已经在福尔唐家工作50年了……<hex:02100103>您要是有什么需要，请尽管吩咐……
27,TEXT_REGROC2HOUSEFORTEMPSSTEWARD_00275_STEWARD_001_020,我是福尔唐家的总管。<hex:02100103>至于工作内容嘛……
28,TEXT_REGROC2HOUSEFORTEMPSSTEWARD_00275_STEWARD_001_021,除了负责阿图瓦雷尔·德·福尔唐伯爵的生活起居，<hex:02100103>主要还有管理福尔唐家的佣人等工作。
29,TEXT_REGROC2HOUSEFORTEMPSSTEWARD_00275_STEWARD_001_022,我已经在福尔唐家工作50年了……<hex:02100103>您要是有什么需要，请尽管吩咐……
30,TEXT_REGROC2HOUSEFORTEMPSSTEWARD_00275_STEWARD_002_010,福尔唐家是建国十二骑士的后代，<hex:02100103>是历史渊源的名门望族，也是伊修加德四大名门之一。
31,TEXT_REGROC2HOUSEFORTEMPSSTEWARD_00275_STEWARD_002_011,正如<hex:022903EB0203>阁下您所知的那样，<hex:02100103>福尔唐家负责管辖库尔札斯中央高地的巨龙首营地。
32,TEXT_REGROC2HOUSEFORTEMPSSTEWARD_00275_STEWARD_002_012,要说福尔唐家的结构嘛……<hex:02100103>首先是身为一家之主的埃德蒙·德·福尔唐伯爵。
33,TEXT_REGROC2HOUSEFORTEMPSSTEWARD_00275_STEWARD_002_013,然后是大少爷阿图瓦雷尔，<hex:02100103>二少爷埃马内兰。
34,TEXT_REGROC2HOUSEFORTEMPSSTEWARD_00275_STEWARD_002_014,另外加上人数众多的骑士和骑兵，<hex:02100103>还有一百多名佣人。
35,TEXT_REGROC2HOUSEFORTEMPSSTEWARD_00275_STEWARD_002_015,福尔唐家上下按照福尔唐伯爵的方针，<hex:02100103>呼吁伊修加德门户开放，积极接纳佣兵和冒险者……
36,TEXT_REGROC2HOUSEFORTEMPSSTEWARD_00275_STEWARD_002_016,这次老爷邀请你们做客，恐怕另有深意。
37,TEXT_REGROC2HOUSEFORTEMPSSTEWARD_00275_STEWARD_002_017,老爷一定是对您抱有期待。<hex:02100103><hex:022903EB0203>阁下，您有能力改变伊修加德的现状……
38,TEXT_REGROC2HOUSEFORTEMPSSTEWARD_00275_STEWARD_002_020,福尔唐家是建国十二骑士的后代，<hex:02100103>是历史渊源的名门望族，也是伊修加德四大名门之一。
39,TEXT_REGROC2HOUSEFORTEMPSSTEWARD_00275_STEWARD_002_021,正如<hex:022903EB0203>阁下您所知的那样，<hex:02100103>福尔唐家负责管辖库尔札斯中央高地的巨龙首营地。
40,TEXT_REGROC2HOUSEFORTEMPSSTEWARD_00275_STEWARD_002_022,要说福尔唐家的结构嘛……<hex:02100103>首先是身为一家之主的阿图瓦雷尔·德·福尔唐伯爵。
41,TEXT_REGROC2HOUSEFORTEMPSSTEWARD_00275_STEWARD_002_023,他的父亲是前代伯爵埃德蒙·德·福尔唐大人，<hex:02100103>他的弟弟埃马内兰少爷作为一名骑士奋战着。
42,TEXT_REGROC2HOUSEFORTEMPSSTEWARD_00275_STEWARD_002_024,另外加上人数众多的骑士和骑兵，<hex:02100103>还有一百多名佣人。
43,TEXT_REGROC2HOUSEFORTEMPSSTEWARD_00275_STEWARD_002_025,福尔唐家上下按照福尔唐伯爵的方针，<hex:02100103>呼吁伊修加德门户开放，积极接纳佣兵和冒险者……
44,TEXT_REGROC2HOUSEFORTEMPSSTEWARD_00275_STEWARD_002_026,这次伯爵邀请你们做客，恐怕另有深意。
45,TEXT_REGROC2HOUSEFORTEMPSSTEWARD_00275_STEWARD_002_027,伯爵一定是对您抱有期待。<hex:02100103><hex:022903EB0203>阁下，您有能力改变伊修加德的现状……
46,TEXT_REGROC2HOUSEFORTEMPSSTEWARD_00275_STEWARD_003_010,伊修加德是国父豪胆将军托尔丹陛下在千年之前创建的，<hex:02100103>是一座拥有悠久历史的城邦。
47,TEXT_REGROC2HOUSEFORTEMPSSTEWARD_00275_STEWARD_003_011,托尔丹陛下受到战神哈罗妮的启示，<hex:02100103>率领族人，来到了神意之地库尔札斯。<hex:02100103>那个时候，阻挡众人的就是邪龙尼德霍格。
48,TEXT_REGROC2HOUSEFORTEMPSSTEWARD_00275_STEWARD_003_012,托尔丹陛下在与邪龙的较量中牺牲了，<hex:02100103>不过他的儿子征龙将哈尔德拉斯等十二骑士坚持奋战，<hex:02100103>最终终于击退了邪龙……
49,TEXT_REGROC2HOUSEFORTEMPSSTEWARD_00275_STEWARD_003_013,从那以后，<hex:02100103>我们伊修加德的人民和龙族之间展开了看不到终点的千年战争。
50,TEXT_REGROC2HOUSEFORTEMPSSTEWARD_00275_STEWARD_003_014,先前的皇都保卫战之后，<hex:02100103>也是史上第一次有龙族入侵到皇都内部。
51,TEXT_REGROC2HOUSEFORTEMPSSTEWARD_00275_STEWARD_003_015,虽然凭借神殿骑士团的活跃表现，<hex:02100103>教皇陛下以及贵族居住的砥柱层得以守护，<hex:02100103>但守备薄弱的基础层却受到了较大的损害。
52,TEXT_REGROC2HOUSEFORTEMPSSTEWARD_00275_STEWARD_003_016,基础层也因此依然留有战争的痕迹。<hex:02100103>那里大多居住着普通市民，所以老爷很是痛心……
53,TEXT_REGROC2HOUSEFORTEMPSSTEWARD_00275_STEWARD_003_020,新的伊修加德……<hex:02100103>要实现那理想中的家园，打破这持续了千年之久的体制，<hex:02100103>想必并不容易。
54,TEXT_REGROC2HOUSEFORTEMPSSTEWARD_00275_STEWARD_003_021,改革伴随着苦痛……<hex:02100103>但是，这苦痛总有一天会消失的。<hex:02100103>那个时候，这个国家才会真正得到重生。
55,TEXT_REGROC2HOUSEFORTEMPSSTEWARD_00275_STEWARD_003_022,在那一天到来之前，我会一直侍奉在福尔唐家，<hex:02100103>和老爷一起支持艾默里克阁下。<hex:02100103>这一定也是奥尔什方少爷的心愿。
56,TEXT_REGROC2HOUSEFORTEMPSSTEWARD_00275_STEWARD_003_030,由贵族中选出的议员组成的上议院，<hex:02100103>和由平民中选出的议员组成的下议院……<hex:02100103>今后皇都转为由这两院引导发展了。
57,TEXT_REGROC2HOUSEFORTEMPSSTEWARD_00275_STEWARD_003_031,在见证了改革踏出的第一步之后，<hex:02100103>埃德蒙老爷正式引退了。<hex:02100103>现在福尔唐家的家主是阿图瓦雷尔少爷……
58,TEXT_REGROC2HOUSEFORTEMPSSTEWARD_00275_STEWARD_003_032,我也在考虑是不是该退休了，<hex:02100103>不过被阿图瓦雷尔少爷强烈挽留了。<hex:02100103>所以我会拼上我这把老骨头，侍奉福尔唐家到最后。
59,TEXT_REGROC2HOUSEFORTEMPSSTEWARD_00275_TALK_ACTOR,（未使用/预计删除）
