key,0,1
#,,
offset,0,4
int32,str,str
0,TEXT_REGOTH4MYCMIKOTO_00659_000_000,从“探觉石”上已经感觉不到力量了。<hex:02100103>就像请神需要以太一样，<hex:02100103>记忆探索也需要“探觉石”这种水晶的力量。
1,TEXT_REGOTH4MYCMIKOTO_00659_000_001,但愿这探觉石能像圣石一样可以充能吧。<hex:02100103>不过目前的原理仍未成功解析……<hex:02100103>得进一步进行研究才行……
2,TEXT_REGOTH4MYCMIKOTO_00659_000_002,我就留在这里继续解析“探觉石”。<hex:02100103>如果有了新的进展再联络你。
3,TEXT_REGOTH4MYCMIKOTO_00659_000_003,请问有什么事情吗？
4,TEXT_REGOTH4MYCMIKOTO_00659_MIKOTO_000_005,博兹雅义军的反击帝国作战终于开始了。<hex:02100103>希望大家都能平安回到甘戈斯。<hex:02100103>冒险者你也不要太勉强自己……祝你旗开得胜！
5,TEXT_REGOTH4MYCMIKOTO_00659_MIKOTO_000_006,请问有什么事情吗？
6,TEXT_REGOTH4MYCMIKOTO_00659_MIKOTO_000_010,虽然我平时总是窝在研究室里，<hex:02100103>但为了尽可能地帮上大家的忙，<hex:02100103>我想学习一些能治疗伤病的魔法。
7,TEXT_REGOTH4MYCMIKOTO_00659_MIKOTO_000_011,请问有什么事情吗？
8,TEXT_REGOTH4MYCMIKOTO_00659_MIKOTO_000_015,我完全没有注意到……<hex:02100103>米希亚心中盘踞着的“黑暗”。<hex:02100103>果然人心是非常复杂的……
9,TEXT_REGOTH4MYCMIKOTO_00659_MIKOTO_000_016,即便第四军团利用了她，<hex:02100103>这一切也都是米希亚自己所期望的。<hex:02100103>我们无论如何也要阻止她才行……
10,TEXT_REGOTH4MYCMIKOTO_00659_MIKOTO_000_017,请问有什么事情吗？
11,TEXT_REGOTH4MYCMIKOTO_00659_MIKOTO_000_020,米希亚用圣剑之力召唤出来的斗神……<hex:02100103>是真正的斗神吗……<hex:02100103>虽然我也说不出个所以然，但总觉得有些奇怪。
12,TEXT_REGOTH4MYCMIKOTO_00659_MIKOTO_000_021,请问有什么事情吗？
13,TEXT_REGOTH4MYCMIKOTO_00659_MIKOTO_000_025,请稍等一下。<hex:02100103>为了能向大家好好说明，我要先组织一下语言。
14,TEXT_REGOTH4MYCMIKOTO_00659_MIKOTO_000_030,恐怕米希亚的下一个目标是……<hex:02100103>不……应该不是……<hex:02100103>不对，果然还是……
15,TEXT_REGOTH4MYCMIKOTO_00659_MIKOTO_000_040,圣剑天佑女王是非常危险的遗物，本应该破坏掉才对，<hex:02100103>但它同时也是博兹雅的至宝，所以只得由我代为保管。<hex:02100103>我和大家商量了一下，决定先将其封印起来。
16,TEXT_REGOTH4MYCMIKOTO_00659_MIKOTO_000_041,至于封印方法，我准备到时候向萨雷安的学者咨询一下……<hex:02100103>总之，圣剑在博兹雅人心中是一个美好的象征，<hex:02100103>我们绝不能让它再次带来灾难。
17,TEXT_REGOTH4MYCMIKOTO_00659_MIKOTO_000_042,请问有什么事情吗？
18,TEXT_REGOTH4MYCMIKOTO_00659_MIKOTO_000_045,冒险者也要去扎杜诺尔高原了吧。<hex:02100103>我也想去为大家贡献一份绵薄之力。
19,TEXT_REGOTH4MYCMIKOTO_00659_MIKOTO_000_050,必须要尽快想办法解决西德先生设置的仿制青龙壁<hex:02100103>今后要如何运用等问题……
20,TEXT_REGOTH4MYCMIKOTO_00659_MIKOTO_000_055,冒险者马上就要去战场了吧。<hex:02100103>在这里你不仅要注意眼前的敌人，<hex:02100103>还得小心来自空中的袭击才行。
21,TEXT_REGOTH4MYCMIKOTO_00659_MIKOTO_000_056,仿制青龙壁的防御效果仅限于这个前哨附近，<hex:02100103>请记住，一旦到了保护伞外面就会成为上空敌人的靶子。<hex:02100103>希望你能平安无事……
22,TEXT_REGOTH4MYCMIKOTO_00659_MIKOTO_000_060,为了确保魔导障壁的强度，<hex:02100103>我们必须要将残留能量引导至<hex:02100103>白沙恩选择的下一个据点的地脉中。
23,TEXT_REGOTH4MYCMIKOTO_00659_MIKOTO_000_061,我已经在地图上做出标记了，<hex:02100103>请去那里设置引导装置。
24,TEXT_REGOTH4MYCMIKOTO_00659_MIKOTO_000_065,冒险者，谢谢你的协助。<hex:02100103>接下来，我们准备对所有地脉进行调查，<hex:02100103>毕竟在毫无意义的地点设置引导装置只会浪费大家的时间。
25,TEXT_REGOTH4MYCMIKOTO_00659_MIKOTO_000_066,请问有什么事情吗？
26,TEXT_REGOTH4MYCMIKOTO_00659_MIKOTO_000_070,虽然很过意不去，但这件事只能拜托冒险者了，<hex:02100103>我们跟你一起去的话反而会拖后腿……<hex:02100103>请你一定要注意安全啊！
27,TEXT_REGOTH4MYCMIKOTO_00659_MIKOTO_000_071,请问有什么事情吗？
28,TEXT_REGOTH4MYCMIKOTO_00659_MIKOTO_000_075,我正在监视设置好的引导装置的情况。<hex:02100103>但愿大家能顺利占据下一个据点，<hex:02100103>也希望你能平安无事。
29,TEXT_REGOTH4MYCMIKOTO_00659_MIKOTO_000_076,请问有什么事情吗？
30,TEXT_REGOTH4MYCMIKOTO_00659_Q30_000_000,想了解什么？
31,TEXT_REGOTH4MYCMIKOTO_00659_A30_000_000,关于“探知师”
32,TEXT_REGOTH4MYCMIKOTO_00659_A30_000_001,关于“探觉石”
33,TEXT_REGOTH4MYCMIKOTO_00659_A30_000_002,关于“记忆”
34,TEXT_REGOTH4MYCMIKOTO_00659_A30_000_003,关于“眺望未来”
35,TEXT_REGOTH4MYCMIKOTO_00659_A30_100_003,关于“斗神天佑女王”
36,TEXT_REGOTH4MYCMIKOTO_00659_A30_101_003,关于“信徒”
37,TEXT_REGOTH4MYCMIKOTO_00659_A30_000_004,关于水琴
38,TEXT_REGOTH4MYCMIKOTO_00659_A30_000_0010,取消
39,TEXT_REGOTH4MYCMIKOTO_00659_Q40_000_000,想了解什么？
40,TEXT_REGOTH4MYCMIKOTO_00659_A40_000_000,关于“眺望未来”之前所展现的内容
41,TEXT_REGOTH4MYCMIKOTO_00659_A40_000_0010,取消
42,TEXT_REGOTH4MYCMIKOTO_00659_MIKOTO_300_200,在第四星历时期，有一群被称为“探知师”的巫师。<hex:02100103>他们使用特殊的水晶进入有心病的患者内心进行治疗。
43,TEXT_REGOTH4MYCMIKOTO_00659_MIKOTO_300_201,在那个时期，不仅是周边各国，就连博兹雅也是部族之间纷争频发，<hex:02100103>再加上干旱、水灾等等自然灾害多发，<hex:02100103>对于博兹雅的人民来说那是一段极为艰苦的日子。
44,TEXT_REGOTH4MYCMIKOTO_00659_MIKOTO_300_202,在这种情况下，随着患有心灵创伤的人不断增加，<hex:02100103>“探知师”这一职业应运而生了。<hex:02100103>这些“探知师”应该都是拥有回溯过去力量的人。
45,TEXT_REGOTH4MYCMIKOTO_00659_MIKOTO_300_203,他们通过接触患者的记忆以太，<hex:02100103>摘除导致心病的心理阴影，<hex:02100103>或将其置换成别的记忆，从而使患者解开心结。
46,TEXT_REGOTH4MYCMIKOTO_00659_MIKOTO_300_204,在现在的萨雷安，<hex:02100103>对记忆以太动手脚可是会被指责存在伦理问题呢。<hex:02100103>我也觉得就算被允许探索记忆，也不该对其肆意篡改。
47,TEXT_REGOTH4MYCMIKOTO_00659_MIKOTO_300_300,通过解析，得知探觉石是人工合成的水晶。<hex:02100103>由于没有证据表明它为此地独有，<hex:02100103>古代博兹雅人推测这是由最初的“探知师”制成的。
48,TEXT_REGOTH4MYCMIKOTO_00659_MIKOTO_300_301,只不过有意思的是，这个被称为“探觉石”的水晶上<hex:02100103>有古代亚拉戈帝国技术的使用痕迹。<hex:02100103>这样的话倒是就说得通了……
49,TEXT_REGOTH4MYCMIKOTO_00659_MIKOTO_300_302,虽然这样说有点失礼，通过调查过去的文献，<hex:02100103>我实在不认为当时的古代博兹雅人具备合成“探觉石”的技术。
50,TEXT_REGOTH4MYCMIKOTO_00659_MIKOTO_300_303,从这里开始只是我的猜测，<hex:02100103>也许有拥有超越之力的古代亚拉戈人在第四灵灾中幸存，<hex:02100103>并对古代亚拉戈帝国引发了第四灵灾抱有罪恶感……
51,TEXT_REGOTH4MYCMIKOTO_00659_MIKOTO_300_304,他为了赎罪来到此地救助其他民族，<hex:02100103>成为了初代的“探知师”——你觉得这种猜想怎么样？<hex:02100103>“探觉石”可能就是他或者他身边的人制造的。
52,TEXT_REGOTH4MYCMIKOTO_00659_MIKOTO_300_305,如果真是这样的话那就很浪漫了……<hex:02100103>啊，抱歉！这只是我的妄想！<hex:02100103>请你忘掉吧……
53,TEXT_REGOTH4MYCMIKOTO_00659_MIKOTO_300_400,将构成生命体的以太粗略进行分类，<hex:02100103>大致有“寄宿在肉体中的生命力”、“辨别个体的灵魂”、<hex:02100103>以及“掌管经验的记忆”这三类。
54,TEXT_REGOTH4MYCMIKOTO_00659_MIKOTO_300_401,比如说，一个人如果只剩下生命力的话，会变成一具行尸走肉，<hex:02100103>如果只剩下灵魂，会变成一个鬼魂。如果灵魂和记忆都还在，<hex:02100103>只是失去了生命力的话，则会变成一个保留有生前记忆的幽灵。
55,TEXT_REGOTH4MYCMIKOTO_00659_MIKOTO_300_402,此次我们使用的秘术，<hex:02100103>就是用“探觉石”抽选出对象的特定记忆以太，<hex:02100103>然后由“探知师”访问该记忆进行探索，提取出需要的情报。
56,TEXT_REGOTH4MYCMIKOTO_00659_MIKOTO_300_403,只不过记忆所记录的情报不一定就是事实真相。<hex:02100103>记忆会随时间的经过而风化、劣化，<hex:02100103>甚至有可能一开始记下的内容就是错误的。
57,TEXT_REGOTH4MYCMIKOTO_00659_MIKOTO_300_404,因此，“无意识间记录的情报”就显得尤为重要了。<hex:02100103>记忆其实分为“主动记录的情报”与“无意识间记录的情报”两种。
58,TEXT_REGOTH4MYCMIKOTO_00659_MIKOTO_300_405,通过回忆能够回想起来的内容是“主动记下的记忆”，<hex:02100103>而无法主动回想起来，<hex:02100103>被无意识间保存下来的情报则是“无意识间记下的记忆”。
59,TEXT_REGOTH4MYCMIKOTO_00659_MIKOTO_300_406,比如想要记住眼前人物的外貌时，<hex:02100103>这个外貌就会保存为“主动记下的记忆”。<hex:02100103>不过，除非记忆力超群，否则很难记住细节。
60,TEXT_REGOTH4MYCMIKOTO_00659_MIKOTO_300_407,可是，进入视野的人物细节以及周边情报<hex:02100103>都会被保存为“无意识间记下的记忆”。<hex:02100103>而且不只视觉情报，味道、气味、温度也会被记录下来。
61,TEXT_REGOTH4MYCMIKOTO_00659_MIKOTO_300_408,表层意识，也就是“主动记录的情报”非常不可信。<hex:02100103>里面夹杂着不经意间记错的情报、故意篡改的情报，<hex:02100103>甚至无视事实强将自身妄想作为记忆保存下来的情报。
62,TEXT_REGOTH4MYCMIKOTO_00659_MIKOTO_300_409,这下你理解为什么我说“无意识间记录的情报”重要了吧。<hex:02100103>“真相”就沉睡在无意识间记录下来的情报当中！
63,TEXT_REGOTH4MYCMIKOTO_00659_MIKOTO_300_500,可以认为是“超越之力”的一种……<hex:02100103>如果说回溯过去是体验他人所经历的过去，<hex:02100103>那眺望未来就是体验今后将要发生的未来。
64,TEXT_REGOTH4MYCMIKOTO_00659_MIKOTO_300_501,你可能会认为这和预知梦或占卜之类的预言一样。<hex:02100103>但通过预言得知的未来也许可以回避，<hex:02100103>而“眺望未来”看到的却是“注定的未来”。
65,TEXT_REGOTH4MYCMIKOTO_00659_MIKOTO_300_502,那是必定发生、无从避免的未来，<hex:02100103>是将来确实存在、确定会发生的事情。<hex:02100103>这就是“眺望未来”。
66,TEXT_REGOTH4MYCMIKOTO_00659_MIKOTO_300_503,路易索瓦大师和于里昂热研究的预言诗«梅萨亚的预言»，<hex:02100103>其作者被认为很可能是这种力量的拥有者。
67,TEXT_REGOTH4MYCMIKOTO_00659_MIKOTO_300_504,“眺望未来”其实是很少发动的。<hex:02100103>而且就算发动了，也不会看到含有决定性重要情报的未来……<hex:02100103>反正我从没看到过与我们的生死有直接关系的未来。
68,TEXT_REGOTH4MYCMIKOTO_00659_MIKOTO_300_505,不过这样倒是值得庆幸呢……<hex:02100103>如果眺望到世界毁灭的未来却又无可奈何，<hex:02100103>说实话我也会很困扰的……
69,TEXT_REGOTH4MYCMIKOTO_00659_MIKOTO_300_506,我曾和别人因为这个闹得非常不愉快，<hex:02100103>明明也不是看到了天崩地裂的大事。<hex:02100103>确实怪我多嘴……反正我不想再重蹈覆辙了。
70,TEXT_REGOTH4MYCMIKOTO_00659_MIKOTO_300_507,啊，请你将我刚才说的话忘掉吧。<hex:02100103>总、总之，我的“眺望未来”基本上是没多大作用的，<hex:02100103>不要对它抱有太大期待比较好。
71,TEXT_REGOTH4MYCMIKOTO_00659_MIKOTO_300_520,毁灭了亚拉戈帝国的第四灵灾也同样席卷了博兹雅。<hex:02100103>根据传说，最后一任女王贡希尔德解放了圣剑之力，<hex:02100103>保护了一小部分博兹雅人民。
72,TEXT_REGOTH4MYCMIKOTO_00659_MIKOTO_300_521,米希亚召唤的蛮神……不，是斗神，<hex:02100103>正是保护了博兹雅人民的圣剑之力，<hex:02100103>也就是斗神天佑女王。
73,TEXT_REGOTH4MYCMIKOTO_00659_MIKOTO_300_522,最后一任女王贡希尔德为了“请神”而牺牲了自己，<hex:02100103>我认为，和那个叫伊塞勒的女性召唤的蛮神希瓦一样，<hex:02100103>斗神天佑女王也是那种附身型蛮神。
74,TEXT_REGOTH4MYCMIKOTO_00659_MIKOTO_300_523,正如冒险者你所看见的那样，<hex:02100103>为政者们畏惧能够自由召唤斗神的女王贡希尔德，<hex:02100103>于是便命令亲卫队女王之刃暗杀了女王……
75,TEXT_REGOTH4MYCMIKOTO_00659_MIKOTO_300_524,因此，最后一任女王贡希尔德的记忆……<hex:02100103>也就是以太的一部分，与圣剑融为了一体。<hex:02100103>据推测，最终应该是圣剑本身化为了斗神。
76,TEXT_REGOTH4MYCMIKOTO_00659_MIKOTO_300_525,我认为这种蛮神出现的形式非常罕见，<hex:02100103>但更让我好奇的是，米希亚竟然可以对其加以控制。<hex:02100103>这很可能与她使用了探觉石有关。
77,TEXT_REGOTH4MYCMIKOTO_00659_MIKOTO_300_526,无论如何，斗神天佑女王还需要进一步研究。<hex:02100103>如果不想办法对付斗神的话，恐怕我们很难取得胜利。
78,TEXT_REGOTH4MYCMIKOTO_00659_MIKOTO_300_530,我之前进行的说明只是推论而已，<hex:02100103>说实话我总觉得哪里有些说不通……<hex:02100103>但我也搞不懂究竟是哪里不对劲。
79,TEXT_REGOTH4MYCMIKOTO_00659_MIKOTO_300_535,探觉石在这次的战斗中被破坏了。<hex:02100103>这样一来，别说是像以前那样作为探知师的工具使用了，<hex:02100103>就连控制女王贡希尔德的幻影应该都做不到了吧。
80,TEXT_REGOTH4MYCMIKOTO_00659_MIKOTO_300_536,但只要圣剑依旧存在，<hex:02100103>就会有恶徒解放圣剑之力，使斗神再度降临的可能性，<hex:02100103>所以我们必须要消灭所有隐患才行。
81,TEXT_REGOTH4MYCMIKOTO_00659_MIKOTO_300_537,说起来，圣剑吸收的最后一任女王的记忆以太，<hex:02100103>也就是那些精神的残渣究竟怎么样了呢？<hex:02100103>没有探觉石的话，我们也就无从知晓了。
82,TEXT_REGOTH4MYCMIKOTO_00659_MIKOTO_300_540,因大量以太和人的祈祷而降临的蛮神或斗神，<hex:02100103>会使用被称为“祝福”的强大力量给人类或兽人“洗脑”。<hex:02100103>信徒就是指那些被洗脑的人。
83,TEXT_REGOTH4MYCMIKOTO_00659_MIKOTO_300_541,信徒的身心都已经属于蛮神，<hex:02100103>自愿过着奴隶一样的生活。<hex:02100103>为了信仰的蛮神，信徒甚至连自己的孩子都会杀掉。
84,TEXT_REGOTH4MYCMIKOTO_00659_MIKOTO_300_542,非常遗憾的是，成为信徒的人没有任何方法可以恢复原样……<hex:02100103>尽管萨雷安正在进行这方面的研究，<hex:02100103>但目前我们还没有办法让信徒恢复。
85,TEXT_REGOTH4MYCMIKOTO_00659_MIKOTO_300_543,这次成为了斗神天佑女王信徒的新生女王之刃们也是如此。<hex:02100103>恐怕我们是无法拯救他们了。
86,TEXT_REGOTH4MYCMIKOTO_00659_MIKOTO_300_544,信徒绝不会容忍与他们的主蛮神为敌的人。<hex:02100103>新生女王之刃们也是一样……<hex:02100103>他们必然会作为斗神天佑女王的先锋部队向我们发动攻击。
87,TEXT_REGOTH4MYCMIKOTO_00659_MIKOTO_301_542,虽然成为信徒的人被认为是无法恢复的，<hex:02100103>但目前，拂晓血盟已经确立了治疗方法，<hex:02100103>并且和东方联盟共享了术式。
88,TEXT_REGOTH4MYCMIKOTO_00659_MIKOTO_300_545,万幸的是，<hex:02100103>冒险者和我这种拥有超越之力的人不会成为蛮神的信徒。
89,TEXT_REGOTH4MYCMIKOTO_00659_MIKOTO_300_546,信徒可以交给白沙恩他们解决，<hex:02100103>但斗神就只能由我们来想办法了。<hex:02100103>这正是拥有光之加护的我们的任务。
90,TEXT_REGOTH4MYCMIKOTO_00659_MIKOTO_300_550,如果能在那些成为信徒的义军士兵们的<hex:02100103>肉体发生变异前抓住他们的话，<hex:02100103>说不定就能让他们恢复原状了。
91,TEXT_REGOTH4MYCMIKOTO_00659_MIKOTO_300_551,但是这种事说着简单，实际做起来应该很难吧……<hex:02100103>要是白沙恩他们因为顾及那些士兵，<hex:02100103>在战斗中反而施展不开拳脚的话，那我岂不是……
92,TEXT_REGOTH4MYCMIKOTO_00659_MIKOTO_300_600,诶——？我、我的事情吗？<hex:02100103>啊？没有别的意思？<hex:02100103>我、我才没有误会呢！是真的！
93,TEXT_REGOTH4MYCMIKOTO_00659_MIKOTO_300_601,那个，我跳级进入萨雷安魔法大学后，<hex:02100103>通过以太学的研究成果取得了贤人的称号，<hex:02100103>后在该大学担任兼课老师。
94,TEXT_REGOTH4MYCMIKOTO_00659_MIKOTO_300_602,已故……贤人穆恩布瑞达是我大学时代的学姐，<hex:02100103>我曾协助她开发以太提取器。<hex:02100103>在同一个研究室，她就像姐姐一样无微不至地照顾我……
95,TEXT_REGOTH4MYCMIKOTO_00659_MIKOTO_300_603,啊……我其实是有姐姐的。<hex:02100103>她跟我是同卵双胞胎，所以年龄外表都一模一样。<hex:02100103>只不过她取得贤人称号后就不知所踪了……
96,TEXT_REGOTH4MYCMIKOTO_00659_MIKOTO_300_604,姐姐的成绩比我要优秀很多，<hex:02100103>可她对萨雷安的体制——<hex:02100103>应该说是对哲学家议会的做事方式极为不满。
97,TEXT_REGOTH4MYCMIKOTO_00659_MIKOTO_300_605,姐姐跟我从小就不是特别亲。<hex:02100103>也许是因为这个，穆恩布瑞达学姐一直非常关照我。<hex:02100103>至今我都无法接受学姐已经去世这件事……
98,TEXT_REGOTH4MYCMIKOTO_00659_MIKOTO_300_606,穆恩布瑞达学姐现在也经常会出现在我的梦里。<hex:02100103>虽然这个学姐只是由存留在我记忆中的情报构成的，<hex:02100103>可她还是会像以前一样满脸笑容地鼓励我安慰我……
99,TEXT_REGOTH4MYCMIKOTO_00659_MIKOTO_300_607,利用“探觉石”的话，是否就能再次见到封存在记忆以太中的学姐，<hex:02100103>跟她亲密畅谈呢……<hex:02100103>可那也终究只是记忆中的学姐，不是她本人了。
100,TEXT_REGOTH4MYCMIKOTO_00659_MIKOTO_300_700,别再说这个话题了……<hex:02100103>虽然那个场景十分凶险，但现在我们对此毫无办法……
101,TEXT_REGOTH4MYCMIKOTO_00659_MIKOTO_300_701,请你千万别告诉别人，拜托了……<hex:02100103>我知道你很担心，可无论我们做出什么对策，<hex:02100103>都无法回避眺望未来所展现的未来……
102,TEXT_REGOTH4MYCMIKOTO_00659_MIKOTO_300_702,而且，这里毕竟是战场，每天都有人丧命于此。<hex:02100103>我也是做好了心理准备才来的，<hex:02100103>因此即便是死在博兹雅，我也没什么可后悔的。
103,TEXT_REGOTH4MYCMIKOTO_00659_MIKOTO_300_703,穆恩布瑞达学姐在生命的最后一刻，肯定也没有任何犹豫……<hex:02100103>如果是你的话，我想……你也一样会坚定地面对。
