key,0,1
#,,
offset,0,4
int32,str,str
0,TEXT_CTSERKEUREKA3KRILE1_00512_KRILE_000_000,感谢你过来。<hex:02100103>那在开始调查前，咱们再确认一下现在的状况吧。
1,TEXT_CTSERKEUREKA3KRILE1_00512_KRILE_000_001,咱们来这里的目的是为了使用原型以太之光。<hex:02100103>这个装置是在大约一千年前，用于进行传送实验时建造的。<hex:02100103>爷爷他们将其移走后当成了观测用的装置。
2,TEXT_CTSERKEUREKA3KRILE1_00512_KRILE_000_002,用这个装置的话，<hex:02100103>不仅能详细验证艾吉卡说的优雷卡谜团与地脉有关联是否正确，<hex:02100103>而且还能顺便使地脉恢复稳定，真是一石二鸟呢。
3,TEXT_CTSERKEUREKA3KRILE1_00512_KRILE_000_003,……好了，我想你也应该理清楚现在的状况了。<hex:02100103>咱们距离爷爷他们所在的总部塔就差一步之遥了。
4,TEXT_CTSERKEUREKA3KRILE1_00512_KRILE_000_004,对了话说回来，你看见艾吉卡了吗？<hex:02100103>我想他差不多该过来了呀……
5,TEXT_CTSERKEUREKA3KRILE1_00512_KRILE_000_005,……话音刚落就来了。<hex:02100103>喂，艾吉卡，你倒是吭一声，别不搭理人啊！
6,TEXT_CTSERKEUREKA3KRILE1_00512_EJIKATSUNJIKA_000_006,嗯，是可露儿和冒险者啊……<hex:02100103>抱歉，我没注意到你们。
7,TEXT_CTSERKEUREKA3KRILE1_00512_KRILE_000_007,真少见啊，你居然在发呆。<hex:02100103>发生了什么事吗？
8,TEXT_CTSERKEUREKA3KRILE1_00512_EJIKATSUNJIKA_000_008,什么事……优……没什么……<hex:02100103>那个、情报……对，因为没有什么新情报呢。
9,TEXT_CTSERKEUREKA3KRILE1_00512_EJIKATSUNJIKA_000_009,没能帮上忙，真是抱歉。<hex:02100103>我会继续调查有关加拉夫大人的封印一事，<hex:02100103>那就再见了。
10,TEXT_CTSERKEUREKA3KRILE1_00512_KRILE_000_010,艾吉卡……他那个状态，估计现在什么也问不出来。<hex:02100103>一旦沉浸在研究中，他总是会变成那样……
11,TEXT_CTSERKEUREKA3KRILE1_00512_KRILE_000_011,算了，他过段时间估计就会好的。<hex:02100103>如果你在探索途中再次遇见他的话，<hex:02100103>请你尽量自然地向他确认一下现状好吗？
12,TEXT_CTSERKEUREKA3KRILE1_00512_KRILE_000_012,那就先聊到这，开始移动吧。<hex:02100103>原型以太之光所在的实验魔器工房<hex:02100103>从据点最里面的大门那里就能过去。
13,TEXT_CTSERKEUREKA3KRILE1_00512_KRILE_000_020,好了，关于地脉的调查结果……<hex:02100103>受到地脉不稳定的影响，虽然没法掌握全貌，<hex:02100103>但基本的情况我还是弄清楚了。
14,TEXT_CTSERKEUREKA3KRILE1_00512_KRILE_000_021,首先，总部塔附近的地脉中的以太量<hex:02100103>已经上升到了无法用常识解释的水平。<hex:02100103>我确认了一下留存下来的资料，才知道从20年前就已经是这样了。
15,TEXT_CTSERKEUREKA3KRILE1_00512_Q1_000_000,要说什么？
16,TEXT_CTSERKEUREKA3KRILE1_00512_A1_000_001,是加拉夫他们造成的吗？
17,TEXT_CTSERKEUREKA3KRILE1_00512_A1_000_002,是自然造成的吗？
18,TEXT_CTSERKEUREKA3KRILE1_00512_KRILE_000_030,这很有可能。<hex:02100103>我想应该就是爷爷他们所做的“逆转流向”，<hex:02100103>导致了地脉的以太量上升。
19,TEXT_CTSERKEUREKA3KRILE1_00512_KRILE_000_040,不对，怎么想这也不太可能是自然现象。<hex:02100103>我想应该是爷爷他们所做的“逆转流向”，<hex:02100103>导致了地脉的以太量上升。
20,TEXT_CTSERKEUREKA3KRILE1_00512_KRILE_000_050,还有……其实接下来要说的才是正题。<hex:02100103>我从总部塔下方的地脉那里<hex:02100103>确认到了类似于蛮神的巨大以太反应。
21,TEXT_CTSERKEUREKA3KRILE1_00512_KRILE_000_051,而且更加糟糕的是这个以太反应还在逐渐增大。<hex:02100103>也就是说它正从地脉中吸取以太，还在不断成长。
22,TEXT_CTSERKEUREKA3KRILE1_00512_KRILE_000_052,从这一观测结果可以推测，<hex:02100103>约20年前爷爷他们将某种东西……<hex:02100103>应该是古代蛮神封印在了总部塔的内部。
23,TEXT_CTSERKEUREKA3KRILE1_00512_KRILE_000_053,再加上你曾经看见的过去的情景中<hex:02100103>爷爷他们说过的话，我想我的推测是正确的。<hex:02100103>但问题是那个蛮神已经开始活性化，封印已经撑不了多久了。
24,TEXT_CTSERKEUREKA3KRILE1_00512_KRILE_000_054,现在防御障壁勉强能够压制蛮神，<hex:02100103>但不断成长的蛮神最终肯定会完全复活的。
25,TEXT_CTSERKEUREKA3KRILE1_00512_KRILE_000_055,……鉴于以上推测，我认为接下来有必要<hex:02100103>以继续进行地脉的稳定化工作为今后的探索方针。<hex:02100103>其理由有两个。
26,TEXT_CTSERKEUREKA3KRILE1_00512_KRILE_000_056,第一是为了摸索对抗古代蛮神的方法。<hex:02100103>想要弄清楚爷爷他们利用“逆转流向”进行封印的方法，<hex:02100103>需要先让地脉稳定下来，才能进行详细的调查。
27,TEXT_CTSERKEUREKA3KRILE1_00512_KRILE_000_057,另一个理由就是不论是对抗蛮神<hex:02100103>还是搜寻委员会的幸存者，最后都得闯入总部塔。<hex:02100103>进不了总部塔内部的话一切都无从谈起。
28,TEXT_CTSERKEUREKA3KRILE1_00512_KRILE_000_058,而且爷爷他们也一定在总部塔等待着救援……<hex:02100103>不管对手是蛮神还是无影，<hex:02100103>爷爷他们是不可能轻易被打败的！
29,TEXT_CTSERKEUREKA3KRILE1_00512_KRILE_000_059,所以请你继续调查异常的结节点，回收魔素石吧。
30,TEXT_CTSERKEUREKA3KRILE1_00512_KRILE_000_060,顺便说一下，目前已经找到了一个魔素石的反应。<hex:02100103>就在冰针东北附近。<hex:02100103>能麻烦你赶紧去跑一趟吗？
31,TEXT_CTSERKEUREKA3KRILE1_00512_KRILE_000_061,谢谢你。<hex:02100103>我想你应该已经习惯优雷卡的探索任务了，<hex:02100103>但毕竟不知道会发生什么，请你多加小心吧。
32,TEXT_CTSERKEUREKA3KRILE1_00512_KRILE_000_070,异常的结节点与魔素石的反应发生在冰针东北。<hex:02100103>你前去回收时请多加小心。
33,TEXT_CTSERKEUREKA3KRILE1_00512_KRILE_000_080,欢迎你回来，看来你回收好魔素石了啊。<hex:02100103>既然魔素板无法嵌入更多的魔素石，<hex:02100103>正好我也有想要调查的东西，能不能先把这个交给我保管？
34,TEXT_CTSERKEUREKA3KRILE1_00512_KRILE_000_081,谢谢你。<hex:02100103>……还有其他异常的结节点和魔素石反应残留，<hex:02100103>要想测定出位置还需要些时间，请你再稍微等等吧。
35,TEXT_CTSERKEUREKA3KRILE1_00512_SYSTEM_000_082,想要推进下一阶段的剧情，<hex:02100103>需要将元素等级提升到38级。
36,TEXT_CTSERKEUREKA3KRILE1_00512_KRILE_000_090,我正在用原型以太之光<hex:02100103>仔细研究你交给我保管的魔素石，<hex:02100103>我想尽全力弄清楚地脉与魔素石之间的因果关系。
37,TEXT_CTSERKEUREKA3KRILE1_00512_KRILE_000_091,当然我也在测定其他魔素石的位置，<hex:02100103>只不过需要点时间，<hex:02100103>不好意思请你再稍微等等吧。
38,TEXT_CTSERKEUREKA3KRILE1_00512_SYSTEM_000_092,想要推进下一阶段的剧情，<hex:02100103>需要将元素等级提升到38级。
39,TEXT_CTSERKEUREKA3KRILE1_00512_KRILE_000_100,啊，你来得正好。<hex:02100103>调查有了新的进展，我跟你说一下吧。
40,TEXT_CTSERKEUREKA3KRILE1_00512_KRILE_000_101,多亏你帮忙从冰针东北回收的魔素石，<hex:02100103>我终于得以详细解析了残存在地脉中的痕迹。<hex:02100103>根据痕迹显示，瓦尔岛果然曾经整岛传送过。
41,TEXT_CTSERKEUREKA3KRILE1_00512_KRILE_000_102,也就是说瓦尔岛的毁灭不是因为魔法攻击，<hex:02100103>而是因为类似于传送、返回的空间转移类魔法造成的。
42,TEXT_CTSERKEUREKA3KRILE1_00512_KRILE_000_103,不对，这哪能称得上是魔法，实在是太过乱来了，<hex:02100103>因为完全没考虑过传送后该怎么办，<hex:02100103>所以物质没能正确地重新构成，从而变得一团糟。
43,TEXT_CTSERKEUREKA3KRILE1_00512_KRILE_000_104,地脉和属性之力的混乱、环境的急剧变化、<hex:02100103>魔素石和文理碎晶等都是因此形成的，<hex:02100103>想必魔物的变异和妖异的闯入也是受到了这件事的影响。
44,TEXT_CTSERKEUREKA3KRILE1_00512_KRILE_000_105,到底是谁出于何种目的，进行了这种传送……<hex:02100103>要想知道答案，看来只能继续探索优雷卡了。
45,TEXT_CTSERKEUREKA3KRILE1_00512_KRILE_000_106,因此我想请你再次去回收魔素石。<hex:02100103>不过测定出位置需要些时间……<hex:02100103>所以呢，在这段时间能不能帮我做些别的事？
46,TEXT_CTSERKEUREKA3KRILE1_00512_KRILE_000_107,德雷克想到了文理融合器的改良方案。<hex:02100103>我想这对今后的探索肯定有所帮助，你就去找他谈谈吧。<hex:02100103>拜托你了！
47,TEXT_CTSERKEUREKA3KRILE1_00512_KRILE_000_110,将整个岛屿传送走的魔法……<hex:02100103>也有可能这次传送是瓦尔岛为了躲避<hex:02100103>与“究极”魔法相当的强力攻击而采取的紧急措施……
48,TEXT_CTSERKEUREKA3KRILE1_00512_KRILE_000_112,啊，抱歉。<hex:02100103>要弄清魔素石的位置还需要些时间。<hex:02100103>你就趁着这段时间帮帮德雷克吧。
49,TEXT_CTSERKEUREKA3KRILE1_00512_KRILE_000_120,辛苦你了。<hex:02100103>看来文理融合器改良成功了啊。
50,TEXT_CTSERKEUREKA3KRILE1_00512_KRILE_000_121,我这边也让你久等了，<hex:02100103>我终于确定魔素石的位置了。
51,TEXT_CTSERKEUREKA3KRILE1_00512_KRILE_000_123,接下来这个魔素石好像在耐热实验场。<hex:02100103>不好意思，老是让你东奔西跑的，<hex:02100103>但还是麻烦你再去回收一下。
52,TEXT_CTSERKEUREKA3KRILE1_00512_KRILE_000_130,魔素石的反应出现在耐热实验场。<hex:02100103>不好意思，老是让你东奔西跑的，<hex:02100103>但还是麻烦你去回收一下。
53,TEXT_CTSERKEUREKA3KRILE1_00512_KRILE_000_140,欢迎回来！<hex:02100103>我很高兴能看到你平安回来。<hex:02100103>你找到魔素石了吗？
54,TEXT_CTSERKEUREKA3KRILE1_00512_KRILE_000_141,辛苦你了。<hex:02100103>这个魔素石交给我来调查吧。<hex:02100103>……哎呀，你还遇到其他什么事了吗？
55,TEXT_CTSERKEUREKA3KRILE1_00512_KRILE_000_142,创神“优雷卡”……<hex:02100103>艾吉卡是这样说的啊。
56,TEXT_CTSERKEUREKA3KRILE1_00512_KRILE_000_143,……在瓦尔岛消失前，<hex:02100103>我在委员会的同事拉哈还有爷爷和我三个人，<hex:02100103>一起讨论过有关水晶塔的事情。
57,TEXT_CTSERKEUREKA3KRILE1_00512_KRILE_000_144,那个时候拉哈向爷爷问过，<hex:02100103>传承中记载的用于封印危险武器的禁地地下迷宫，<hex:02100103>是否真的存在于水晶塔的地下。
58,TEXT_CTSERKEUREKA3KRILE1_00512_KRILE_000_145,爷爷回答说优雷卡不在那里。<hex:02100103>那时候爷爷的表情非常凝重……所以我记得很清楚。
59,TEXT_CTSERKEUREKA3KRILE1_00512_KRILE_000_146,所以当罗薇娜小姐让我为这座岛屿命名时，<hex:02100103>我下意识地回答出了优雷卡这个名字……
60,TEXT_CTSERKEUREKA3KRILE1_00512_KRILE_000_147,当时爷爷用了代指人而不是代指物的称呼来称呼优雷卡……<hex:02100103>我本来以为那只是爷爷的口误，现在看来并不是那样。
61,TEXT_CTSERKEUREKA3KRILE1_00512_KRILE_000_148,……总之，辛苦你了。<hex:02100103>测定出下一个魔素石的位置还需要些时间，<hex:02100103>过段时间你再来找我吧。
62,TEXT_CTSERKEUREKA3KRILE1_00512_SYSTEM_000_149,想要推进下一阶段的剧情，<hex:02100103>需要将元素等级提升到40级。
63,TEXT_CTSERKEUREKA3KRILE1_00512_KRILE_000_150,话说回来，你和拉哈……<hex:02100103>古·拉哈·提亚一起调查过水晶塔是吧？<hex:02100103>我看过诺亚的报告书。
64,TEXT_CTSERKEUREKA3KRILE1_00512_KRILE_000_151,他曾经一直寻找自己出生的意义，<hex:02100103>但托你的福他总算了结那段因缘。
65,TEXT_CTSERKEUREKA3KRILE1_00512_KRILE_000_152,好了，为了不让拉哈看笑话，我也得努力才行！<hex:02100103>创神优雷卡……无论如何都要找出对抗它的方法，<hex:02100103>解救爷爷他们！
66,TEXT_CTSERKEUREKA3KRILE1_00512_KRILE_000_160,创神优雷卡……为了解开这座岛屿的谜团，解救爷爷他们，<hex:02100103>无论如何都要找出对抗的方法。<hex:02100103>请你也多多帮忙。
67,TEXT_CTSERKEUREKA3KRILE1_00512_SYSTEM_000_170,想要推进下一阶段的剧情，<hex:02100103>需要将元素等级提升到40级。
68,TEXT_CTSERKEUREKA3KRILE1_00512_KRILE_000_180,……那个，我想问你一下。<hex:02100103>你是不是从别的地点回收到了魔素石啊？
69,TEXT_CTSERKEUREKA3KRILE1_00512_KRILE_000_181,实际上现在那些还没有测定出位置的<hex:02100103>异常的结节点都接连消失了，<hex:02100103>地脉也逐渐恢复了稳定。
70,TEXT_CTSERKEUREKA3KRILE1_00512_KRILE_000_182,魔素石是不太可能自然消失的，<hex:02100103>那肯定是有人回收了魔素石。<hex:02100103>而这个人要不是你的话……莫非是艾吉卡干的吗？
71,TEXT_CTSERKEUREKA3KRILE1_00512_KRILE_000_183,嗯……总觉得有些不对劲，<hex:02100103>也弄不明白他到底是怎么想的……<hex:02100103>总之你就先继续回收魔素石吧。
72,TEXT_CTSERKEUREKA3KRILE1_00512_KRILE_000_184,下一个魔素石的反应发生在火岩溶洞西侧。<hex:02100103>麻烦你去回收一下。
73,TEXT_CTSERKEUREKA3KRILE1_00512_KRILE_000_190,异常的结节点在火岩溶洞西侧。<hex:02100103>虽然艾吉卡的动向让人很在意，<hex:02100103>但还是请你先去回收魔素石。
74,TEXT_CTSERKEUREKA3KRILE1_00512_KRILE_000_200,欢迎回来，你顺利回收到魔素石了啊。<hex:02100103>那就先把魔素石交给我保管吧？
75,TEXT_CTSERKEUREKA3KRILE1_00512_KRILE_000_201,谢谢啦，这样算上艾吉卡回收的那些魔素石，<hex:02100103>涌火地带的地脉已经变得相当稳定了呢。<hex:02100103>这样一来关于“让流向逆转”的方法，我也有了眉目。
76,TEXT_CTSERKEUREKA3KRILE1_00512_KRILE_000_202,再给我一点时间用来验证的话，<hex:02100103>我感觉差不多就能找出答案了。<hex:02100103>你就等着我的好消息吧。
77,TEXT_CTSERKEUREKA3KRILE1_00512_SYSTEM_000_203,想要推进下一阶段的剧情，<hex:02100103>需要将元素等级提升到45级。
78,TEXT_CTSERKEUREKA3KRILE1_00512_KRILE_000_210,还差一点就能弄清楚“让流向逆转”的方法了。<hex:02100103>再给我一些时间验证的话，一定会找出答案的。<hex:02100103>你就等着我的好消息吧。
79,TEXT_CTSERKEUREKA3KRILE1_00512_SYSTEM_000_211,想要推进下一阶段的剧情，<hex:02100103>需要将元素等级提升到45级。
80,TEXT_CTSERKEUREKA3KRILE1_00512_KRILE_000_500,……我终于弄清楚了，<hex:02100103>我终于弄清楚爷爷提到的“让流向逆转”的方法了，<hex:02100103>答案原来就在地脉上面！
81,TEXT_CTSERKEUREKA3KRILE1_00512_KRILE_000_501,爷爷他们将地脉看作是魔纹，并描绘魔法阵。<hex:02100103>利用瓦尔岛整体构筑出了巨大的术式，<hex:02100103>想必应该称为地脉纹式封印术吧。
82,TEXT_CTSERKEUREKA3KRILE1_00512_KRILE_000_502,而且我也弄清了这个封印术的效果。<hex:02100103>这个封印术就是将封印在中央岛的蛮神以太进行转换，<hex:02100103>并使其流入地脉，最终蛮神会因为以太枯竭而被消灭。
83,TEXT_CTSERKEUREKA3KRILE1_00512_KRILE_000_503,也就是说整个岛屿就像是一个魔素板，<hex:02100103>不，连术式的原理都一样，<hex:02100103>所以不能说是像，而应该说就是魔素板。
84,TEXT_CTSERKEUREKA3KRILE1_00512_KRILE_000_504,这个封印术虽然还在运转，<hex:02100103>但因为地脉的不稳定，现在的效果也变得很弱，<hex:02100103>如果修好的话，应该能成为对抗创神优雷卡的手段。
85,TEXT_CTSERKEUREKA3KRILE1_00512_KRILE_000_505,那么关于修复方法，<hex:02100103>第一步是要让地脉恢复稳定，<hex:02100103>多亏了你的努力，这个目标已经完成得差不多了。
86,TEXT_CTSERKEUREKA3KRILE1_00512_KRILE_000_506,之后就是这里也有像恒冰地带那样，<hex:02100103>地脉的流向发生了变化的地点，<hex:02100103>为此需要配合地脉的流向对术式的基点进行重新调整。
87,TEXT_CTSERKEUREKA3KRILE1_00512_KRILE_000_507,这边才是问题所在……<hex:02100103>我无法得知术式的基点究竟是什么。<hex:02100103>要是魔素板的话，那肯定是以魔素石为基点……
88,TEXT_CTSERKEUREKA3KRILE1_00512_KRILE_000_508,但考虑到术式规模，一定是比魔素石要大很多的水晶，<hex:02100103>在涌火地带设置的数量应该有4个才对。<hex:02100103>……你有没有什么头绪啊？
89,TEXT_CTSERKEUREKA3KRILE1_00512_Q10_000_000,如何作答？
90,TEXT_CTSERKEUREKA3KRILE1_00512_A10_000_001,以太之光
91,TEXT_CTSERKEUREKA3KRILE1_00512_A10_000_002,据点里的大水晶
92,TEXT_CTSERKEUREKA3KRILE1_00512_KRILE_000_510,以太之光？
93,TEXT_CTSERKEUREKA3KRILE1_00512_KRILE_000_511,据点里的大水晶……<hex:02100103>也就是以太之光吧？
94,TEXT_CTSERKEUREKA3KRILE1_00512_KRILE_000_512,……对啊，就是以太之光啊！<hex:02100103>就算不使用专用的结晶体，也可以拿以太之光来代用！<hex:02100103>还能利用传送网来隐藏封印术，真是一石二鸟呢！
95,TEXT_CTSERKEUREKA3KRILE1_00512_KRILE_000_513,呵呵，看来我的思考模式有些僵硬了呢。<hex:02100103>能和你聊聊真是太好了。
96,TEXT_CTSERKEUREKA3KRILE1_00512_KRILE_000_514,地、地震？！<hex:02100103>……不对啊，这种摇晃的方式不像是地震。
97,TEXT_CTSERKEUREKA3KRILE1_00512_KRILE_000_515,地脉在动摇……<hex:02100103>这是纯粹以太的冲击波……<hex:02100103>这个感觉……是来自原型以太之光的方向！
98,TEXT_CTSERKEUREKA3KRILE1_00512_KRILE_000_516,原型以太之光停止了运转……<hex:02100103>到底是怎么回事？
99,TEXT_CTSERKEUREKA3KRILE1_00512_EJIKATSUNJIKA_000_517,(-？？？？-)你们来了啊……<hex:02100103>来得够快的啊。
100,TEXT_CTSERKEUREKA3KRILE1_00512_KRILE_000_518,艾吉卡……<hex:02100103>这到底是什么情况？
101,TEXT_CTSERKEUREKA3KRILE1_00512_EJIKATSUNJIKA_000_519,看了还不明白吗，蠢货。<hex:02100103>我刚刚将这个原型以太之光……<hex:02100103>这个碍事的术式的基点破坏完啊。
102,TEXT_CTSERKEUREKA3KRILE1_00512_KRILE_000_520,你说破坏？！<hex:02100103>你能不能……说明一下？
103,TEXT_CTSERKEUREKA3KRILE1_00512_EJIKATSUNJIKA_000_521,哼，迟钝的家伙。<hex:02100103>就是这回事啊。
104,TEXT_CTSERKEUREKA3KRILE1_00512_EUREKAPERSON_000_522,拥有善良之心的传承者啊……<hex:02100103>可憎的枷锁……已经解开……<hex:02100103>遵从契约……授予汝想要的力量……
105,TEXT_CTSERKEUREKA3KRILE1_00512_EJIKATSUNJIKA_000_523,这把剑……斩断以太之刃……<hex:02100103>原来如此，和我要求的一样。<hex:02100103>这样一来，所有的条件就都凑齐了。
106,TEXT_CTSERKEUREKA3KRILE1_00512_EJIKATSUNJIKA_000_524,冒险者，我终于得到了特别的力量……<hex:02100103>可以一决胜负的力量。<hex:02100103>呵呵呵……此刻我的心情比预想的还要激动啊。
107,TEXT_CTSERKEUREKA3KRILE1_00512_KRILE_000_525,你、你给我等一下！<hex:02100103>你到底在说什么。
108,TEXT_CTSERKEUREKA3KRILE1_00512_EJIKATSUNJIKA_000_526,那我就跟你直说了。<hex:02100103>我成为了这个家伙的主人，<hex:02100103>创神优雷卡终端的主人。
109,TEXT_CTSERKEUREKA3KRILE1_00512_EUREKAPERSON_000_527,(-创神优雷卡终端-)就是这样……令人厌恶的光之拥有者……<hex:02100103>再也不能像过去那样……将我封印了……<hex:02100103>我的传承者……将会消灭邪恶……
110,TEXT_CTSERKEUREKA3KRILE1_00512_KRILE_000_528,啊，艾吉卡……你……<hex:02100103>难道被精炼了……
111,TEXT_CTSERKEUREKA3KRILE1_00512_EJIKATSUNJIKA_000_529,哈，你说的蠢话真让我目瞪口呆啊，可露儿。<hex:02100103>我在总部塔安置创神的地方等你们。<hex:02100103>时间不多了……恭候大驾哦？
112,TEXT_CTSERKEUREKA3KRILE1_00512_KRILE_000_530,艾吉卡，你等一下！
113,TEXT_CTSERKEUREKA3KRILE1_00512_KRILE_000_531,到底怎么回事啊……
114,TEXT_CTSERKEUREKA3KRILE1_00512_KRILE_000_532,没戏了……外部姑且不论，内部的损伤实在太重了……<hex:02100103>这样的原型以太之光是无法使用的……
115,TEXT_CTSERKEUREKA3KRILE1_00512_KRILE_000_533,要想进行修理，需要萨雷安本土水准的尖端设施才行……<hex:02100103>我们不具备这种条件，所以原型以太之光已经<hex:02100103>实质上等于完全被破坏掉了。而且……
116,TEXT_CTSERKEUREKA3KRILE1_00512_KRILE_000_534,爷爷他们施加的封印术也完全停止运转了。<hex:02100103>看来是没能承受住刚才原型以太之光被破坏时<hex:02100103>产生的那次好似地震的地脉冲击。
117,TEXT_CTSERKEUREKA3KRILE1_00512_KRILE_000_535,结果创神优雷卡从地脉吸收的以太量又增大了。<hex:02100103>抑制其行动的防御障壁也撑不了多久了……
118,TEXT_CTSERKEUREKA3KRILE1_00512_KRILE_000_536,他……变成信徒了吗……
119,TEXT_CTSERKEUREKA3KRILE1_00512_KRILE_000_537,艾吉卡是不可能主动去解放创神的啊。<hex:02100103>而且还说什么主人……
120,TEXT_CTSERKEUREKA3KRILE1_00512_KRILE_000_538,啊，真是最糟糕的状况，弄得我晕头转向。<hex:02100103>好不容易才看见了希望……<hex:02100103>我到底该怎么办才好啊……爷爷……
121,TEXT_CTSERKEUREKA3KRILE1_00512_KRILE_000_550,……哎，太累了。<hex:02100103>没想到实验一做就是一整夜。
122,TEXT_CTSERKEUREKA3KRILE1_00512_EJIKATSUNJIKA_000_551,哼，这种程度就开始抱怨啊。
123,TEXT_CTSERKEUREKA3KRILE1_00512_KRILE_000_552,你呀……<hex:02100103>我这么累，有一部分原因也是因为你说明不足导致的哦？
124,TEXT_CTSERKEUREKA3KRILE1_00512_EJIKATSUNJIKA_000_553,我已经跟你做过最低限度的说明了。<hex:02100103>而且你每次自由发挥做出的成果<hex:02100103>都会比听别人多嘴做出的成果更好，不是吗？
125,TEXT_CTSERKEUREKA3KRILE1_00512_KRILE_000_554,我指的不是这个……<hex:02100103>哎，算了吧。<hex:02100103>这时候对你说什么都没用对吧。
126,TEXT_CTSERKEUREKA3KRILE1_00512_EJIKATSUNJIKA_000_555,你要是这么不愿意，直接拒绝不就完了。<hex:02100103>又不是非得要你帮忙才行。
127,TEXT_CTSERKEUREKA3KRILE1_00512_KRILE_000_556,明明是你从刚一开始就直接来求我的，你可真会说啊。<hex:02100103>……不过你说的没错，<hex:02100103>讨厌的事情真应该拒绝呢。
128,TEXT_CTSERKEUREKA3KRILE1_00512_EJIKATSUNJIKA_000_556,我本以为你很蠢，没想到蠢到这个地步……<hex:02100103>你难道是不愿意但还是来帮忙了？
129,TEXT_CTSERKEUREKA3KRILE1_00512_KRILE_000_557,嗯……倒不是不愿意，只是嫌麻烦。<hex:02100103>这回是说明也不足，要做的事情也多，而且还挺难……
130,TEXT_CTSERKEUREKA3KRILE1_00512_KRILE_000_558,但你绝不做错事。<hex:02100103>所以我认为这还是值得我帮忙，并且很有意义。
131,TEXT_CTSERKEUREKA3KRILE1_00512_EJIKATSUNJIKA_000_559,哼……无法理解你呢。
132,TEXT_CTSERKEUREKA3KRILE1_00512_GALUFBALDESION_000_560,可露儿还有艾吉卡，你们俩的关系是真好啊。
133,TEXT_CTSERKEUREKA3KRILE1_00512_KRILE_000_561,(-可露儿和艾吉卡-)才不是呢！
134,TEXT_CTSERKEUREKA3KRILE1_00512_KRILE_000_610,请再给我一些时间。<hex:02100103>我需要重新整理一下现况，考虑一下能做点什么。<hex:02100103>你过一段时间再来找我吧。
135,TEXT_CTSERKEUREKA3KRILE1_00512_SYSTEM_000_611,想要推进下一阶段的剧情，<hex:02100103>需要将元素等级提升到50级。
136,TEXT_CTSERKEUREKA3KRILE1_00512_KRILE_000_620,……好了，咱们重新确认一下现状。<hex:02100103>首先，为了对抗被封印在总部塔的创神优雷卡，<hex:02100103>我们调查了“让流向逆转”的方法。
137,TEXT_CTSERKEUREKA3KRILE1_00512_KRILE_000_621,结果就是了解到了那是利用地脉和以太之光施展的封印……<hex:02100103>也就是将蛮神的以太流向地脉，从而使其消灭的术式，<hex:02100103>但是原型以太之光遭到破坏，术式彻底消散了。
138,TEXT_CTSERKEUREKA3KRILE1_00512_KRILE_000_622,失去了封印术，创神优雷卡即将完全复活。<hex:02100103>正常来说，由于现代不存在古代蛮神的信徒，<hex:02100103>所以处理方式只要选择讨伐即可，不会有重新被召唤出来的风险。
139,TEXT_CTSERKEUREKA3KRILE1_00512_KRILE_000_623,可爷爷他们选的却是更为繁琐的封印……<hex:02100103>我想一定有什么原因导致这一蛮神是无法单靠蛮力消灭的。
140,TEXT_CTSERKEUREKA3KRILE1_00512_KRILE_000_624,这种情况下我们首先会考虑重新构筑损坏的术式，<hex:02100103>但作为基点的原型以太之光却处于没法修理的状态。<hex:02100103>我们的路可以说是已经完全被封死了呢。
141,TEXT_CTSERKEUREKA3KRILE1_00512_KRILE_000_625,不过无论形势多么不利，<hex:02100103>你肯定都不会眼睁睁看着创神优雷卡完全复活，对不对？
