25,本人是黑涡团正漩士卡·拉芙敏。<hex:02100103>负责发行军队理符。,如果有执行过行会理符经验的人，<hex:02100103>我倒可以把手中的任务派给他……<hex:02100103>但必须要向黑涡军令部申请派兵！,<hex:022903EB0203><hex:020831E1E93501FF29><hex:020825E3E93580FF1D><hex:022819FF14>GCRankLimsaMaleText<hex:E9350103><hex:FF01><hex:03><hex:FF01><hex:03><hex:020834E1E93601FF2C><hex:020828E3E93680FF20><hex:02281CFF17>GCRankGridaniaMaleText<hex:E9360103><hex:FF01><hex:03><hex:FF01><hex:03><hex:020831E1E93701FF29><hex:020825E3E93780FF1D><hex:022819FF14>GCRankUldahMaleText<hex:E9370103><hex:FF01><hex:03><hex:FF01><hex:03>，祝你旗开得胜！,如果有执行过行会理符经验的人，<hex:02100103>我倒可以把手中的任务派给他……<hex:02100103>但必须要向黑涡军令部申请派兵！,确认任务已完成！<hex:02100103>按照规定，支付<hex:022903EB0203><hex:020831E1E93501FF29><hex:020825E3E93580FF1D><hex:022819FF14>GCRankLimsaMaleText<hex:E9350103><hex:FF01><hex:03><hex:FF01><hex:03><hex:020834E1E93601FF2C><hex:020828E3E93680FF20><hex:02281CFF17>GCRankGridaniaMaleText<hex:E9360103><hex:FF01><hex:03><hex:FF01><hex:03><hex:020831E1E93701FF29><hex:020825E3E93780FF1D><hex:022819FF14>GCRankUldahMaleText<hex:E9370103><hex:FF01><hex:03><hex:FF01><hex:03>相应军票！,本人是军队理符任务发行人。<hex:02100103>请你在加入任意大国防联军之后再来。,虽然可以将此任务交给有相应实力的人去做……<hex:02100103>但军衔至少要在士官以上……,0
26,在下隶属于双蛇党黄蛇队。<hex:02100103>负责在此管理军队理符。,如果有执行过行会理符经验的人，<hex:02100103>我倒可以把任务派给他……<hex:02100103>但必须要向蛇巢司令部申请增员！,<hex:022903EB0203><hex:020831E1E93501FF29><hex:020825E3E93580FF1D><hex:022819FF14>GCRankLimsaMaleText<hex:E9350103><hex:FF01><hex:03><hex:FF01><hex:03><hex:020834E1E93601FF2C><hex:020828E3E93680FF20><hex:02281CFF17>GCRankGridaniaMaleText<hex:E9360103><hex:FF01><hex:03><hex:FF01><hex:03><hex:020831E1E93701FF29><hex:020825E3E93780FF1D><hex:022819FF14>GCRankUldahMaleText<hex:E9370103><hex:FF01><hex:03><hex:FF01><hex:03>，愿诺菲卡女神保佑你……,如果有执行过行会理符经验的人，<hex:02100103>我倒可以把任务派给他……<hex:02100103>但必须要向蛇巢司令部申请增员！,任务达成，辛苦你了！<hex:02100103>按照规定，支付<hex:022903EB0203><hex:020831E1E93501FF29><hex:020825E3E93580FF1D><hex:022819FF14>GCRankLimsaMaleText<hex:E9350103><hex:FF01><hex:03><hex:FF01><hex:03><hex:020834E1E93601FF2C><hex:020828E3E93680FF20><hex:02281CFF17>GCRankGridaniaMaleText<hex:E9360103><hex:FF01><hex:03><hex:FF01><hex:03><hex:020831E1E93701FF29><hex:020825E3E93780FF1D><hex:022819FF14>GCRankUldahMaleText<hex:E9370103><hex:FF01><hex:03><hex:FF01><hex:03>相应军票！,在下负责在此管理军队理符，<hex:02100103>向任意大国防联军成员发布特殊任务。,0,0
27,在下隶属于双蛇党黄蛇队。<hex:02100103>负责在此管理军队理符。,如果有执行过行会理符经验的人，<hex:02100103>我倒可以把任务派给他……<hex:02100103>但必须要向蛇巢司令部申请增员！,<hex:022903EB0203><hex:020831E1E93501FF29><hex:020825E3E93580FF1D><hex:022819FF14>GCRankLimsaMaleText<hex:E9350103><hex:FF01><hex:03><hex:FF01><hex:03><hex:020834E1E93601FF2C><hex:020828E3E93680FF20><hex:02281CFF17>GCRankGridaniaMaleText<hex:E9360103><hex:FF01><hex:03><hex:FF01><hex:03><hex:020831E1E93701FF29><hex:020825E3E93780FF1D><hex:022819FF14>GCRankUldahMaleText<hex:E9370103><hex:FF01><hex:03><hex:FF01><hex:03>，愿诺菲卡女神保佑你……,如果有执行过行会理符经验的人，<hex:02100103>我倒可以把任务派给他……<hex:02100103>但必须要向蛇巢司令部申请增员！,任务达成，辛苦你了！<hex:02100103>按照规定，支付<hex:022903EB0203><hex:020831E1E93501FF29><hex:020825E3E93580FF1D><hex:022819FF14>GCRankLimsaMaleText<hex:E9350103><hex:FF01><hex:03><hex:FF01><hex:03><hex:020834E1E93601FF2C><hex:020828E3E93680FF20><hex:02281CFF17>GCRankGridaniaMaleText<hex:E9360103><hex:FF01><hex:03><hex:FF01><hex:03><hex:020831E1E93701FF29><hex:020825E3E93780FF1D><hex:022819FF14>GCRankUldahMaleText<hex:E9370103><hex:FF01><hex:03><hex:FF01><hex:03>相应军票！,在下负责在此管理军队理符，<hex:02100103>向任意大国防联军成员发布特殊任务。,虽然可以将此任务交给有相应实力的人去做……<hex:02100103>但军衔至少要在士官以上……,0
28,我是恒辉队的琪琪丽正耀士！<hex:02100103>在此发行军队理符任务！,有执行过行会理符任务的经验是很好……<hex:02100103>不过需要和恒辉作战总部取得交涉才行。,<hex:022903EB0203><hex:020831E1E93501FF29><hex:020825E3E93580FF1D><hex:022819FF14>GCRankLimsaMaleText<hex:E9350103><hex:FF01><hex:03><hex:FF01><hex:03><hex:020834E1E93601FF2C><hex:020828E3E93680FF20><hex:02281CFF17>GCRankGridaniaMaleText<hex:E9360103><hex:FF01><hex:03><hex:FF01><hex:03><hex:020831E1E93701FF29><hex:020825E3E93780FF1D><hex:022819FF14>GCRankUldahMaleText<hex:E9370103><hex:FF01><hex:03><hex:FF01><hex:03>，愿水晶给予你指引！,有执行过行会理符任务的经验是很好……<hex:02100103>不过需要和恒辉作战总部取得交涉才行。,确认任务已完成！<hex:02100103>按照规定，支付你相应军票！,我在此发行恒辉队的军队理符！<hex:02100103>请你在加入任意大国防联军之后再来领取任务！,0,0
29,我是恒辉队的布露·海灵正耀士！<hex:02100103>在此发行军队理符任务！,有执行过行会理符任务的经验是很好……<hex:02100103>不过需要和恒辉作战总部取得交涉才行。,<hex:022903EB0203><hex:020831E1E93501FF29><hex:020825E3E93580FF1D><hex:022819FF14>GCRankLimsaMaleText<hex:E9350103><hex:FF01><hex:03><hex:FF01><hex:03><hex:020834E1E93601FF2C><hex:020828E3E93680FF20><hex:02281CFF17>GCRankGridaniaMaleText<hex:E9360103><hex:FF01><hex:03><hex:FF01><hex:03><hex:020831E1E93701FF29><hex:020825E3E93780FF1D><hex:022819FF14>GCRankUldahMaleText<hex:E9370103><hex:FF01><hex:03><hex:FF01><hex:03>，愿水晶给予你指引！,有执行过行会理符任务的经验是很好……<hex:02100103>不过需要和恒辉作战总部取得交涉才行。,确认任务已完成！<hex:02100103>按照规定，支付你相应军票！,我在此发行恒辉队的军队理符！<hex:02100103>请你在加入任意大国防联军之后再来领取任务！,能胜任此任务是很好……<hex:02100103>不过军衔至少要在士官以上才可以领取……,0
30,在下隶属于双蛇党黄蛇队。<hex:02100103>基于与伊修加德签订的协议，<hex:02100103>负责在此占星台发行军队理符。,在下管理的任务都十分棘手……<hex:02100103>所以至少要是执行过行会理符的人才能领取……,<hex:022903EB0203><hex:020831E1E93501FF29><hex:020825E3E93580FF1D><hex:022819FF14>GCRankLimsaMaleText<hex:E9350103><hex:FF01><hex:03><hex:FF01><hex:03><hex:020834E1E93601FF2C><hex:020828E3E93680FF20><hex:02281CFF17>GCRankGridaniaMaleText<hex:E9360103><hex:FF01><hex:03><hex:FF01><hex:03><hex:020831E1E93701FF29><hex:020825E3E93780FF1D><hex:022819FF14>GCRankUldahMaleText<hex:E9370103><hex:FF01><hex:03><hex:FF01><hex:03>，愿诺菲卡女神保佑你！,在下管理的任务都十分棘手……<hex:02100103>所以必须要由有相应实力的兵将来完成。,确认任务完成，现在将<hex:022903EB0203><hex:020831E1E93501FF29><hex:020825E3E93580FF1D><hex:022819FF14>GCRankLimsaMaleText<hex:E9350103><hex:FF01><hex:03><hex:FF01><hex:03><hex:020834E1E93601FF2C><hex:020828E3E93680FF20><hex:02281CFF17>GCRankGridaniaMaleText<hex:E9360103><hex:FF01><hex:03><hex:FF01><hex:03><hex:020831E1E93701FF29><hex:020825E3E93780FF1D><hex:022819FF14>GCRankUldahMaleText<hex:E9370103><hex:FF01><hex:03><hex:FF01><hex:03>的任务解除。<hex:02100103>辛苦你了，这是支付给你的军票。,在下隶属于双蛇党黄蛇队。<hex:02100103>向各国大国防联军成员发放特殊任务。,在下管理的任务都十分棘手……<hex:02100103>所以军衔至少要在士官以上才可以领取……,0
31,我是双蛇党黄蛇队的洛蒂耶牙士长。<hex:02100103>基于与伊修加德签订的协议，<hex:02100103>在库尔札斯发行军队理符。,白云崖前哨一带的任务大多比想象中要棘手。<hex:02100103>所以至少要是执行过行会理符的人才能领取……,<hex:022903EB0203><hex:020831E1E93501FF29><hex:020825E3E93580FF1D><hex:022819FF14>GCRankLimsaMaleText<hex:E9350103><hex:FF01><hex:03><hex:FF01><hex:03><hex:020834E1E93601FF2C><hex:020828E3E93680FF20><hex:02281CFF17>GCRankGridaniaMaleText<hex:E9360103><hex:FF01><hex:03><hex:FF01><hex:03><hex:020831E1E93701FF29><hex:020825E3E93780FF1D><hex:022819FF14>GCRankUldahMaleText<hex:E9370103><hex:FF01><hex:03><hex:FF01><hex:03>，愿诺菲卡女神保佑你！,白云崖前哨一带的任务大多比想象中要棘手。<hex:02100103>所以必须要由有相应实力的兵将来完成。,确认任务完成。<hex:02100103>辛苦你了，<hex:022903EB0203><hex:020831E1E93501FF29><hex:020825E3E93580FF1D><hex:022819FF14>GCRankLimsaMaleText<hex:E9350103><hex:FF01><hex:03><hex:FF01><hex:03><hex:020834E1E93601FF2C><hex:020828E3E93680FF20><hex:02281CFF17>GCRankGridaniaMaleText<hex:E9360103><hex:FF01><hex:03><hex:FF01><hex:03><hex:020831E1E93701FF29><hex:020825E3E93780FF1D><hex:022819FF14>GCRankUldahMaleText<hex:E9370103><hex:FF01><hex:03><hex:FF01><hex:03>。<hex:02100103>按照规定，支付给你相应的军票。,你是冒险者吧？<hex:02100103>你需要加入任意大国防联军后，<hex:02100103>才能领取我们所管理的任务。,白云崖前哨一带的任务大多比想象中要棘手。<hex:02100103>所以军衔至少要在士官以上才可以领取……,0
32,我是隶属于恒辉队的艾伊德哈特耀士长！<hex:02100103>负责管理摩杜纳地区的军队理符！,摩杜纳地区的任务都比较棘手！<hex:02100103>必须是有行会理符执行经验的人才能领取！,<hex:022903EB0203><hex:020831E1E93501FF29><hex:020825E3E93580FF1D><hex:022819FF14>GCRankLimsaMaleText<hex:E9350103><hex:FF01><hex:03><hex:FF01><hex:03><hex:020834E1E93601FF2C><hex:020828E3E93680FF20><hex:02281CFF17>GCRankGridaniaMaleText<hex:E9360103><hex:FF01><hex:03><hex:FF01><hex:03><hex:020831E1E93701FF29><hex:020825E3E93780FF1D><hex:022819FF14>GCRankUldahMaleText<hex:E9370103><hex:FF01><hex:03><hex:FF01><hex:03>，祝你旗开得胜！,摩杜纳地区的任务都比较棘手！<hex:02100103>没有实力的人会必死无疑！,确认<hex:022903EB0203><hex:020831E1E93501FF29><hex:020825E3E93580FF1D><hex:022819FF14>GCRankLimsaMaleText<hex:E9350103><hex:FF01><hex:03><hex:FF01><hex:03><hex:020834E1E93601FF2C><hex:020828E3E93680FF20><hex:02281CFF17>GCRankGridaniaMaleText<hex:E9360103><hex:FF01><hex:03><hex:FF01><hex:03><hex:020831E1E93701FF29><hex:020825E3E93780FF1D><hex:022819FF14>GCRankUldahMaleText<hex:E9370103><hex:FF01><hex:03><hex:FF01><hex:03>已返回！<hex:02100103>按照规定，支付给你相应军票！<hex:02100103>辛苦你了！,在下负责发行军队理符！<hex:02100103>加入任意大国防联军后才可领取任务！,摩杜纳地区的任务都比较棘手！<hex:02100103>所以军衔至少要在士官长以上才可以领取！,0
33,我们基于总骑士长的提案在这里发行神殿骑士团理符。,有一定能力并且值得信赖的人才可以从这里领取理符任务……,我在这等你平安归来。<hex:02100103>愿战神哈罗妮保佑你！<hex:02100103>,有一定能力并且值得信赖的人才可以从这里领取理符任务……,你的任务完成了！<hex:02100103>感谢你对皇都做出的贡献，这是你的报酬。,0,0,你竟然解决了悬赏魔物？<hex:02100103>这可得给你加算报酬才行。
34,为了扩大冒险者行会的活动范围，<hex:02100103>我们按照总部的指示在这里开设了黄金港窗口。<hex:02100103>欢迎有意的冒险者前来帮忙！,有没有身具工匠技艺的冒险者啊……,手头的委托做得还顺利吗？<hex:02100103>我相信你一定没问题的……是吧？,有没有身具工匠技艺的冒险者啊……,很好，你已经完成了委托。<hex:02100103>久等了，这是给你的报酬！,0,0,0
35,我这里负责将中庸工艺馆接到的大量委托<hex:02100103>以理符的形式发放给注册的工匠们。<hex:02100103>你要不要也来领取一个理符试试？,有没有对理符感兴趣的工匠出现呢……,交给你的工作怎么样了？<hex:02100103>记得好好完成啊！,有没有对理符感兴趣的工匠出现呢……,你漂亮地完成了工作呀！<hex:02100103>给你，这是报酬！,0,0,0
36,一般那些委托给拾穗人总会的工作，<hex:02100103>我们都会以理符的形式发布出去，介绍给登记在册工匠会员处理。<hex:02100103>你怎么样，有看中合适的任务吗？,工作越堆越多。<hex:02100103>要是能多几个愿意加入我们会员的工匠就好了……,你好呀，工作做的怎么样了？<hex:02100103>搞定了之后可别忘了去边上交货啊。,工作越堆越多。<hex:02100103>要是能多几个愿意加入我们会员的工匠就好了……,你好呀，工作都完成啦！<hex:02100103>久等了，这些是给你的报酬，快收下吧！,0,0,0
37,我这里负责将广大国民提交的委托以理符形式发放给有能力的工匠。<hex:02100103>如何，要来一个吗？,现在人手完全不够用……<hex:02100103>就算是刚来到王都的工匠也行啊……<hex:02100103>只要能力达标就能帮上忙了……,0,现在人手完全不够用……<hex:02100103>就算是刚来到王都的工匠也行啊……<hex:02100103>只要能力达标就能帮上忙了……,你顺利完成工作了呀！<hex:02100103>那么、那么，给你报酬！,0,0,0
